intermediate	on the top of a hill, looking down on northumberland’s beautiful kielder water reservoir, a group of people wait in a car park next to a strange wooden building. they are looking for darkness and this is kielder observatory, the centre of britain’s latest industry – astrotourism. the people waiting outside are the lucky ones. many more apply for a night of stargazing at the observatory but numbers are strictly limited.inside, under a dim light, the observatory’s founder and lead astronomer, gary fildes, delivers a speech to his colleagues and volunteers. the team discusses the prospect of seeing the northern lights but fildes is doubtful. instead, they decide to use their powerful telescopes to observe jupiter and venus and, later, to pick out stars such as capella and betelgeuse. an additional attraction is the appearance of the international space station.fildes, 49, is at the forefront of the uk’s growing astrotourism industry. the key moment for northumberland came in 2013 when the entire national park, about 1,500 square kilometres in area, was awarded dark sky park status, the only one in england. dark sky parks are rare. the 2013 star count revealed that only 5% of the uk population can see more than 31 stars on a clear night.the arizona-based international dark-sky association (ida) awards the status of dark sky park only to places that take major steps to avoid light pollution. and those areas must also prove their night skies are dark enough. in northumberland dark sky park, as the area was renamed, it is so dark that venus casts a shadow on the earth.duncan wise, visitor development officer for the northumberland national park authority, helped to lead the campaign for dark-sky status. “we tend to look at landscape as everything up to the horizon,” wise said. “but what about what’s above it?” wise and others spent years preparing their application to the ida, collecting thousands of light readings and producing an exterior lighting master plan that influences the construction of new developments in the area.their efforts have been rewarded. many of the 1.5 million who visit northumberland each year are now aware of its dark sky status. “we get a lot of people coming here to see the sky now,” says the man at the car-hire firm in newcastle. “they come in autumn and winter, when it’s darkest. it’s good for the local hotels because they get business all year round now.” local hotels now give guests night-vision torches and put out deckchairs at night.wise agrees that northumberland needs to do more to take advantage of its scarce resource. he believes the region needs a couple more observatories to ensure that visitors will see what they came for. a new £14m national landscape discovery centre will have an observatory when it is completed in a couple of years.fildes has big ambitions. he is planning britain’s first “astrovillage”, one that would contain the largest public observatory in the world and have a 100-seat auditorium, a 100-seat planetarium, a one-metre aperture telescope, and radiomagnetic and solar telescopes. the multimillion-pound project would also have a hotel and draw in 100,000 people a year, four times the number currently able to use the observatory. fildes believes the astrovillage will be a reality by 2018.however, northumberland has competition. galloway forest park in scotland also has dark sky park status. since exmoor was designated europe’s first international dark sky reserve – one level below dark sky park – in 2011, a range of local businesses offering stargazing breaks and safaris has sprung up. the uk has a long way to go to rival northern chile, which has more than a dozen tourist observatories and some of the clearest skies in the world. the teide national park in tenerife is also becoming a major astrotourism destination.so, why do people want to look up into the night sky? the media have helped. tv presenters like brian cox have attracted a new generation of stargazers. “brian cox has made astronomy accessible,” says wise. “it’s no longer seen as something just for professors with telescopes.” technology has also made astronomy more popular. apps such as stellarium now turn smartphones into pocket-size planetariums. but fildes believes that, most importantly, people are starting to appreciate what lies above. “if you had to build a visitor attraction from scratch, what could be better than the universe?”nan
intermediate	will we soon live in a world where drones deliver packages? if you believe amazon, the answer is òyesó. others are not so sure: we need to make more technical progress in this area but there is also the problem of public safety.amazon spokesman paul misener told a us congress hearing recently that his company would be ready as soon as all the rules were in place. the federal aviation authority (faa) will  nally have regulations on the commercial use of unmanned aircraft by june 2016. but the technology has a long way to go before then and larger machines arenõt legal yet ð only drones up to 25kg will be legal. and the faa says that, if youõre going to crowd the skies with radio- controlled  ying robots, they must all use different radio frequencies that nobody can jam or hijack.professor sajiv singh, who runs a cargo delivery company called nearearth, said that, to pilot a state-of-the-art drone, you simply give it some basic instructions: go to this altitude, perform this short task, go back home. but even short  ights from a mobile landing pad could cause serious logistical problems, he said.òtheyõre not going to deliver from one uninhabited place to another uninhabited place; theyõre going to deliver from a warehouse to the consumer, which will probably be an urban area or a suburban area,ó he said. òin those particular cases, there are going to be hazards that the vehicle is going to have to see. maybe there will be terrain that the map doesnõt know about. then, maybe thereõs construction equipment that wasnõt there before but is there now. maybe gps signals are blocked, in which case itõs going to have an incorrect idea about where it is.ó all these problems can be solved, he said ð but itõs dif cult.one major problem is maintaining radio contact with a drone and planning for what happens if that contact breaks. òif you have an off-the-shelf uav [unmanned aerial vehicle], itõll just keep going and crash into the ground,ó said roboticist daniel huber.furthermore, òyou canõt do everything with a 25kg aircraftó, said jay mcconville, director of business development for unmanned systems at lockheed martin. òpeople in the aircraft business have to remind ourselves that the operator doesnõt really care about every little thing about the aircraft and wants instead to focus on the end result,ó he said. òoperators want to see vehicle status information; they want to see video on their handheld device or their laptop.óòtechnologically, most of the things that we need for this are in place,ó said huber. he is working on a program to allow drones to inspect infrastructure ð pipelines, telephone lines, bridges and so on. òweõve developed an exploration algorithm where you draw a box around an area and it will  y around that area and look at every surface and then report back.óhuber, who works on 3d systems imagery, said about amazon: òi have heard them say that many packages are lightweight ð a drone can carry a kilogram for 15 minutes. if you have a vehicle that can go into a neighbourhood, it can deliver from that base. you need a 15-minute distance and typical off-the-shelf drones have that distance.ó itõs one way, he said, of making sure the surrounding population is relatively safe. òthe larger you get, the more dangerous you get.óproblems with the use of drones can be solved in some very dramatic ways, huber said. at a recent conference, he said, a disaster relief drone company demonstrated a robot that could take off and, when it got tired, land on its own charging station and exchange its batteries.of course, safety is still a major concern ð singh says that, for a commercial aircraft to be allowed to  y, it has to prove a rate of one serious failure every one million hours. drones, he said, are a long way from that. òthe reaper drone has one failure in 10,000 hours,ó singh said. but they donõt consider an oil leak a catastrophic failure ð something has to fall out of the sky.part of the reason for this is that air travel is dangerous so standards are much higher. òif you  y commercial airlines, they often say, ôoh, a component has failed ð we have to go back to the gate,õó singh said. òand thatõs an established industry with 60 years of legacy! i hate to think that a drone might come down on a busy road.ó part of the solution, singh said, is planning for every situation: òif things fail, the vehicle has to do something reasonable.ónan
intermediate	from all across rwanda, and even parts of neighbouring burundi, people are coming to the southern town of butare to a little shop called inzozi nziza (sweet dreams). they come for a taste of the unknown, something most have never tasted before ð sweet, cold ice cream.here, at the central african countryõs  rst ice- cream parlour, customers can buy scoops in sweet cream, passion fruit, strawberry and pineapple  avours. toppings include fresh fruit, honey, chocolate chips and granola. black tea and coffee are also on sale.the shop, which has òice cream, coffee, dreamsó written on its signs, is taking advantage of local curiosity about the dessert ð and òchanging livesó in the process, says inzozi nzizaõs manager, louise ingabire.òice cream is important,ó she says between mouthfuls of a honey- avoured offering. òsome rwandans like ice cream, but itõs a new thing. we still have some work to do, to tell others that theyõll enjoy it.óthe shop can certainly make dreams come true. òi didnõt have a job before: i just stayed at home. now, i have a vision for the future. i am making money and i can give some of it to my family,ó says the 27-year-old.butare, which has 89,600 residents and is located 135km south of the capital, kigali, is the home of the national university of rwanda. inzozi nziza has become a meeting place for tired students looking to treat themselves to something cool and different.òitõs something uniting people here,ó kalisa migendo, a 24-year-old agriculture student, says. òif you need to go out and talk to a friend, a girl or a boy, you come to inzozi nziza for an ice cream.ómost of the ingredients are from local sources and the milk comes from nearby nyanza. the vanilla beans and cocoa are imported.inzozi nziza was opened by the theatre director odile gakire katese. she met alexis miesen and jennie dundas, co-founders of blue marble ice cream in brooklyn, new york, and formed a partnership to open the shop in 2010.òan ice-cream shop, katese said, might help to put the human pieces back together by rebuilding spirits, hopes and family traditions,ó miesen says.at the start, miesen and dundas owned the shop in partnership with its staff and had shares in the business, which is a cooperative and non-pro t. after 18 months, they transferred their shares to the women, who had by then proved they could run the business.ice cream is new to rwanda. making the business successful requires a lot of skills and changing peopleõs way of thinking because selling and eating ice cream is not part of rwandan culture.the butare shop employs nine women, who spend their spare time practising with ingoma nshya, rwandaõs  rst and only female drumming group, which was established by katese ten years ago.the musicians are hutu and tutsi women. some are survivors of the 1994 genocide, during which almost a million tutsis and hutus were killed. some members of ingoma nshya are widows, some orphans.historically, says ingabire, rwandan women were forbidden to drum and many people considered the drums too heavy for women to carry. òbut itõs something which brings unity.óingabireõs father, two siblings and many cousins were killed in the genocide. òwhen iõm drumming, it gives me power because weõre still alive and survivors,ó she says.the ice-cream parlour is in a documentary by  lm-makers rob and lisa fruchtman. sweet dreams, which tells the story of how the women have made a promising post-genocide future, also includes the female drummers.the  lm has been shown in more than a dozen countries, including the us, uk and several african states. òwe feel the  lm is about resilience, hope, bravery, resourcefulness and the ability to change the course of your own life,ó says lisa fruchtman.nannan
intermediate	they call him the robin hood of the banks, a man who took out many loans worth almost half a million euros with no intention of ever paying them back. instead, enric duran gave the money to projects that created and promoted alternatives to capitalism.after 14 months in hiding, duran is unapologetic, even though his activities could put him in jail. òiõm proud of what i did,ó he said in an interview by skype from a secret location.from 2006 to 2008, duran took out 68 commercial and personal loans from 39 banks in spain. he gave the money to social activists, who used it to pay for speaking tours against capitalism and tv cameras for a media network. he said he saw that these social movements were building alternatives but that they didnõt have enough money. òmeanwhile, constant growth was creating a system that created money out of nothing.óthe loans he swindled from banks were his way of regulating and denouncing this situation, he said. he started slowly. òi  lled out a few credit applications with my real details. they said no, but i just wanted to understand what they were asking for.ófrom there, the former table-tennis coach began to set up a confusing web of accounts, payments and transfers. òi was learning constantly.ó by the summer of 2007, he had discovered how to make the system work ð he applied for loans under the name of a false television production company. òthen, i managed to get a lot.ó û492,000, to be exact.duran was arrested in spain in 2009, on charges brought against him by six of the 39 banks that had lent him money. he spent two months in prison before being let out on û50,000 bail. in february 2013, threatened with up to eight years in prison, he decided to  ee rather than stand trial because, he said, he doesnõt recognize the authority of the judicial system.his actions, he said, were an important part of a worldwide debate on the economic crisis. the timing pushed the anti-capitalist movement into the light, just as many spaniards were looking for alternatives to a system that has caused chaos in their lives. in todayõs spain, the anti-capitalist movement, and groups such as the indignados, are supported by thousands of spaniards.duran is now widening his focus to include spainõs justice system, by promoting restorative justice. òthe people in spain who believe that banks donõt work, they think that i donõt owe anything. iõve already done my work,ó he said. òbut there is a part of a population that is not in agreement with us and i think i should respond to that.óin his case, he said, he could offer banks the insight he got from years of obtaining bank loans fraudulently. he could share his thoughts on òwhich best practices work and the bad ones that donõt,ó he suggested, òfor the general population and for bank workersó.
intermediate	a canadian man who became famous because he offered a free round-the-world trip to a woman with the same name as his ex-girlfriend has returned from the trip with his chosen namesake. unfortunately, to the disappointment of those following the story, the two of them did not fall in love. jordan axani, a 28-year-old toronto charity founder, arrived back in canada with elizabeth quinn gallagher and said the pair had “a brother-sister-like relationship”.axani had made headlines in 2014 because he offered an air ticket to any canadian named elizabeth gallagher. he had booked a three-week vacation with his girlfriend but they split up and he was unable to change the name on the flight tickets.that’s where axani’s new travelling companion, a 23-year-old student from cole harbour, nova scotia, enters the story. elizabeth gallagher, who calls herself quinn, replied to an online posting from axani and she was chosen. gallagher explained before the trip that she had a “pretty serious” boyfriend. but that had not stopped journalists from hoping the globetrotters might fall for one another. unfortunately, it did not happen.“i’m going to be very clear,” axani said, soon after the pair returned to toronto. “this was never a romantic endeavour. it was strictly platonic. i do not think of quinn in a romantic way at all. there is no future for us romantically. she is a good friend. i think of her as a little sister and that is it. and our feelings are entirely mutual.”it took work to create that brother-sister, good-friend relationship, however. “it wasn’t easy and it certainly wasn’t immediate. it took us about a week to really figure each other out,” axani said. there was a certain amount of stumbling around as the pair got to know each other “about the dos and don’ts of travelling together. at the end of it, we’d developed a really great rhythm – one second, we had really funny inside jokes and, the next second, we knew when the other person needed space.”although the pair did not fall in love, axani said the trip, which included milan, venice, vienna, prague, khao lak (in thailand) and hong kong, was “fantastic”. a favourite place was prague, axani said, where they met more people than anywhere else on the trip.“over the course of two and a half days i think we met about two dozen people. so that’s a lot of stories, that’s a lot of individuals and that’s a lot of love for their home city of prague.”people were following the pair on twitter and instagram, axani said, and they were even recognized in the street in hong kong. “it was a real adventure. we had a blast. we learned a lot about ourselves and about each other. i can’t imagine it going much better than it did.”axani arrived back in toronto at 3am and went straight into a meeting at his charity, a ticket forward. axani started the non-profit organization after his internet post went viral. he wants to offer round-the-world-trips to survivors of abuse, cancer and war.apart from that, axani is also discussing making his story into a television show or film, he said. but he would not comment on what form those productions might take. “i’ll only say that there’s been lots of interest from many production companies. we’re well advanced.” in terms of his love life, axani said he was not looking for his next elizabeth gallagher yet. “i’m not looking for anything but life happens and we’ll see,” he said. “as always, life’s a journey.”
intermediate	behind the bright lights and mirrored panels, cameras are watching you. if you pick up a boot, a camera will make sure you donõt put it into your bag. enter a department store and you will be watched. but new technology is less focused on shoplifting and more interested in your age, sex and shopping habits.a few months ago, it company computer sciences corporation (csc) wrote a report that said around 30% of stores use facial recognition technology to track customers in-store. facial recognition is a technology that can identify people by analysing and comparing facial features from a database. it uses devices such as intel realsense cameras, which are able to analyse everything from particular expressions to the clothing brands someone is wearing.intel spokesman joe jensen says that the aim of using realsense technology in shops is not to create databases of speci c peopleõs lives but to build generalized models of peopleõs lifestyles and shopping habits. òwe donõt need to know a particular customer. we need to know that this shopper has these characteristics and that, when those characteristics are present, this is what a person tends to do.óif you combine recognition technology with databases of previous customer patterns, you can start to predict a lot about what a person may or may not do in a shop. if, for example, thereõs a woman walking quickly towards the sock section, you can use that data to predict she wants to buy socks. that could allow a store to automatically put targeted ads on screens aimed speci cally at that person. if she looks like the type of person who wants to buy socks, they will show her adverts for socks.if it sounds familiar, itõs because the online world has been using techniques like these for years. if you search for something on amazon, youõll get targeted ads for similar products on other sites. but itõs not easy to bring these systems into the physical world. people do not react to cameras in the same way as they do to browser cookies.hoxton analytics, a team of data scientists in london, has developed a technology that uses machine learning and arti cial intelligence to categorize people based on the shoes they are wearing. by analysing the style and size of peopleõs footwear as they walk past the sensor, the system can identify a customerõs gender with 75-80% accuracy.owen mccormack, hoxton analytics ceo, says that the focus of the system was partly a reaction to facial recognition. òmy idea was, why donõt we simply consider the clothes someoneõs wearing?ó he said. òif i just showed you a photo of someoneõs body, you could probably tell me what gender they are. however, pointing a camera at someoneõs chest or hips feels just as creepy as facial recognition. the idea was ð what about peopleõs shoes?ópeople use the word òcreepyó a lot during discussions of in-store tracking. for stores and data scientists, the aim is to  nd a way of getting information without seeming intrusive.for mccormack, the argument is based on the fact that personal information isnõt collected. òright now, shops are doing lots of incredibly invasive things but we just donõt know about it. what we say is that, if you know someoneõs a male or a female, then your advertising will be much more ef cient. if you know that everyone in your shop right now is a male, youõll be advertising playstations not hairdryers.ófrom the perspective of stores, itõs understandable that physical shops want some of the information online shops collect. we allow this to happen online so why not of ine? online, you get a pop-up asking you to accept cookies. but you canõt ask for peopleõs consent in the same way when they move from one physical shop to another.but itõs also true that the generation that is growing up with online shopping does not see online advertising as so invasive. in the csc report, a survey showed that 72% of people aged 55 or more said they were very uncomfortable with these types of technologies in physical shops. but only 51% of 16-24 year olds said they were uncomfortable.are younger people more open because they are more familiar with digital technology or do they believe in the honesty of organizations offering free services? is this kind of technology always creepy or does it depend? in any case, there are a growing number of eyes between the shelves and they care a lot about what youõre wearing.nannan
