advanced	dame sally davies, the chief medical officer for england, has likened the problem of antibiotic resistance to the risks presented by international terrorism. while this might sound like an exaggeration, the threat was actually, if anything, understated. each year, the global number of deaths to which bacterial resistance contributes far outstrips those caused by terrorist attacks.while it is difficult to track the global impact of antibiotic resistance across all bacterial species, the world health organization estimates that for tuberculosis alone multi-drug resistance accounts for more than 150,000 deaths each year. antibiotic resistance is no longer an abstract risk: this is now a war.in the past hundred years, our expectations of life and survival have changed beyond all recognition. at the beginning of the twentieth century, life expectancy in the uk stood at around 47 years of age for a man and 50 for a woman, a number heavily affected by the very high rate of infant mortality in those days. around a third of all deaths occurred in children under the age of five, largely because of infectious disease.in contrast, a child born in britain today has a better than one in four chance of reaching their 100th birthday. for this we have public health systems, vaccination and antibiotics to thank. it is by these means – the prevention and treatment of illnesses caused by microorganisms – that the real war against disease is principally won.elsewhere, we have pushed the limits of survival, notably in intensive care. this, the specialism in which i chose to train, is where antibiotic resistant organisms are most prevalent. here, powerful antibiotics, essential in the treatment of life-threatening illness, are used routinely. these drugs decimate ordinary bacteria. but what they leave behind are hardy species that have begun to learn tricks that allow them to evade antibiotic drugs.as a newly qualified doctor in the late 1990s, i learnt about methicillin resistant staphylococcus aureus – the infamous mrsa – a bacterial species resistant to methicillin and all other penicillins. in the fight against it, there were a handful of exotic-sounding drugs – vancomycin and teicoplanin among them. these were supposed to be our last lines of defence, but antibiotic resistant bacteria became more and more common; as did species with new patterns of resistance. drugs we had previously barely heard of became commonplace. new last-line drugs emerged to replace the old. we got used to this state of affairs; a steady escalation in the arms race between us and the bacteria.but the balance has been shifting steadily. in our hospitals and our gp surgeries we have abused the drugs that gave us such a huge advantage over infectious disease, using them too often and too indiscriminately. and some of the worst abuses have occurred outside of healthcare, with antibiotics introduced into the food chain, through agriculture and the lacing of livestock feed with anti-bacterial drugs. we assumed that antibiotic therapy was an advantage we could enjoy forever. we became complacent that the pharmaceutical industry would continue to stay ahead of the game.but this is no longer the case. new, more resistant species have been identified. the vancomycin that we used to rely on to treat mrsa infection was defeated. vancomycin resistant staphylococcus aureus (vrsa) emerged in our hospitals. and other bacterial species were learning the same trick. enterobacteria, organisms usually found in the gut, had also acquired vancomycin resistance. today, infections with formidable, highly resistant organisms are commonplace and the pharmaceutical industry is not keeping pace. fewer and fewer new anti-microbial drugs are emerging from their production lines. it is becoming increasingly difficult to develop new drugs active against resistant strains. for every method of attack the pharmaceutical companies invent, bacteria rapidly evolve a defence. all of the simple approaches to the problem have been exhausted. antibiotics have become drugs that are expensive to develop, that are only used in short courses and that quickly become ineffective due to the evolution of bacterial resistance. consequently, the pharmaceutical industry’s incentive to manufacture new drugs that can fight them is low.almost as soon as antibiotic use became widespread in the 1940s, the first evidence of bacteria resistance to antimicrobial therapy emerged. initially, these were little more than curiosities. when they did infect patients, the numbers were so small that at first they were not enough to warrant much attention. but today, they have become a fact of medical life. less than a century after the discovery of penicillin, we are beginning to lose the fight.since the first mrsa deaths in otherwise healthy children in the us in 1998, the number of deaths from mrsa infection in the us each year has risen to tens of thousands – outstripping the number of deaths caused by aids. bacterial resistance in hospitals is everywhere you look. this is a war like no other. there needs to be cultural change in our prescribing behaviours and more restraint in the use of antibiotics in farming and agriculture. and somehow, the pharmaceutical companies have to be convinced to chase the development of these less profitable drugs.within my working lifetime, the pattern of antibiotic resistance in healthcare has transformed from a rare but notable event to a problem of epidemic proportion. if we are to avoid a return to the pre-antibiotic time with all its excess mortality, we must be bold. to squander the advantage we have so recently gained against microorganisms in the fight for life would be unthinkable.nannan
advanced	music subscription services, including spotify and deezer, have broken through the $1bn sales barrier worldwide, as increasing numbers of fans choose to pay for music online.streaming and subscription revenues rose by more than 50% in 2013 to reach $1.1bn, helping overall sales of recorded music in europe grow for the  rst time in 12 years, according to  gures published in march 2014.there are now an estimated 450 music-rental services around the world, and, while many people still listen for free, a desire for more choice is persuading more music lovers to part with their cash. in a three-year period, the number of paying subscribers rose from 8 million to 28 million, according to the 2014 digital music report from the international federation of the phonographic industry (ifpi).easily accessible from smartphones and tablets, subscription services are popular with people looking to try out new music without committing to buying a download or a cd. consumers say they are attracted by a cheap, user-friendly and legal alternative to pirated downloads. òit is now clear that music streaming and subscription is a mainstream model for our business,ó said ifpi chief executive, frances moore.the ifpi also said that one direction were the biggest-selling artists of 2013, with 4m physical and digital sales for their midnight memories album. katy perryõs prism was the best-selling album by a female artist, in sixth place behind eminem, justin timberlake, bruno mars and daft punk.consumer-technology companies have been racing to join the music-streaming trend, with apple launching itunes radio and google promoting its play store, with smaller players like beats music, created by the team behind the beats headphones brand, also joining the fray.there are signs that, in britain and america, streaming may soon generate more revenue for the music industry than downloads from online stores such as appleõs itunes. subscription services now account for a third of all digital sales globally, with downloads making up the balance, but the ifpi data shows that the two formats are growing at different rates.in the us, the percentage of people claiming to use subscription and streaming rose from 19% in 2012 to 23%, while the percentage of people downloading fell from 28% to 27%. in britain, downloaders remained static, at exactly one third, while subscribers grew from 19% to 22%. in sweden, france and italy, streaming is already more popular than downloading.digital formats now account for 39% of all music sales, or nearly £5.9bn out of £15bn, and, while sales of cds and vinyl declined steeply in 2013, they still contribute just over half the industryõs income. a recent crash in music sales in japan, which accounts for one  fth of music industry sales and where physical formats remained popular for longer than elsewhere, meant sales across all formats globally fell 3.9%.however, vinyl continued to make a comeback in some markets. sales increased by 32% in america and by 101% in the uk in 2013.
advanced	ever since he was diagnosed hiv positive, moses king, 48, has had one major problem. he has been able to cope with the stigma of being hiv positive – widespread in liberia – and he was able to access antiretroviral medication, provided by the global fund to fight aids, tuberculosis and malaria and distributed by the liberian government. but king and his family of six children could not get the right food to eat. a subsistence farmer, he grew vegetables and bought rice. but meat and fish – expensive, luxury products in liberian markets but essential sources of protein – remained elusive.“subsistence farming allowed us to survive, but we had so many problems,” said king. “we could not get any protein, and we were not getting the nutrients we needed to sustain ourselves.”pate k chon, a counsellor who works with hiv sufferers in liberia, provided an unlikely solution. since watching a documentary about a fish farm in thailand several years earlier, she had thought of setting up a similar project in liberia, enabling hiv sufferers to have work and also access a stable source of protein.“i saw this film about fish in a cement pool and i thought it was a good idea,” said chon, herself diagnosed with hiv in 1992. “so many of the people i work with don’t have the means to have a balanced protein diet and fish is such a clean source of protein – it doesn’t cause health problems like other sources, and it is something we can farm.”chon, founder of a faith-based ngo, began building a pool in which to farm fish. in june 2012, chon met john sheehy, a ‘strategic philanthropist’ and founder of consultancy emerging business lab, who raised money for the non-profit fish farm in the northeast of monrovia, liberia’s capital, and set about learning aquaculture, doing an online course through cornell university and speaking to other fish farmers in africa.“i raised the money and built the farm, learned the proper tank layout and water flow system,” said sheehy. “a lot of my knowledge was self-taught, and now i would love to be able to write a manual and share it with other people,” he added.the project has now grown into the grow2feed liberia fish farm, with 12 tanks, which, when fully stocked, will each have 5,000 fish – providing up to 200,000 fish per year, serving a community of 1,200 predominantly hiv-positive people, including king and his family.in addition to the fish, waste from the tanks is collected and used to irrigate crops, also providing food and income for the community, made up of 503 women, 206 men and 346 children.“the members of the community live near the farm, and have agreed to be part of the co-operative,” said sheehy. “many work on the farm, or tending the crops, and what they get in return – when the fish are fully grown after 90 days – is fish. they can use those fish to feed themselves and to sell in the market so that they get money to buy other staple items.“the fish farm gives these people with hiv a way of getting back into society – now they are bartering and trading with people in the market every week.”according to liberia’s demographic health survey, 1.5% of liberia’s 3.5 million people are hiv positive, with 60% of those women or girls. stigma and discrimination still surround the illness, and have led to around half of all cases in the country going untreated.good nutrition is particularly important for people with hiv. research has shown they need much higher levels of protein to prevent their health from deteriorating and to allow healthy growth. “nutrition is one of the key things if you are taking antiretroviral drugs,” said chon. “the drugs are toxic and, if you don’t have food to eat, they can make you very ill. but food in liberia is very expensive. we buy expensive imported rice, even though we should be growing it ourselves and fish is difficult for most people to afford.”sheehy says grow2feed is the first co-operative fish farm in liberia to operate for the benefit of an hiv-positive community. the project has attracted the interest of the liberian government, and the un food and agriculture organization, which has worked with grow2feed to provide training, will also support teaching at the university of liberia.fish farming experts say the practice has huge potential in africa.“fish farming is absolutely viable in africa,” said paul white, owner of the hydrofish fish farm in ivory coast, which produces 3,000 tonnes of fish each year. “a lot of the fish on the market comes from china and is imported frozen. it is of a quality that could never enter europe or america. there has been a serious lack of investment and a lack of know-how in fish production. it is all coming to the forefront now,” he added.some critics are sceptical of farmed fish, citing inbred fish and high levels of toxins. but sheehy said good practice mitigated these problems. “a lot of farmed fish is inbred, which does cause problems, but we are using a process with local fish sourced in liberia, not fish from another region,” said sheehy. “that means we can continue using local fish to bring in new broodstock. “and we are not using lakes that are cornered off, where the fish absorb all the toxins in the lake. we can control the environment using the tanks, and we test the water and monitor it constantly.sheehy hopes to replicate the model throughout liberia and the region. “a rice-growing co-op in sierra leone asked us if we could do this on our property so that they can feed their workers and we have had interest from nigeria and central america,” said sheehy. “but we operate 100% non-profit and we will never lose our social justice aspect.”
advanced	organic food has more of the antioxidant compounds linked to better health than regular food, and lower levels of toxic metals and pesticides, according to the most comprehensive scienti c analysis to date. the international team behind the work suggests that switching to organic fruit and vegetables could give the same bene ts as adding one or two portions of the recommended ô ve a dayõ.the team, led by professor carlo leifert at newcastle university, concludes that there are òstatistically signi cant, meaningfuló differences, with a range of antioxidants being òsubstantially higheró ð between 19% and 69% ð in organic food. it is the  rst study to demonstrate clear and wide-ranging differences between organic and conventional fruits, vegetables and cereals.the researchers say the increased levels of antioxidants are equivalent to òone to two of the  ve portions of fruits and vegetables recommended to be consumed daily and would therefore be signi cant and meaningful in terms of human nutrition, if information linking these compounds to the health bene ts associated with increased fruit, vegetable and wholegrain consumption is con rmedó.the  ndings will add to the controversy over organic food and whether it is better for people, with one expert saying that the  ndings were exaggerated. tom sanders, a professor of nutrition at kingõs college london, said the research did show some differences. òbut the question is are they within natural variation? and are they nutritionally relevant? i am not convinced.ó he said leifertõs work had caused controversy in the past. òleifert has had a lot of disagreements with a lot of people.ó sanders added the research showed organic cereals have less protein than conventional crops.the results of the research are based on an analysis of 343 peer-reviewed studies from around the world ð more than ever before ð which examine differences between organic and conventional fruit, vegetables and cereals. òthe crucially important thing about this research is that it shatters the myth that how we farm does not affect the quality of the food we eat,ó said helen browning, chief executive of the soil association, which campaigns for organic farming.plants produce many of their antioxidant compounds to  ght back against pest attacks, so the higher levels in organic crops may result from their lack of protection by chemical sprays. but, the scientists say other reasons may be important, such as organic varieties being bred for toughness and not being overfed with arti cial fertilizers.leifert and his colleagues conclude that many antioxidants òhave previously been linked to a reduced risk of chronic diseases, including cardiovascular diseases, neurodegenerative diseases and certain cancersó. but, they also note that no long-term studies showing health bene ts from a broad organic diet have yet been conducted. the researchers found much higher levels of cadmium, a toxic metal, in conventional crops. pesticide residues were found on conventional crops four times more often than on organic food. the research was funded by the eu and an organic farming charity.the research is certain to be criticized: the inclusion of so many studies in the analysis could mean poor-quality work skews the results, although the team did òsensitivity analysesó and found that excluding weaker work did not signi cantly change the outcome. also, the higher levels of cadmium and pesticides in conventional produce were still well below regulatory limits. but, the researchers say cadmium accumulates over time in the body and that some people may wish to avoid this, and that pesticide limits are set individually, not for the cocktail of chemicals used on crops.a further criticism is that the differences seen may result from different climates, soil types and crop varieties, and not from organic farming, though the researchers argue that combining many studies should average out these other differences. the greatest criticism, however, will be over the suggestions of potential health bene ts. the most recent major analysis, which took in 223 studies in 2012, found little evidence. òthe published literature lacks strong evidence that organic foods are signi cantly more nutritious than conventional foods,ó it found.this was also the conclusion of earlier, smaller studies published in 2009 in a scienti c journal and by the uk food standards agency, though the latter considered just 11 studies. the 2012 study did note that eating organic food might help people avoid pesticide residues. sanders said he was not persuaded by the new work. òyou are not going to be better nourished if you eat organic food,ó he said. òwhat is most important is what you eat, not whether itõs organic or conventional. itõs whether you eat fruit and vegetables at all. people are buying into a lifestyle system. they get an assurance it is not being grown with chemicals and is not grown by big business.óopinion polls show healthy eating (55%) and avoiding chemical residues (53%) are key reasons cited by shoppers for buying organic produce. but, many also say care for the environment (44%) and animal welfare (31%) are important, as is taste (35%). browning said: òthis research backs up what people think about organic food. in other countries, there have long been much higher levels of support and acceptance of the bene ts of organic food and farming. we hope these  ndings will bring the uk into line with the rest of europe.ó
advanced	when you see the word amazon, what’s the first thing that springs to mind – the world’s biggest forest, the longest river or the largest internet retailer – and which do you consider most important?these questions have risen to the fore in an arcane, but hugely important, debate about how to redraw the boundaries of the internet. brazil and peru have lodged objections to a bid made by the us e-commerce giant for a prime new piece of cyberspace: “.amazon”.the seattle-based company has applied for its brand to be a top-level domain name (currently “.com”), but the south american governments argue this would prevent the use of this internet address for environmental protection, the promotion of indigenous rights and other public interest uses.along with dozens of other disputed claims to names, including “.patagonia” and “.shangrila”, the issue cuts to the heart of debates about the purpose and governance of the internet.until now, the differences between commercial, governmental and other types of identity were easily distinguished in every internet address by “.com”, “.gov” and 20 other categories.but these categories – or generic top-level domains (gtlds) as they are technically known – are about to undergo the biggest expansion since the start of the worldwide web.the internet corporation for assigned names and numbers (icann) – a us-based non-profit organization that plays a key role in cyberspace governance – has received bids (each reportedly worth almost $200,000) for hundreds of new gtlds to add to the existing 22.amazon has applied for dozens of new domains, including “.shop”, “.song”, “.book” and “.kindle”. but its most contentious application is for its own brand.brazil and peru have called for the “.amazon” application to be withdrawn, saying a private company should not be assigned a name that denotes an important geographical area that spans their territories and is also used for certain regions and cross-border organizations.“allowing private companies to register geographical names as gtlds to reinforce their brand strategy or to profit from the meaning of these names does not serve, in our view, the public interest,” the brazilian ministry of science and technology said.brazil said its views were endorsed last month by other members of the amazon cooperation treaty (bolivia, colombia, ecuador, guyana, suriname and venezuela).dozens of other protests have also been registered over proposed top-level domains that take geographical, cultural or contested brand names.argentina has lodged an expression of its unhappiness that the us outdoor clothing retailer, patagonia, is claiming a domain name that has been known far longer as a region of spectacular beauty that also has its own parliament. “argentina rejects the ‘.patagonia’ request for a new generic top-level domain,” the government notes in an appeal. “patagonia is a relevant region for the country’s economy because it has oil, fishing, mining and agriculture resources. it is also a region with a vibrant local community and it is a major tourist destination.”less convincingly, china has disputed the domain “.shangrila”, which is proposed by a hotel group of the same name. the authorities in beijing say the “shangri-la” label belongs to a region in yunnan province, although it was only renamed as such in 2001 (long after the hotel group was formed) so that the local community could cash in on the fame of the fictional paradise depicted in the novel, lost horizon, by british author james hilton.at a conference in april in beijing, icann’s governmental advisory committee – the primary voice of national governments within the institution – recommended a freeze on disputed proposals. they are expected to be discussed again at a meeting in durban in july. the first approved domain names should be in use before the end of 2013.
