intermediate	in the arctic regions of canada, the summer sun shines for more than 20 hours a day. for some, it’s a welcome change from the constant darkness of winter. but, for the small but growing muslim community of iqaluit, nunavut, life in the land of the midnight sun is a real challenge during the month of ramadan, when muslims typically fast from sunrise to sunset.“i haven’t fainted once,” said 29-year-old abdul karim, one of the few in the area who has carefully timed his ramadan fast to the arctic sun since moving from ottawa in 2011. this year, that means eating at about 1.30am before the sun rises and breaking his fast at about 11pm when the sun sets. “the only reason to stop would be if it hurts my health,” karim said.it is nearly the end of ramadan for muslims around the world. fasting is important but, during the holy month, in every muslim community, there is also a focus on community work, prayer and reflection. but, in iqaluit and the other muslim communities in the arctic, the long days have forced a change in how they fast.most muslims in iqaluit follow the timetable followed by muslims in ottawa, about 1,300 miles south – this follows the advice of muslim scholars who have said muslims in the far north should observe ramadan using the timetable of mecca or the nearest muslim city. it still means fasting for around 18 hours a day, said atif jilani, who moved to iqaluit from toronto. “the days are long, but it’s more manageable.”many in the community of 100 people break their fast together – they gather in the city’s brand new mosque for nightly suppers. as they tuck into traditional food such as dates and goat or lamb curries, the sun shines brightly through the windows.it’s a similar situation across canada’s most northern mosques during ramadan, as muslims deal with the country’s unique geography. in recent years, much of the community has chosen to follow the ramadan timetable of edmonton, in alberta. some follow the timings of mecca, for example awan, a father of two young children, including a 12-year-old who recently started fasting. he hopes to encourage his son with the more manageable timetable of about 15 hours of fasting compared with about 18 hours in edmonton. “if i fast edmonton times, my son might say, ‘papa, you are really insane. what are you doing?’” he said.for the 100 or so muslims in inuvik, a small town 125 miles north of the arctic circle, it is impossible to follow the local movements of the sun. they have also been following edmonton’s timetable. “we currently have 24 hours a day of sun,” said ahmad alkhalaf. “there’s no sunrise or sunset.”they were already following the edmonton schedule in 2001 when he moved from toronto to the small northern community of 3,500 people. “my first ramadan here was in december. there’s no sun at that time; it’s dark all day and night. so we used edmonton time.”at times, it can be difficult to follow the clock rather than what is happening outside, alkhalaf said. “you’re supposed to break your fast when it’s dusk but we eat when the sun is up. it’s not usual to have iftar [the meal that breaks the fast] when the sun is up,” he said.in inuvik, where most of the population is inuit, the muslim community has tried to strike a balance between ramadan and the local culture and traditions. the iftar meal includes dates and curries – as well as local game such as reindeer. “we make a soup or curry, but instead of using beef, we use reindeer.”in iqaluit, as the muslim community prepares to mark the end of ramadan, some reflect that 2016’s timing – stretching across some of the longest days of the year – has made it one of the more difficult of recent years. it’s particularly true for those like karim who have followed the local sunrise and sunset carefully. but, his efforts will be rewarded in future years, said karim, thanks to the lunar calendar. ramadan will eventually fall during winter and, in iqaluit, the sun will rise and set within a few hours each day. “i’ll follow those hours, too,” he said with a laugh. “oh yes, definitely.”nan
intermediate	apart from volcanoes, hurricanes and earthquakes, there are two key things that can make a city disintegrate or even totally disappear ð water and sand. a century ago, venice ð one of the most beautiful and low-lying cities in the world ð used to  ood around ten times a year. nowadays, its lowest point, piazza san marco (only three feet above sea level) is inundated with water approximately 100 times a year.but rising sea levels are not the only cause. in many parts of the world, the land is also sinking. in venice, subsoil compaction (a result of industrial exploitation of the surrounding area) lowered the city by 20cm between 1950 and 1970. ho chi minh city in vietnam is also sinking by about 2cm a year ð but thatõs nothing compared to jakarta, which is dropping 10 to 20cm each year. in the past three decades, the city has sunk roughly four metres. unfortunately for the indonesian capital, it has pumped out so much groundwater to support its population that the land above is drying out and compacting ð this has created a bowl. rivers that used to  ow through the city down to the sea have had to be diverted because they cannot drain uphill.while there are many plans to save venice ð and ho chi minh city and jakarta are taking the problem seriously ð the same cannot be said for miami, where politicians refuse to admit the city has a serious environmental problem.there are three problems in miami. it is less than ten feet above sea level; an increasing number of tropical storms are inundating the city; and it is built on porous rock, which is absorbing the rising seawater. this water then  lls the cityõs foundations and comes up through drains and pipes, forcing sewage upwards and polluting its fresh water. it is possible that miami may one day become uninhabitable.in the maldives, the populations of whole islands are now considering abandoning their homes. the capital, male_, population 153,379 and only four feet above sea level, has built a ten-foot sea wall at a cost of $63 million ð but, long term, only a stabilization of rising sea levels will save it and the rest of the islands.in africa, deserti cation is causing the sahara to spread south at a rate of 30 miles per year, threatening settlements in northern mauritania. over the past 20 years, for example, the desert has grown by more than 260 acres around the trading and religious centre of chinguetti, where the population has declined from 20,000 people in the mid-twentieth century to just a few thousand now. trading has almost completely stopped as sand piles up in the streets. likewise, the californian resort of rancho mirage, near palm springs, may have to be abandoned in the next decade. this city is just one example of a problem caused not so much by global warming as human over-expansion. californiaõs dream of farming the desert made sense while its total population remained around half a million (in 1870) ð but now the state is home to 38 million people, who own 32 million vehicles.the daily water use in rancho mirage is more than 200 gallons per person, which is causing a man-made drought. a 25% cut in water use has been implemented but this is unlikely to stabilize the resort, which is surrounded by sand and dust. the long-term answer in californiaõs desert is likely to be the abandonment of some cities.fire is a growing threat to urban settlements in america ð in fact, forest  res cause the most damage after severe storms, with 800 major  re disasters there between 1953 and 2014. a new report by the usda forest service maps the increasing number of urban locations that are particularly vulnerable to wild re.similarly in australia, some of victoriaõs resorts and several melbourne suburbs have been placed on a list of the stateõs 52 most vulnerable bush re spots because long-term droughts are making trees highly combustible. itõs unlikely that a forest  re will ever destroy an entire city but a succession of  res could make it uninhabitable. many cities are  ghting a losing battle against nature but is it possible to identify the worlds most vulnerable city? natural events are very dif cult to predict  but males future looks particularly bad because, even if its new sea wall continues to be effective, the islands around the maldives capital are going to disappear before too long. and, if they disappear, males raison detre disappears, too.nannannan
intermediate	swedish prisons have long had a reputation around the world for being progressive. but are the country’s prisons a soft option?the head of sweden’s prison and probation service, nils oberg, said in november 2013 that four swedish prisons will close due to an “out of the ordinary” fall in prisoner numbers.although there has been no fall in crime rates, between 2011 and 2012 there was a 6% fall in sweden’s prisoner population, now a little over 4,500. a similar decrease is expected in 2013 and 2014. oberg said he was puzzled by the unexpected fall, but hoped that the reason was to do with how his prisons are run. “we certainly hope that the efforts we put into rehabilitation and preventing criminals from reoffending has made a difference,” he said.“the modern prison service in sweden is very different from when i joined as a young prison officer in 1978,” says kenneth gustafsson, governor of kumla prison, sweden’s most secure jail, 130 miles west of stockholm. however, he doesn’t think the system has gone soft. “when i joined, the focus was very much on humanity in prisons. prisoners were treated well – maybe too well, some might say. but, after a number of escapes in 2004, we had to place more emphasis on security.”the swedes still have a humane approach to sentencing, even of the most serious offenders: jail sentences are not usually more than ten years. those who receive life imprisonment can still apply to the courts after a decade to have the sentence changed to a fixed sentence, usually between 18 and 25 years. sweden was the first country in europe to introduce the electronic tagging of convicted criminals and continues to keep prison sentences short wherever possible by using community-based measures. these have been effective at stopping criminals from reoffending.the overall reoffending rate in sweden is between 30 and 40% over three years – to compare that with another european country, the number is around half that of the uk. one thing that has kept reoffending down and the number of prisoners in sweden below 70 per 100,000 people is that the age of criminal responsibility is 15. in the uk, for example, children aged ten to 17 and young people under the age of 21 have the highest reoffending rates. in sweden, no young person under the age of 21 can be sentenced to life – this is not the case in many other countries – and they try to keep young offenders out of prison.one strong reason for the fall in prison numbers might be the amount of post-prison support available in sweden. a government-run probation service supervises people on probation and provides treatment programmes for offenders with drug, alcohol or violence problems. the service is helped by around 4,500 members of the public who volunteer to befriend and support offenders under supervision.i spoke to a former prisoner who now runs a group called x-cons sweden. peter soderlund served almost three years of a four-year sentence for drug and weapons offences before he was released in 1998. he was helped by an organization run by other former prisoners called kris (criminals’ return into society).both organizations work with the same goal: helping prisoners successfully fit back into society after they have been released. and what is life like for the prisoner in sweden? “when i was inside, i was lucky.” says soderlund. “in osteraker prison, where i served my sentence, we were treated well. but i knew that not all swedish prisons were like that. i met so many people in there who needed help – after i received help from kris, i knew i wanted to help others. with x-cons, we meet them at the prison gate and support them into accommodation and offer a network of support.”“in sweden, we believe very much in the idea of rehabilitation,” says gustafsson. “of course, there are some people who will not or cannot change. but, in my experience, the majority of prisoners want to change and we must do what we can to help them.”nannan
intermediate	there are many quirky solutions to help make our cities more livable, such as glow-in-the-dark trees, underground bike sheds and solar-powered bins. city living has many upsides but a sustainable lifestyle is not always one of them. pollution, traf c and loss of green spaces are just some of the daily problems that city-dwellers have to deal with. we look at ten quirky solutions to making our cities better places to live.pop-up parks todayõs cities sometimes look like theyõre built more for cars than people. the pop-up park is a simple idea. take an empty car park, a small amount of money and a pot plant or two, and make yourself your own private park. the park(ing) project started as an arts experiment in san francisco. it has since spread across the world. temporary urban farms and ecology demonstrations are just some of the ideas that have come out of the project, which celebrates a day of action every september.subterranean storage not all urban dwellers have cars. bikes are becoming more and more fashionable. the question is: where to keep them safe? tokyo-based engineering company giken has a solution: an underground bicycle park. just seven metres wide, the cylindrical storage facility buries deep into the ground and can hold 204 bikes. owners can retrieve their bike at the touch of a button ð the automated system delivers it back above ground in around 13 seconds.glow-in-the-dark trees when most people think of trees that glow in the dark, christmas trees usually come to mind. not daan roosegaarde. the dutch designer-artist has invented a òbioluminescentó plant. the experimental technology joins dna from luminescent marine bacteria with the chloroplast genome of a plant to create a glow like a jelly sh. they are trying to create a version of the technology that roosegaarde hopes could one day replace normal street lighting.footfall harvesting every day, hundreds of commuters and shoppers in the east london neighbourhood of west ham cross the elevated pedestrian walkway close to the underground station. few people probably notice the springiness beneath their feet. even fewer realize that the springy rubber surface powers the streetlights above. the  oor has smart tiles that capture the energy from pedestriansõ footsteps and convert it into electricity. pavegen, the uk company who had the idea, has installed a similar system at londonõs heathrow airport and other international locations.supertrees it had to happen eventually: man-made trees. singaporeõs gardens by the bay has a group of them. up to 50 metres high, these steel-framed ôsupertreesõ not only have  owers growing up them ð their metallic canopies absorb and disperse heat, too. and they collect rainwater, as well as provide air ventilation for two large conservatories below. eleven of the 18 trees also have solar panels on their ôbranchesõ.
elementary	a new report says that almost one billion people will remain in extreme poverty by 2030 if countries donõt try to solve the social, economic and cultural problems that keep them poor. the report by the chronic poverty advisory network says that many people may rise above the poverty line of $1.25 a day, but fall back again when they have problems such as drought or illness and insecurity or con ict.the report found that, in parts of rural kenya and in south africa, 30 to 40% of people who escaped from poverty fell back again. this percentage rose to 60% in some areas of ethiopia between 1999 and 2009. even in successful countries such as indonesia and vietnam, the proportion was 20%.individual examples show how easy it is for people to fall back into poverty. amin is from a village in bangladesh. his income has fallen slowly, because of his illness and his wifeõs illness, the cost of his sonõs marriage, the death of his father and loss of goods such as  shing nets. lovemore, from zimbabwe, is now one of the poorest people in his village. he recently lost his job because of ill health and has to look after his  ve grandchildren after the death of his daughters.òwe need to make sure that people who come out of poverty remain above the poverty line permanently. too many families return to poverty when they have personal or bigger problems. governments shouldnõt assume that, just because somebodyõs income hits $1.25, that means the problem is solved,ó said andrew shepherd, the main author of the report.according to the un, the goal of eliminating extreme poverty by 2030 is still possible. but the report says that countries need to make changes to achieve zero poverty. there was a drop in extreme poverty from 1.9 billion in 1990 to 1.2 billion in 2010, but the report says that progress in the next 15 years will be much more dif cult. there has been a lot of progress in china but there will probably not be similar progress in other parts of the world.the report says countries should try to help the chronically poor ð those who are poor for many years or their entire lives ð and stop people becoming poor. ògovernments have been quite good at moving people over the poverty line because that is quite easy. but they have avoided the more dif cult job of trying to reduce chronic poverty,ó said shepherd.the report says progress on poverty reduction has helped people who were already closer to the poverty line, but has helped the chronically poor much less. it will not be possible to get to zero poverty if development policies donõt focus on the chronically poor, it adds. the report suggests three ideas. they all cost a lot of money.the  rst is social help ð to bring the poorest people closer to a good-enough standard of living. the second is education, from early childhood to the start of work, so people can escape and stay out of poverty. the third is economic growth policies that make sure that the bene ts of increasing national wealth reach the poorest people.all this will cost money and the report says higher taxes will be necessary. aid will also be necessary for the start-up costs for social assistance, healthcare for everyone and to  nance education. òthere remains a huge role for aid in the next 20 years, as many developing countries spend less than $500 on each of their citizens a year. even nigeria, with its oil wealth, spends only $650 per person,ó shepherd said.the authors say governments should have a national development plan and make sure the poorest people are represented politically as well as trying to stop dif cult social customs, such as dowries and witchcraft, that make extreme poverty worse.nannannannan
elementary	barack obama has told young people to reject pessimism and meet people who have different political beliefs if they want to change the world.on the last day of his last visit to britain as us president, obama told 500 youth leaders at a meeting in london: “reject the idea that there are things we can’t control. as jfk said, our problems are manmade and can be solved by man.”“you’ve never had better tools to make a difference,” he told the students at the question-and-answer session. “reject pessimism and know that progress is possible.”but obama said he knew that young people had many challenges. he said it was a time of great change, with 9/11, 7/7, and with so much information and bad news, for example on twitter.the president told the audience to meet and talk with people who have different political beliefs: “look for people who don’t agree with you and it will also help you to compromise.”obama said he was proud of his healthcare reforms and talked about the 2008 financial crisis: “i saved the world from depression – that was quite good.”he also said that his talks with iran and the response to the ebola crisis were some of the best things about his presidency.tanya williams, a community officer, said: “i like barack obama and it’s exciting to hear someone who has changed so much.”oliver sidorczuk, 26, said: “everyone is extremely excited to listen to what he has to say.”furqan naeem, from manchester, said: “i recently visited the united states and i saw some really important work the president did – the work brought different people together.”later, obama met labour party leader, jeremy corbyn, who said they had an “excellent” 90-minute discussion. they also talked about britain’s membership of the eu.after the meeting, obama played golf with british prime minister, david cameron. obama had dinner with cameron and the us ambassador, matthew barzun, and, then, travelled to germany.nannannannannannannannannan
elementary	"the age of the big british summer music festival, including glastonbury, is ending, according to the top rock manager harvey goldsmith.he has produced and worked with most of the western worldõs biggest music stars, including the who, the rolling stones, queen, madonna, bob dylan and luciano pavarotti. he says that the biggest problem is a serious lack of major new bands to follow on from the old ones.òthe age of the music festival peaked about two years ago,ó he said, speaking at the hay festival of literature and arts in wales. òthere are too many festivals and there are not enough big bands to headline them. that is a big, big problem for us. and we are not producing new bands that can headline ð like the rolling stones, muse, even the arctic monkeys.óthere were about 900 music festivals in the uk between may and september in 2014, he said, and they cannot all continue. there will be lots of small combination festivals where it isnõt just music but also poetry or books or magic shows.goldsmith, 69, said that he is working with robin de levita, the dutch producer of the whoõs 1970s rock musical tommy. they will bring the  rst stage adaptation of the teen book and movie series the hunger games to a new 1,100-seat theatre in wembley, london, in june 2016.talking at hay, goldsmith also revealed some of the secrets of his long career in the music industry. he said that keith moon put dynamite down a sydney hotel room toilet to unblock it. and, he said that john lennon had stage fright at madison square garden in 1974 ð he vomited and they had to push him onto the stage. òitõs bizarre how common stage fright is among artists. itõs odd how afraid they get but, as soon as the music starts, theyõre  ne,ó he said.he also gave the answer to a rock õnõ roll mystery: why elvis presley never performed outside north america. presleyõs manager, colonel tom parker, told goldsmith that the real reason why elvis never performed in england was because parker was an immigrant.òhe explained that it was because he was an illegal dutch immigrant. he didnõt want to risk leaving the us,ó said goldsmith.and his ultimate rock õnõ roll performer? òfreddie mercury was our most powerful stage performer, the best live performer weõve ever had.óbut there is no group to follow queen, he said. òweõre not producing a new generation of this kind of band. coldplay is probably the last one and that was ten years ago.""so, with no big bands to headline, there are no big shows. glastonbury now canõt  nd any more big bands. the time of big music festivals is really ending.ónannannan"
