intermediate	two mothers in south africa have found out that they are raising each otherõs daughters after they were mistakenly switched at birth in a hospital in 2010.but, while one of the women wants to correct the error and get her biological child back, the other is refusing to give back the girl she has raised as her own.henk strydom, a lawyer for one of the mothers, described the swap as a travesty and tragedy that is unlikely to have a happy ending.both mothers gave birth at the tambo memorial hospital in boksburg, east of johannesburg, on the same day in 2010. ònobody suspected anything,ó strydom said.but, in 2013, one of the mothers, who is 33 and unemployed, sued her ex-partner for maintenance for her daughter. strydom said: òthe man denied he was the father. a dna test was done and it was found it was not his baby and not her baby. she was devastated. she didnõt know what to do.óeventually, she met the other mother and, since december 2013, they have been attending joint counselling sessions, arranged by the hospital. here they have met their biological daughtersstrydom said of his client: òshe said there are resemblances to herself. she told me that it was traumatic. you can see itõs not easy for her. she has to care for a child that is not hers on her own while her child is with someone else.óthe woman became unhappy with the process and asked the childrenõs court to give her custody of her biological child, but the other mother refused.òitõs a tragedy. she wants the baby back, but itõs four years later: you can understand that the other mother doesnõt want to give up her baby,ó strydom said.the high court in pretoria has asked the university of pretoriaõs centre for child law to investigate what will now be in the best interests of the children.strydom added: òi donõt know what the court will decide. your guess is as good as mine. but, whatever happens, someone wonõt be happy.óhe said, at this point, he and his client do not want to sue the hospital or government health department, which is helping with the case and providing counselling.the centre for child law will interview the mothers and fathers, as well as any other person with a òsignificant relationshipó with either of the girls. the children and mothers will have clinical assessments and may be seen by a psychologist.karabo ngidi, a lawyer with the centre, said: òwhatõs going to happen must be in the best interests of the children. biology is an important aspect but not the only one.ó the families are of zulu ethnicity and so zulu tradition, culture and customary law will be a factor, she added. it is also still possible the ex- partner of the mother who is taking legal action could be the biological father of the girl who was switched.it is not the first child-swap case in south africa. in 1995, two mothers were awarded damages after their sons, born in 1989, were accidentally switched at the johannesburg hospital where they were born.in 2009, in oregon in the united states, dee ann angell and kay rene reed discovered that they had been mistakenly mixed up at birth in 1953 when a nurse brought them back from bathing.in 2013, in japan, a 60-year-old man swapped at birth from his rich parents to a poor family was given compensation. he grew up on welfare and became a truck driver, whereas his biological brothers and sisters ð and the boy brought up in his place ð attended private secondary schools and universities.bruce laing, a clinical psychologist in johannesburg, said the long-term effects of a baby swap could be òprofoundó, òterrifyingó and òincredibly traumatizingó. he told the times of south africa: òthe parents might always be thinking ôwhat if?õó
intermediate	dr ben brabon of edgehill university teaches a mooc – a massive open online course – in literature. the course is one of only two accredited moocs currently on offer in the uk. according to brabon, many students enrol on moocs because they are free and they enjoy communicating with other students. moocs have no enrolment criteria and no fees, so students behave very differently from students on traditional higher education courses.moocs are the newest big idea to try to make higher education available to everyone. a lot of money is being invested in new online platforms that deliver sophisticated and interactive courses to tens of thousands of students. investors hope to find a business model for moocs that will make them profitable – so far, courses have depended on universities funding their star lecturers’ course design and online teaching time. one way of making a return on the investment might be studying data about how, why and when millions of students sign up, interact with their material, submit their assignments, message each other and drop out of the course.one of the questions about the future direction of moocs is that nobody can yet say who exactly they benefit. universities who want to attract fee-paying international students onto postgraduate courses by showing off their best programmes online? students in developing countries who want access to first-world universities? employees who wish to develop their professional knowledge? people without qualifications who want to use moocs as a bridge to higher education? or hobby learners, who want to learn about a subject area in which they have an interest?moocs may be popular at the beginning, but they have very poor completion rates, says brabon. his literature course had 1,000 enrolments and 31 completions. “and almost all of those had a first degree or had been educated to degree level,” he says. “so moocs may not be opening up higher education to sectors of the population it hasn’t reached yet.”“learning online is a different thing and needs quite advanced learning skills,” confirms david kernohan, progamme manager for elearning innovation at a charity that promotes the use of digital technologies in uk education and research. “with moocs, there’s very little support available: the student does not get any individual attention. instead, they get peer support, such as online discussion forums.” although this may mean that online study is unattractive or difficult for someone without high-level qualifications, it suggests, he says, that moocs could be “a really good tool for continuing education.”at a time when the number of part-time students has fallen sharply because the price of a degree is rising, could this type of open and free-to-access course provide a new path to university-level education? could an entire degree be taught via moocs? “i don’t think that’s how moocs work,” says brabon. instead, he suggests “a blended approach that combines a campus experience with a mooc; also, perhaps, using moocs to create a global degree, with students taking courses from across the world, might be possible.”but that’s a little way into the future. for now, mooc completion certificates have no quality assurance on either the course content or its assessment standards, so employers will not be impressed by them. accreditation is now essential for moocs if they want to gain credibility with academics and employers, says brabon.some people are idealistic about moocs – they want to bring the best of first-world teaching to students in less developed countries. but there’s cynicism, too, with the suggestion that universities could use moocs to advertise their on-campus courses to bigger numbers of lucrative students from outside the eu.mike sharples, chair of educational technology, doesn’t agree with that cynicism. moocs are mainly a way to publicize and share universities’ best teaching talent, as well as encouraging interaction and getting feedback from students around the world, he says. he believes that enrolling international students onto university courses is only a secondary objective of moocs – but they could certainly be a very clever marketing idea, as he observes that “if 20,000 people sign up to a mooc – well, you only need 20 of those to enrol afterwards to run a master’s.”“in south america, china and countries in africa, there is a huge appetite for learning and some of the world’s best courses are now offered online,” adds sharples. “if people are genuinely fascinated by learning, then why not? the real challenge is to allow those countries not just to study moocs, but also to create them.”nan
intermediate	he is not the first person to express scepticism about mars one, a private mission that aims to send humans to live on mars from 2025. but joseph roche is different from most critics: he’s on the shortlist of astronauts.roche, an astrophysicist at trinity college dublin who was announced in february as one of the 100 people shortlisted for the mission, has written for the guardian expressing his doubts about the viability of mars one.the selection process, roche writes, “was not rigorous enough to reach the standard of more traditional astronaut selection programmes”. he also says the dutch mars one team have shown “a certain naivety” because they believe they can succeed alone in the $6bn mission. he says they should now accept it is very unlikely to happen.roche also expressed worries about the way the mission organizers publicized a ‘top-ten’ list of candidates. the ranking, he said, didn’t mean these were the best astronauts. it was based on how many “supporter points” each had earned.he says that these points only show how much each supporter has donated to mars one, for example by buying official merchandise.the official timeline for the mission says the group plans to send a stationary lander and satellite to mars in 2018, followed by a rover in 2020 and cargo missions starting in 2022. humans would start arriving in 2025 and crews of four would be sent every two years to add to the settlement. they would not return to earth.in february, a supporter of the project, gerard ’t hooft, a dutch nobel laureate in physics, said he did not believe this timetable was realistic. he said: “it will take quite a bit longer and be quite a bit more expensive. when they first asked me to be involved, i told them: ‘you have to put a zero after everything’.”roche also said that there were not 200,000 people who applied to be astronauts, as mars one said; there were only 2,761.he talked about the selection process in more detail: “i have not met anyone from mars one in person. initially, there were going to be regional interviews; we would travel there, we’d be interviewed and we’d be tested over several days. in my mind, that sounded like a proper astronaut selection process.“but, all of a sudden, it changed from being a proper regional interview over several days to being a ten-minute skype call.”roche told the guardian that he did not want to give more interviews because he didn’t want to sound negative about the idea of space travel.he writes: “i am passionate about scientific endeavour and that is why the ambitiousness of the mars one plan appealed to me. mars one were never likely to overcome the financial and technical barriers during their proposed timeline. but it was nice to hear a new idea that challenges us to think about our own role in the future of space exploration.he said that being part of the public debate about future missions has been one of the most interesting and enjoyable aspects of his involvement with mars one. he went on to say that, “if a one-way mission to mars ever became possible, i would always volunteer. for an astrophysicist, that is not a difficult decision to make.” but he does not think there will be a one-way mission in his lifetime.nan
intermediate	not many exercise classes have a tea break halfway through. but margaret allen’s does. after a gentle warm-up and a few quick exercises, the 93-year-old great-grandmother lets her group relax with a cup of tea and a quick rest.some of the class of eight look as if they need to rest more than others. allen herself, wearing a thick shirt, knitted waistcoat, slacks and sensible shoes, is not even sweating. despite an extremely painful trapped nerve in one leg and a knee in need of replacement, she looks like she could go on for hours.the general rule is that eating just before doing sport is not a good idea and especially not halfway through the class. but, on the afternoon i visit allen’s class in saltburn-by-the-sea near middlesbrough, slices of fruitcake are being passed around during the break. the cake has been baked to celebrate allen’s recent birthday by her 89-year-old sister, joan.the ladies have just finished their cake when allen is up again, leading the group through a lively scottish tune with lots of toe pointing and leg kicking. forty-five minutes later, the class is finally over.allen, a former volunteer with the charity red cross, has been leading classes in the north-east town for 45 years. she wasn’t particularly sporty at school, but she started playing the piano for a keep-fit class during the second world war and eventually took over in her 40s when the previous instructor retired.at one time, allen’s class had more than 18 regulars, each paying £1 a time. but, these days, the group is getting smaller – during the tea break, the ladies discuss a funeral that most of them had attended that week for one of the younger members of the group who had just died, aged 68.allen is the oldest, followed by her sister. the baby of the group is 60-year-old jean cunion, who is a bit embarrassed to admit that she is perhaps the least fit of the group. “i remember, the first time i came, margaret said, ‘who’s that huffing and panting?’ and i had to admit it was me.” ruth steere, 76, says allen always knows what’s going on, although her back is always to the class: “she always shouts at us if we go wrong. she’s remarkably good at knowing what we are doing.”allen, a keen dancer, has never done any formal training to be a fitness instructor. instead, she choreographs her own moves based on five tapes from the bbc’s first ever fitness guru, eileen fowler. allen thinks her good health is largely a result of keeping busy, especially since her husband died in 1997. she started writing poetry when she was 80.“i write poems about everything. i’m a prolific writer. i just can’t stop,” she says, when she phones me a few days after the interview to read out a poem she has written about the joys of exercise. one of the class, 84-year-old former teacher winnie robertson, thinks the secret to staying fit is never letting yourself go: “use it or lose it, that’s what i say.”allen still plays the piano and gives speeches. she did a computer course when she was 88. ageing is no fun, she admits, reading me a few lines from a poem she has written called ‘that beast called age’. she happily remembers a doctor who saw her for the first time a few years ago, who said she couldn’t possibly be more than 78: “i said, ‘thank you, doctor. you can go now.’”she also has a no-nonsense attitude to weight gain: “i just think people shouldn’t eat too much. whenever i hear someone saying, ‘oh, i can’t lose weight’, i say: ‘sellotape.’” she mimes taping her mouth shut. “i said this just the other day to a big fat man. everything in moderation is my motto.”earlier in 2013, allen was watching the news and saw a woman being given the british empire medal. “she was saying: ‘i’m 80 and i’m the oldest fitness instructor in the country!’ i was thinking: ‘no, you’re not.’ but i shan’t be writing to buckingham palace.”nan
elementary	coal will probably rival oil as the world’s biggest source of energy in the next five years. this might be a disaster for the climate.one of the biggest reasons behind the rise in coal use is the big increase in the use of shale gas in the us.new research from the international energy agency (iea) shows that all over the world people are using more coal, except in the us, where shale gas is now more popular than coal. because the us is using less coal, coal prices across the world have reduced. this has made coal more attractive, even in europe.maria van der hoeven, executive director of the iea, said that the amount of coal we use “continues to grow each year and, if no changes are made, coal will catch oil within ten years.”coal is available in large amounts and it can be found in most regions of the world, unlike oil and gas, and it is cheap to extract. the iea says that china and india will drive world coal use in the next five years, and india will probably overtake the us as the world’s second biggest consumer. china is the biggest coal importer, and indonesia is the biggest coal exporter.according to the iea’s medium-term coal market report, the world will burn 1.2bn more tonnes of coal per year by 2017 compared with today.with the highest carbon emissions, coal makes climate change a lot worse, especially when it is burned in old-fashioned, inefficient power stations. coal can also produce sulphur emissions – these lead to acid rain – and mercury and soot-particle pollution.van der hoeven says that we should make coal more expensive so that people prefer to use cleaner technologies such as renewable power. providing cheaper gas is the only way to reduce demand for coal. this has happened in the us because of the big increase in the production of shale gas there in the past five years.she said: “the us experience suggests that a more efficient gas market can reduce coal use, carbon dioxide emissions and electricity bills. europe, china and other regions should take note.”if something isn’t done soon there will be more climate change.nannan
elementary	more than 100,000 people went onto the streets in brazil to show their anger at violent police, poor public services and high costs for the world cup.the demonstrations in rio de janeiro, são paulo, brasilia, belem, belo horizonte and salvador started peacefully, but there were some clashes with police and people set fire to cars and buses.people complained that police used rubber bullets, tear gas and violent beatings.happening at the start of the football confederations cup, the rallies brought together people who are angry with the high costs and poor quality of public services, the large amounts of money spent on international sporting events, low standards of health care, inequality and corruption.most of the demonstrations were peaceful, but several police were hurt, at least one car was burned and windows were broken.people were demonstrating for different reasons. “we are here because we hate the government. they do nothing for us,” said oscar josé santos, 19 years old.“i’m an architect but i have been unemployed for six months. there must be something wrong with this country,” said nadia al husin.at a smaller rally in brasilia, demonstrators entered the high-security area of the national congress. several climbed onto the roof.in belo horizonte, police clashed with protesters who tried to get into a football stadium, where there was a confederations cup match between nigeria and tahiti.in porto alegre, demonstrators set fire to a bus and, in curitiba, protesters tried to enter the office of the state governor. there were also rallies in belem, salvador and other places.in são paulo, there were large groups of people but the marches were peaceful.most protesters were young and, for many, it was their first experience of such a giant rally. “my generation has never experienced this,” said thiago firbida, a student. “since the dictatorship, brazilians have never demonstrated like this. they did not believe they had a reason to. but now brazil once again has problems, with a constant rise in prices, so people are finally reacting.”brazil’s demonstrations have been given special names – the “vinegar revolution” (because police arrested people for carrying vinegar to stop the effects of tear gas), the “20-cent revolution” (because of the bus price rise) and the passe livre (because of the demand for free public transport).some said the protests did not feel brazilian but they were liberating. “our politicians need to see the strength we have as one people. brazilians are usually too nice; they enjoy partying, not protesting, but something is changing,” said deli borsari, a 53-year-old yoga teacher.after people heard about the costs of new and improved stadiums on the news, the confederations cup football tournament has been one of the reasons for the protests. before saturday’s match in brasilia, groups of demonstrators were dispersed by riot police. frightened japanese supporters ran from the area holding their children, when they heard shots – perhaps rubber bullets or tear gas.another protest march, near rio’s maracana stadium, also had a heavy police response.president dilma rousseff “believes peaceful protests are correct and proper for a democracy and that it is natural for young people to demonstrate.”but people booed the president at the opening ceremony for the confederations cup. she will have serious political problems, both now and in 2014, when brazil will host the world cup and also have an election.nannannannan
elementary	the brand and logo of apple are the most valuable in the world. they are worth nearly $119 billion – that is more than the economies of morocco, ecuador or oman.the brand value of apple, the world’s biggest company, has increased by 21% in 12 months, the interbrand best global brands report said.people all around the world recognize apple by its simple “apple with a bite missing” logo. other technology companies have also done very well in the 2014 report. the technology companies pushed more traditional brands – such as coca-cola, mcdonald’s and gillette – down the table.google’s brand value rose by 15% to $107 billion to take second place. coca-cola, in third place, is up 3% to $81.5 billion. ibm’s value is $72.2 billion and microsoft’s $45.5 billion. they are in fourth and fifth places.facebook’s value has increased the most in the table. its brand value increased by 86% to $14.3 billion. it is at 29th place in the table, ahead of older global companies such as volkswagen, kellogg’s and ford.apple was started by steve jobs in his los altos garage in 1976. it only appeared in the top ten of the interbrand annual study in 2011.its logo was created by advertising executive rob janoff in 1977. it was designed with a bite taken out of it so that it would not look like a cherry.graham hayles, interbrand’s chief marketing officer, said, “apple makes a lot of money because it has a very strong brand. if you have a strong brand, you make more money.”many technology companies rose up the chart but some fell, too. finnish mobile-phone company nokia dropped 41 places to 98th at $4.1 billion, just ahead of nintendo in 100th place (down 33).a chinese company has appeared in the top 100 for the first time, with mobile-phone and broadband company huawei at 94th place. it has a brand value of $4.3 billion.most of the brands in the top 100 are american. the most valuable non-american brands are south korea’s samsung (6th), japan’s toyota (8th) and germany’s mercedes-benz (10th). the most valuable british brands are hsbc (33rd), shell (65th) and burberry (73rd).other fashion brands in the top 100 include boss, prada and ralph lauren. designer label louis vuitton is the top fashion name, in 19th position with a value of $23 billion, just ahead of clothing chain h&m, with a brand value of $21 billion in place 21.sports brand nike is at place 22 with a brand value of nearly $20 billion, ahead of its rival adidas at place 59 with a value of $7 billion.jez frampton, chief executive of interbrand, said that customers now have more control than ever over a brand’s reputation. this is because they can make comments about a brand on social media, such as twitter.“customers expect interaction, 24/7 accessibility, customization options and high levels of personalization,” he said.nannannan
