advanced	the senate intelligence committee has approved a bill that would provide for increased transparency of the national security agency’s bulk collection of us phone records but allow the controversial practice to continue. sponsored by chairwoman dianne feinstein, the bill lets the nsa continue to collect phone metadata of millions of americans for renewable 90-day periods and allows the government to retain it. some legislators have alternatively proposed letting phone companies hold the metadata. it passed the committee by an 11-4 vote, paving the way for a full senate vote.the bill allows analysts to search through the data if they suspect there is a ‘reasonable suspicion’ that a suspect is associated with international terrorism. additionally, the bill allows the nsa to continue surveillance begun on foreigners outside the us if they enter the country ‘for a transitory period not to exceed 72 hours’.the bill is a direct challenge to one introduced by senator patrick leahy that would end domestic phone-records collection. it was also opposed by leading intelligence committee member mark udall, who said it did not go far enough. “the nsa’s invasive surveillance of americans’ private information does not respect our constitutional values and needs fundamental reform, not incidental changes. unfortunately, the bill passed by the senate intelligence committee does not go far enough to address the nsa’s overreaching domestic surveillance programmes,” udall said.another democratic member of the committee, ron wyden, said the bill maintains “business as usual” and “remains far from anything that could be considered meaningful reform”. feinstein defended the nsa bulk collection programme, but said there was a need to rebuild public trust. “the nsa call-records programme is legal and subject to extensive congressional and judicial oversight, and i believe it contributes to our national security,” she said in a statement. “but more can, and should, be done to increase transparency and build public support for privacy protections in place.”in her statement, feinstein said the bill would also make a number of improvements to transparency and oversight on the nsa, including: • requiring an annual public report of the total number of queries of nsa’s telephone metadata database and the number of times the programme leads to an fbi investigation or probable cause order; • requiring that the foreign intelligence surveillance court impose limits on the number of people at nsa who may authorize or query the call-records database; • establishing criminal penalties of up to ten years in prison for intentional unauthorized access to data acquired under the foreign intelligence surveillance act (fisa) by the united states; • mandating the fisa court impose a limit on the number of contacts an analyst can receive in response to a query of bulk communication records.after the committee’s hearing had ended, feinstein strongly endorsed the nsa’s main domestic programme. “i think there’s huge misunderstanding about this nsa database programme, and how vital it is to protecting this country,” she told reporters.concern over the intelligence committee’s bill was expressed by independent legal experts, who said the stage was now set for a showdown with the usa freedom act, a bill introduced by leahy and jim sensenbrenner that would prohibit bulk collection of americans’ telephone records. elizabeth goitein of the brennan center for justice said: “the intelligence committee bill and the usa freedom act present two opposing visions of the relationship between law-abiding americans and the national security state. the fundamental question is: should the government have some reason to suspect wrongdoing before sweeping up americans’ most personal information to feed into its databases? leahy and sensenbrenner say yes; feinstein says no.”wyden suggested that recent concern about nsa spying on foreign leaders had distracted from the real focus on mass domestic surveillance in the us. “the statements that american intelligence officials have made about collecting on the intentions of foreign leadership, that’s consistent with the understanding i’ve had for years, as a member of the intelligence committee,” he said. “that has implications for foreign policy. my top priority is ending the mass surveillance, digital surveillance, of millions and millions of lawabiding americans.”feinstein unexpectedly announced that she was “totally opposed” to the foreign leader spying of the sort the nsa conducts of german chancellor angela merkel. feinstein has been a staunch supporter of the nsa’s bulk collection of americans’ phone records.“americans are making it clear, that they never – repeat, never – agreed to give up their constitutional liberties for the appearance of security,” wyden said. “we’re just going to keep fighting this battle. it’s going to be a long one.”separately, feinstein said that james clapper, the director of national intelligence, had agreed to provide her in writing with a statement about a washington post story that alleged the nsa had intercepted data in transmission between google and yahoo data centres. she said she was withholding judgement on the story until she saw clapper’s rebuttal. her strong endorsement of the domestic phone records collection indicates that the powerful senate democrat is not yet prepared to expand the criticism of the nsa that she has launched, “totally opposing” its surveillance of foreign allied leaders – a more traditional intelligence activity than bulk phone metadata surveillance.wyden would not comment on the washington post report on the google and yahoo intercepts. but the senators suggested it had implications for the privacy of americans’ communication. “decades ago, countries had their own kinds of communication systems. now that you’ve had the merger of global communications, i think you’re going to have a lot more challenges spying on foreigners with implications for us citizens,” wyden said.
advanced	the threatened extinction of the tiger in india, the perilous existence of the orangutan in indonesia, the plight of the panda: these are wildlife emergencies with which we have become familiar. they are well-loved animals that no one wants to see disappear. but, now, scientists fear the real impact of declining wildlife could be closer to home, with the threat to creatures such as ladybirds posing the gravest danger to biodiversity.climate change, declining numbers of animals, rising numbers of humans and the rapid rate of species extinction mean a growing number of scientists now declare us to be in the anthropocene – the geological age of extinction when humans finally dominate the ecosystems.wwf’s living planet index (lpi) 2014 seemed to confirm that grim picture, with statistics on the world’s wildlife population that showed a dramatic reduction in numbers across countless species. the lpi showed the number of vertebrates had declined by 52% over four decades. biodiversity loss has now reached “critical levels”. some populations of mammals, birds, reptiles and amphibians have suffered even bigger losses, with freshwater species declining by 76% over the same period. but it’s the creatures that provide the most “natural capital” or “ecosystem services” that are getting many scientists really worried. three quarters of the world’s food production is thought to depend on bees and other pollinators such as hoverflies. never mind how cute a panda is or how stunning a tiger – it’s worms that are grinding up our waste and taking it deep into the soil to turn into nutrients, and bats that are catching mosquitoes and keeping malaria rates down. a study in north america has valued the loss of pest control from ongoing bat declines at more than $22bn in lost agricultural productivity.“it’s the loss of the common species that will impact on people, not so much the rarer creatures because, by the very nature of their rarity, we’re not reliant on them in such an obvious way,” said dr nick isaac, a macroecologist at the centre for ecology & hydrology in oxfordshire. he says that recent work he and colleagues have been doing suggests that britain’s insects and other invertebrates are declining just as fast as vertebrates, with “serious consequences for humanity”. “the really interesting thing about this work is that we are learning that it’ s not just about the numbers of species going extinct, but the actual numbers in a population; that’ s the beginning of a fundamental shift in our understanding,” he says.he pointed to the fact that between 23 and 36% of all birds, mammals and amphibians used for food or medicine are now threatened with extinction. in many parts of the world, wildanimal food sources are a critical part of the diet, particularly for the poor.the blame, most agree, sits with unsustainable human consumption damaging ecosystems, creating climate change and destroying habitats at a far faster rate than previously thought. but, this time, it’s not just the “big, cuddly mammals” we have to worry about losing but the smaller, less visible creatures upon which we depend – insects, creepycrawlies and even worms. they might not be facing immediate extinction but a decline in their numbers will affect us all. “we are going to feel the impact of those losses. with the uk species, the pattern is much the same with invertebrates as it is with vertebrates. it’s not as simplistic as ‘fish die and people starve’ – it’s more complex,” said isaac.humans, said tv naturalist sir david attenborough in 2013, are a “plague on earth”, but wwf claims there is still time to stop the rot. its uk chief executive, david nussbaum, said: “the scale of the destruction highlighted in this report should act as a wake-up call for us all. we all – politicians, business and people – have an interest, and a responsibility, to act to ensure we protect what we all value: a healthy future for people and nature.“humans are cutting down trees more quickly than they can regrow, harvesting more fish than the oceans can restock, pumping water from our rivers and aquifers faster than rainfall can replenish them and emitting more carbon than the oceans and forests can absorb,” he said.
advanced	when two islanders spotted a small fibreglass boat washed up on a remote pacific atoll, they decided to take a closer look. what they found inside was a tale of adventure and unlikely survival to rival the blockbuster book and film life of pi: an emaciated man with long hair and a beard, who claimed to have been drifting for 16 months after setting out from mexico, more than 12,500km away.the man, dressed only in a ragged pair of underpants, told his rescuers that he had been adrift in the 7.3-metre fibreglass boat, whose engines were missing their propellers, since he left mexico for el salvador in september 2012. a companion had died at sea several months earlier, he said.“his condition isn’t good, but he’s getting better,” said ola fjeldstad, a norwegian anthropology student doing research on the isolated ebon atoll, part of the marshall islands archipelago. the man had said his name was josé ivan and he had indicated that he survived by catching turtles and birds with his bare hands, but, because he spoke only spanish, further details were sketchy. there was no fishing equipment on the boat, but a turtle was inside when it washed up. “the boat is really scratched up and looks like it has been in the water for a long time,” fjeldstad told reporters.according to the researcher, the islanders who found the man took him to the main island in the atoll – which is so remote it has only one phone line and no internet – to meet the mayor, ione de brum, who contacted the ministry of foreign affairs in majuro, the marshall islands capital. officials at the ministry said that they were awaiting more details and expected the man to be taken to the capital.the government airline’s only plane that can land at ebon is currently undergoing maintenance and is not expected to return to service for several days. officials are considering sending a boat to pick up the castaway. “he’s staying at the local council house and a family is feeding him,” said fjeldstad, who added that the man had a basic health check and was found to have low blood pressure, but did not appear to have any life-threatening conditions and was able to walk with the aid of men on the island. “we’ve been giving him a lot of water and he’s gaining strength.”fraser christian, who teaches maritime survival courses at his coastal survival school in dorset, said the man’s story, if true, would be remarkable but far from unique. it was entirely possible to catch turtles or small fish by hand, he said, since “they are inquisitive and they will approach a small boat to shelter underneath it”. christian advises clients who find themselves forced to eat turtles to start with their eyes – “lots of fluid” – then move on to the blood.the major problems the man would have faced were exposure and dehydration. “the basic rule is: no water, no food. you need water to digest protein. if you have no fresh water and it doesn’t rain for a few days, so you can’t collect rainwater, you have basically had it.” individual physiology also plays a part, he said, with some people better suited to survival than others. “the mental thing is key and that’s often down to people’s situation in life and how used they are to dealing mentally with hardship.”stories of survival in the vast pacific ocean are not uncommon. in 2006, three mexicans made international headlines when they were discovered drifting, also in a small fibreglass boat near the marshall islands. they claimed to have survived for nine months at sea on a diet of rainwater, raw fish and seabirds, with their hope kept alive by reading the bible. but cliff downing, who teaches sea survival to sailors, said he was sceptical about the latest tale. “it just doesn’t sound right to me. there are 1,001 hazards that would make his survival for so long very unlikely. one would want to know a lot more.”
advanced	more than a third of all women worldwide – 35.6% – will experience physical or sexual violence in their lifetime, usually from a male partner, according to the first comprehensive study of its kind from the world health organization (who). the report reveals the shocking extent of attacks on women from the men with whom they share their lives, with 30% of women being attacked by partners. it also finds that a large proportion of murders of women – 38% – are carried out by intimate partners.“these findings send a powerful message that violence against women is a global health problem of epidemic proportions,” said dr margaret chan, director general of the who. “we also see that the world’s health systems can and must do more for women who experience violence.”the highest levels of violence against women are in africa, where nearly half of all women – 45.6% – will suffer physical or sexual violence. in low- and middle-income europe, the proportion is 27.2%. yet, wealthier nations are not necessarily always safer for women – a third of women in high-income countries (32.7%) will experience violence at some stage in their lives. of the women who suffer violence, 42% sustain injuries, which can bring them to the attention of healthcare staff. that, says the report, is often the first opportunity for violence in the home to be detected and for the woman to be offered help. violence has a profound effect on women’s health. some arrive at hospital with broken bones, while others suffer pregnancy-related complications and mental illness.the two reports from the who – one on the prevalence of violence, the other offering guidelines to healthcare staff on helping women – are the work of dr claudia garcia-moreno, lead specialist in gender, reproductive rights, sexual health and adolescence at who, and professor charlotte watts, an epidemiologist who specializes in gender, violence and health, from the london school of hygiene and tropical medicine.“for the first time, we have compared data from all over the world on the magnitude of partner violence and sexual violence by non-partners and the impact of these sorts of violence on health,” said garcia-moreno. these included hiv and other sexually transmitted infections, depression, women turning to alcohol, unwanted pregnancies and low-birthweight babies.there were variations in the rates of violence against women in different regions of the world but, said garcia-moreno, “in whatever region we looked at, it is unacceptably high”. even in high-income countries, 23.2% of women will suffer physical and/or sexual violence from a partner in their lives, their data from 81 countries shows. the global figure for women attacked by partners was 30%.more sexual assaults and rapes by acquaintances or strangers are reported in high-income countries than elsewhere – the report says that 12.6% of women in wealthy countries will be sexually attacked by a non-partner in their lives, which is higher than the african rate of 11.9%. but, the data on such crimes is not well collected in all regions.the authors say that their previous research shows that better-educated women are less likely to suffer violence, as are those who have jobs, although not in all regions. there is a need to tackle social norms, said watts. “what is society’s attitude concerning the acceptability of certain forms of violence against women?” she asked. “in some societies, it is not ok – but not all.”“i think the numbers are a wake-up call for all of us to pay more attention to this issue,” said garcia-moreno. over the past decade, there has been increasing recognition of the problem, she said, but “one has to recognize that it is a complex problem. we don’t have a vaccine or a pill”.the new who clinical and policy guidelines recommend training for healthcare staff in recognizing the signs of domestic violence and sexual assault, but they rule out general screening – there is not a case for asking every woman who arrives in a clinic whether she has been subjected to violence.“but, if you see a woman coming back several times with undisclosed injuries, you should be asking about domestic violence,” said garcia-moreno. “when i was training in medical school, it wasn’t something you learned or knew about. years later, i was sometimes in a situation where i could tell there was something else going on in the woman i was interviewing, but didn’t have any sense that domestic violence was the issue. now, i think i would handle the interview very differently.”
advanced	in homes and cafes across the country, a cup of tea, baked beans on toast and fish and chips have long played a key role in the british dining experience. but, the extent of a change in tastes over the generations has been captured in a dataset published recently in the national food survey, which was set up in 1940 by the government after concerns about health and access to food.despite the apparent british love of tea, consumption has more than halved since the 1970s, falling from 68g of tea per person per week to only 25g. with a teabag or portion of loose tea weighing around 3g, that means britons are drinking on average only eight cups of tea a week today, down from 23 cups in 1974. and, while tea remains the most drunk hot drink in the uk, households now spend more on coffee.the data, published by the department for environment, food and rural affairs as part of its “open data” scheme, is from 150,000 households who took part in the survey between 1974 and 2000, combined with information from 2000 to 2014. it shows some moves towards healthier diets in recent decades, with shifts to low-calorie soft drinks, from whole to skimmed milk and increasing consumption of fresh fruit. but, weekly consumption of chips, pizza, crisps and ready meals has soared.there has also been a dramatic shift from white to brown, wholemeal and other bread but the figures suggest the amount people are eating has fallen from 25 to 15 slices a week over the past four decades, based on a 40g slice from a medium sliced loaf. the consumption of baked beans in sauce has dropped by a fifth despite a rise in other types of convenience food, particularly italian dishes. adults in the uk now eat an average of 75g of pizza every week compared with none in 1974, while the consumption of pasta has almost tripled over the same period.fresh potatoes are also becoming less essential with a 67% decrease from 1974, when adults ate the equivalent of 188g every day. other vegetables such as cucumbers, courgettes, aubergines and mushrooms have gained space on the table. consumption of takeaway food has almost doubled since 1974, from 80g per person per week to 150g. around 33g of this amount is chips and 56g is meat, with kebabs (10g), chicken (7g), burgers (5g) and “meat-based meals” (32g) particularly popular.some trends suggest that british people are becoming more prudent in what they put on their plates, with the average consumption of fruit, both fresh and processed, increasing by 50% since 1974. in 2014, uk adults ate an average of 157g of fruit per day, equivalent to almost two portions of the five-a-day recommendation from the government. bananas have been the most popular fruit in the uk since 1996, reaching 221g per adult per week in 2014, well above apples (131g) and oranges (48g). low-calorie soft drinks represented half of all soft drinks consumed in 2014 for the first time.other social changes emerge from the survey, with questions about owning chickens and getting your own eggs being dropped in 1991 and a somewhat belated end in the same year to asking the “housewife” to fill out the questionnaire. britons are spending a smaller proportion of pay on food today – 11%, compared with 24% in 1974.the uk environment secretary, elizabeth truss, said: “food is the heart and soul of our society and this data not only shows what we were eating 40 years ago but how a change in culture has led to a food revolution. shoppers are more plugged in to where their food comes from than ever before, the internet has brought quality produce to our doorsteps at the click of a button, pop-up restaurants are showcasing the latest trends and exciting global cuisines are now as common as fish and chips.”“by opening up this data, we can look beyond what, where or how previous generations were eating and pinpoint the moments that changed our habits for good. we’ve only scraped the surface of what the national food survey can tell us and, from local food maps and school projects to predicting new food trends, i look forward to seeing how this data can be used to learn more about our past and grow our world-leading food and farming industry in the future.”
advanced	lego’s profits rose strongly in the first half of 2014, helped by the success of its lego movie, which has stormed box offices in the us and uk.the danish toy firm’s sales rose across europe, the americas and asia as children snapped up products linked to the film. the film, released in february, took more than $250m in the us and £31m in the uk by the first weekend in april.the movie cost about $60m to make and has been described as a near-flawless piece of content marketing by creating entertaining content aimed at consumers who are likely to go out and buy the company’s products.lego’s finance director, john goodwin, said: “the strong performance of the lego movie products had a positive effect during the first half of 2014, and it remains to be seen how the line will continue to develop behind the highly anticipated launch of the movie on dvd in the second half of 2014.”operating profit for the first six months of lego’s financial year increased by 12% to $630m. sales rose by 11% to more than three times the figure six years before.jørgen vig knudstorp, lego’s chief executive, said: “it is a very satisfactory result that shows our significant growth in recent years in a tough economic environment. the result for the first half of 2014 is an outcome of our ability to develop, launch and distribute lego products, which children all over the world put at the top of their wishlists.”lego, based in the small town of billund, started producing its plastic bricks in 1949 and became a staple children’s toy around the world by the 1970s. but the group lost its way and was on the brink of collapse in 2003. knudstrop took over as chief executive, ending 70 years of family rule, and ditched hundreds of surplus products to refocus the business on its trademark bricks.the company opened its first factory in china in april and opened an office in shanghai to spearhead expansion in the world’s secondbiggest economy.
