elementary	the taliban sent a gunman to shoot malala yousafzai in october 2012 as she went home on a bus after school. they wanted to silence the teenager and end her campaign for girls’ education.nine months and many operations later, she stood up at the united nations on her 16th birthday. “they thought that the bullet would silence us. but they failed,” she said.it was an unusual 16th birthday. malala didn’t blow out candles on a cake; she sat at the united nation in the central seat where world leaders usually sit.she listened quietly as ban ki-moon, the un secretary-general, described her as “our hero, our champion”; and as the ex-british prime minister and now un education envoy, gordon brown, said “the words the taliban never wanted her to hear: happy 16th birthday, malala”.the event was named malala day after the girl from mingora in pakistan. she became famous after she wrote a blog for the bbc urdu service – in the blog, she described her difficult experiences of trying to get an education under the power of the taliban.when she was 11, she asked the us special representative to pakistan, richard holbrooke, to help in her campaign against the taliban, who wanted to stop education for girls. by 14, archbishop desmond tutu, suggested her for the international children’s peace prize, and, by 15, she became the youngest nobel peace prize nominee in history.then she got death threats, and, on 9 october 2012, after a meeting of pakistani taliban leaders, the gunman came to kill her.she has had many operations in pakistan and the uk after the shooting on the bus. she now lives with her family in birmingham, england, and does what the taliban tried to stop her doing: she goes to school every day. “i am not against anyone,” she said. and she doesn’t want “personal revenge against the taliban or any other terrorist group.”malala replied to the violence of the taliban with words against bullets. “i do not even hate the talib who shot me. even if there was a gun in my hand and he stood in front of me, i would not shoot him.”“the extremists are afraid of books and pens,” the teenager continued. “the power of education frightens them. they are afraid of women. the power of the voice of women frightens them.”she talked about the attack in june on a hospital in quetta, capital of baluchistan, and killings of female teachers in khyber pakhtunkhwa. “that is why they are blasting schools every day – because they were and they are afraid of change, afraid of the equality that we will bring to our society.”the “stand with malala” petition, that is asking for education for the 57 million children around the world who do not go to school, has got more than four million signatures – more than a million were added after malala’s speech.at the start of her speech, malala said: “i don’t know where to begin my speech. i don’t know what people are expecting me to say.” she did not have to worry.nannan
elementary	the vice-president of google has warned that digitized material from blogs, tweets, pictures, videos and official documents such as emails could be lost forever because the programs we need to view them will no longer exist. our first steps into the digital world could be lost to future historians, vint cerf told the american association for the advancement of science’s annual meeting. he said that we might become a “forgotten generation or even a forgotten century” because of “bit rot”, where old computer files become useless junk.cerf said we should develop digital methods to preserve old software and hardware to read old files. “so much of the information about our daily lives is in digital form, like our interactions by email, people’s tweets and all of the world wide web. so it’s clear that we could lose a lot of our history,” he said. “if we want to keep it, we need to make sure that people can still see the digital objects we create today in the future,” he added.what is ‘bit rot’ and is vint cerf right to be worried? his warning highlights an irony about modern technology: we digitize music, photos, letters and other documents so that they survive for centuries but the programs and hardware people will need to read those files don’t survive.“we are throwing all of our data into an information black hole. we digitize things because we think we will preserve them. but what we don’t understand is that, if we don’t do something, those digital versions may not be any better than the things that we digitized. in fact, they may be worse,” cerf says. “if there are photos you really care about, print them out.”ancient civilizations did not have these problems because people wrote histories down and we need only eyes to read them. to study today’s culture, future historians will have to read pdfs, word documents and hundreds of other file types, using special software and sometimes hardware, too.the problem is already here. in the 1980s, it was normal to save documents on floppy disks and buy computer games on cassettes. even if the disks and cassettes are in good condition, we can now only find the equipment to view them in museums.cerf warns that we will also lose important political and historical documents because of bit rot. in 2005, american historian doris kearns goodwin wrote a book about abraham lincoln. she went to libraries around the us and found the paper letters of the people involved. “in today’s world, those letters would be emails and it will be almost impossible to find them one hundred years from now,” said cerf.he admits that historians will try to preserve important material. but he says that people often don’t understand the importance of documents until hundreds of years later. historians have learned how archimedes thought about infinity in 3bc because they found his writings hidden under the words of a thirteenth-century book. “we’ve been surprised by what we’ve learned from objects that have been preserved by accident,” he said.researchers in pittsburgh are trying to find a solution to bit rot. they are creating a computer that can read old files.inventing new technology helps but it is only part of the solution. it could be even more difficult to get the legal permissions to copy and store software before it dies. “to do this properly, we might need to think about things like copyright. we’re talking about preserving documents for hundreds to thousands of years,” said cerf.
elementary	swiss police recently entered the baur au lac hotel in zurich at dawn and arrested 16 football officials, including five current or former fifa executives. they were later charged with corruption in the us. the officials included the former brazilian federation chief ricardo teixeira and his successor, marco polo del nero.they were among 16 individuals accused of fraud and other crimes by the us department of justice. the us has now charged 27 defendants, including former fifa executives. “the level of corruption is completely unacceptable,” said the us attorney general, loretta lynch.swiss police arrested the president of the south american football confederation, the paraguayan juan ángel napout, and alfredo hawit, the head of the north and central american and caribbean governing body. hawit started his job after jeffrey webb left the job in may 2015 because he was arrested. this was part of the us operation that led to a crisis at fifa and caused sepp blatter to lose his job and reputation.the swiss federal office of justice said of the latest arrests: “they are in custody before their extradition. the us believes they accepted bribes of millions of dollars”. webb and the colombian former executive luis bedoya entered guilty pleas in the us.eleven current and former fifa executives have now been charged in the investigation, which alleges $200m in bribes, mainly from tv and marketing contracts but also fifa’s development programmes.“the message from this announcement should be clear to everyone who hopes to escape our investigation: you will not escape,” said lynch. teixeira, the former son-in-law of the fifa ex-president joão havelange, was charged together with del nero and his predecessor josé maria marin, who was charged in may 2015.fourteen men were charged in may 2015. days later, blatter won a fifth term as president but then agreed to leave his job as the crisis grew. he was then suspended together with the uefa president, michel platini, because of an alleged £1.3m payment to the frenchman. both men might get life bans when the fifa ethics committee hears their case in december if they are found guilty.among those also charged on thursday were rafael salguero, a guatemalan who left the executive committee in may; the former south american confederation secretary general eduardo deluca; former peruvian football federation president manuel burga; and bolivia’s football president, carlos chaves, already jailed in his own country.lynch said: “the department of justice really wants to end the corruption in the leadership of international football – not only because there is such a lot of corruption but also because the corruption is an insult to international principles.”the acting fifa president, issa hayatou, refused to comment on the detail of the latest arrests. but he said neither he nor the organization was corrupt. hayatou appeared for the first time before the media since he started the job in september, when blatter was suspended, and said the current crisis was the fault of a few bad people.“fifa is not corrupt. we have some people that have shown negative behaviour. but not everyone in fifa is corrupt,” said hayatou, president of the confederation of african football for more than 25 years. “there are lots of people who have been in fifa for more than 20 or 30 years that have not been accused of anything.”
elementary	nelson mandela, the most important person in africa’s fight for freedom and a hero to millions of people around the world, has died at the age of 95.south africa’s first black president died with his family with him at home in johannesburg after years of illness.the news was told to the country by the current president, jacob zuma, who said mandela died around 8.50pm local time and was at peace.“this is the moment of our deepest sorrow,” zuma said. “our nation has lost its greatest son.“south africans, nelson mandela brought us together and it is together that we will say goodbye to him.”zuma said that mandela would receive a state funeral.barack obama called mandela by his clan name – madiba. the us president said: “madiba transformed south africa – and moved all of us.”uk prime minister david cameron said: “a great light has gone out in the world” and he described mandela as “a hero of our time”.fw de klerk – the south african president who freed mandela from prison and shared the nobel peace prize with him in 1993 – said the news was very sad for south africa and the world.he was a great unifier,” de klerk said.in soweto, people came together to sing and dance near the house where mandela once lived. they sang songs from the anti-apartheid struggle. some people were wearing south african flags and the green, yellow and black colours of mandela’s party, the african national congress (anc).mandela’s death sends south africa deep into mourning nearly 20 years after he led the country from racial apartheid to democracybut his death will also be felt by people around the world who thought mandela was one of history’s last great political leaders, similar to gandhi and martin luther king.after spending 27 years in prison, including 18 years on robben island, mandela won the country’s first multiracial election in 1994, with his party, the anc.born with the name rolihlahla dalibhunga in a small village in the eastern cape on 18 july, 1918, a teacher at mandela’s school gave him his english name, nelson.he joined the anc in 1943. in 1952, he started south africa’s first black law firm with his partner, oliver tambo.when the anc was banned in 1960, mandela went underground. after the sharpeville massacre, in which 69 black protesters were shot dead by police, he took the difficult decision to begin an armed struggle. he was arrested and sent to prison for life.finally, in 1990, fw de klerk ended the ban on the anc and mandela was released from prison.archbishop desmond tutu, said: “he made people believe in africa and africans again.”mandela’s 91st birthday was celebrated by the first annual “mandela day” in his honour. he was married three times and he had six children, 17 grandchildren and 14 great-grandchildren.nannannannannannannannannannan
elementary	an international agreement to improve safety in bangladesh’s clothes factories could face legal action. this is because factory owners are asking for compensation for the cost of closures and repair work. some repairs may take months and factory owners say they cannot pay workers while factories are closed. also, they cannot pay for big works to make buildings safe. the building repairs are happening after the rana plaza building in the capital of bangladesh, dhaka, collapsed in 2013 and 1,138 people died.the problems come as hundreds of bangladeshi clothes factories are inspected every month for fire-safety and structural problems under the accord on fire and building safety in bangladesh. the accord is supported by over 170 international companies, including primark and marks & spencer, and international trade unions, including industriall.the owner of one dhaka factory, softex cotton, said he will take legal action against the accord because his factory was closed down as a result of structural problems. he wants around $100 million in compensation.another factory owner said that, when a factory closed, even for a few months, it would lose orders and close permanently: “there is no such thing as temporary closure,” he said. the factory owner said it was not clear in the accord agreement who would pay for factory closures.jenny holdcroft, policy director for industriall, which has been closely involved in the accord, said that the agreement made sure that factories would not lose orders during closure because companies agreed to continue orders with suppliers for two years.the accord has found12 factories that need a lot of work, but holdcroft said many of those only needed partial closure and production could continue on other floors. the accord also asks companies to make sure that workers receive pay during factory closures. she said that factory owners who could afford to pay for repairs and compensation for workers should make the payments.“companies don’t want to pay so that rich factory owners can continue to just take the profits and not spend on their factories for years. it is not surprising that there is disruption. if there was no disruption, there would be no change,” she said. a spokesman for the accord said negotiations over payments and even legal action would not delay its work to improve safety in factories.but there is now more pressure on the accord to help pay workers when their factories close. a rival factory-safety group, supported by us retailers including walmart and gap, the alliance for bangladesh worker safety, has given $5 million to help pay factory workers for up to two months while buildings are improved.“the alliance is sharing the workers’ salary with factory owners so now there is a big confusion. we had a big meeting with the accord to make them understand they have to help or how will we help our workers?” said shaidullah azim, a director of the bangladeshi garment manufacturers and exporters association.
elementary	george w bush, benedict cumberbatch and stephen hawking have done it. david cameron, barack obama and pamela anderson have refused to do it. the ice bucket challenge began in the us in july. it has raised $100 million for the als association, an american motor neurone disease charity, and £4.5 million for a british charity, as well as thousands of pounds for charities in hong kong and australia.but some people are unhappy with the ice bucket challenge. animal-rights groups and environmentalists (people who want to protect the natural world) have criticized it. some people say it wastes water. other people criticize it because some people enjoy the fun and then do not donate anything to charity.but the challenge continues to grow. if you don’t know how it works, someone gives a short speech to camera about the charity, then throws a bucket of ice cubes in water over their head or asks a friend to do it. then, they give the names of three other people who have to do the same or donate money to the charity.it was an unlucky coincidence that the ice bucket challenge was happening during world water week, when people from all over the world met in stockholm to discuss the planet’s water crisis. the charity wateraid is asking people to use recycled water from their baths or rainwater from their gardens, or to use sea water.douglas graham, of the uk motor neurone association, said: “we are not surprised about the criticism but this is a wonderful windfall and we’re so grateful. we didn’t expect it but, suddenly, the donations just started.” the money is a very big help to a small charity that looks after sufferers of a terrible disease that has no cure and kills five people a day in the uk.former baywatch star and animal-rights activist pamela anderson wrote a public letter to the als association. in the letter, she said that she did not like the charity’s use of animal experimentation. a few us stars have rejected the challenge because of california’s drought. actor matt damon solved the problem by using water from his toilet. actor verne troyer used milk, also for environmental reasons. and some people say the challenge caused a water shortage on the scottish island of colonsay.another criticism is that small charities won’t know what to do with the extra money but the mnd association rejects this. “oh, we know what to do with the extra money here,” said graham. “we pay for research to find the causes of the disease, and a treatment or cure. we give care and support to 3,500 people and they need it because this disease is expensive to manage. more than 50% of people with the disease die within two years.”but, for many people with a connection to the disease, the awareness that the challenge has created is as important as the money. normally, the mnd association gets about 300,000 hits a year on its website. on just one day recently, it had 330,000 hits.“it is great to donate to any charity. i understand that some people might want to donate to a different charity,” said graham. “in 2013, british people gave £62 billion to charity – we should be proud of that. it’s fabulous for us to get this windfall. over the next few weeks, we will decide how to spend the money in the best way.”nannan
elementary	a new report says that almost one billion people will remain in extreme poverty by 2030 if countries donõt try to solve the social, economic and cultural problems that keep them poor. the report by the chronic poverty advisory network says that many people may rise above the poverty line of $1.25 a day, but fall back again when they have problems such as drought or illness and insecurity or con ict.the report found that, in parts of rural kenya and in south africa, 30 to 40% of people who escaped from poverty fell back again. this percentage rose to 60% in some areas of ethiopia between 1999 and 2009. even in successful countries such as indonesia and vietnam, the proportion was 20%.individual examples show how easy it is for people to fall back into poverty. amin is from a village in bangladesh. his income has fallen slowly, because of his illness and his wifeõs illness, the cost of his sonõs marriage, the death of his father and loss of goods such as  shing nets. lovemore, from zimbabwe, is now one of the poorest people in his village. he recently lost his job because of ill health and has to look after his  ve grandchildren after the death of his daughters.òwe need to make sure that people who come out of poverty remain above the poverty line permanently. too many families return to poverty when they have personal or bigger problems. governments shouldnõt assume that, just because somebodyõs income hits $1.25, that means the problem is solved,ó said andrew shepherd, the main author of the report.according to the un, the goal of eliminating extreme poverty by 2030 is still possible. but the report says that countries need to make changes to achieve zero poverty. there was a drop in extreme poverty from 1.9 billion in 1990 to 1.2 billion in 2010, but the report says that progress in the next 15 years will be much more dif cult. there has been a lot of progress in china but there will probably not be similar progress in other parts of the world.the report says countries should try to help the chronically poor ð those who are poor for many years or their entire lives ð and stop people becoming poor. ògovernments have been quite good at moving people over the poverty line because that is quite easy. but they have avoided the more dif cult job of trying to reduce chronic poverty,ó said shepherd.the report says progress on poverty reduction has helped people who were already closer to the poverty line, but has helped the chronically poor much less. it will not be possible to get to zero poverty if development policies donõt focus on the chronically poor, it adds. the report suggests three ideas. they all cost a lot of money.the  rst is social help ð to bring the poorest people closer to a good-enough standard of living. the second is education, from early childhood to the start of work, so people can escape and stay out of poverty. the third is economic growth policies that make sure that the bene ts of increasing national wealth reach the poorest people.all this will cost money and the report says higher taxes will be necessary. aid will also be necessary for the start-up costs for social assistance, healthcare for everyone and to  nance education. òthere remains a huge role for aid in the next 20 years, as many developing countries spend less than $500 on each of their citizens a year. even nigeria, with its oil wealth, spends only $650 per person,ó shepherd said.the authors say governments should have a national development plan and make sure the poorest people are represented politically as well as trying to stop dif cult social customs, such as dowries and witchcraft, that make extreme poverty worse.nannannannan
