advanced	brazil’s latest funk sensation, anitta, has won millions of fans by taking the favela sound into the mainstream, but she is at the centre of a debate about skin colour.anti-discrimination campaigners and social commentators say the music industry’s fastest rising star has had to sacrifice her blackness to make it into the predominantly white middleclass market.the controversy was prompted by the publication of then-and-now photographs that show a dramatic lightening of anitta’s skin tone since she signed a deal with warner.in the first, when she was relatively unknown, she looked darker. in the second – a marketing shot after she became famous – she seems paler. whether this was the result of whitening products and cosmetic surgery or – more likely – photoshop tweaks, the contrast has rekindled discussion about whether you need to be pale to get ahead in brazil.jarid arraes, a psychology student and blogger, wrote a post criticizing the latent discrimination in media and marketing that she felt anitta’s image change represented. “people refuse to accept that they are racist and they think they live in a multiracial democracy, but the statistics show that is far from the case. the whitening shows us a profoundly intolerant society that doesn’t support diversity. white is the image of the rich, the nice, the successful, the good, while people see black as the opposite of all that.”born larissa de macedo machado, the diva-to-be was a church chorister in her childhood. in her teens, she made a name for herself in rio de janeiro’s baile funk scene as a dancer and singer.she has now exploded into the public consciousness with an album and a huge hit single, show das poderosas, which topped the charts and attracted 52 million youtube views.though adored first and foremost as a pop idol with a strong message and some catchy tunes, her backers project her as a cultural bridge between the predominantly black and mixed-race shanty towns on rio’s hillsides and the wealthier and whiter communities below.she has toned down the suggestive dancing, gangsta references and explicit lyrics of baile funk. now, however, questions are being asked about whether she – or her marketing team – have gone too far in re-tailoring her image to attract a more lucrative demographic. “if pop stars have curly hair, they are going to feel coerced into straightening it. if they have a big nose, they will be coerced into getting rhinoplasty,” said arraes. “it creates a vicious cycle for self-esteem.”this is a sensitive topic in this largely mixed-raced nation. brazil – one of the last big countries in the world to ban slavery – has the largest population of african descent outside africa, but race and ancestry are less important here than colour. and, despite the nation’s goal of being a multiracial democracy, there is a clear link between skin tone and inequality.in brazilian cities, white workers earn roughly twice as much as those of african descent. up until 2011, black or mixed-race students also spent two years less at school on average.the government says the gap is closing thanks to quota systems for university places and other forms of affirmative action. but the gulf remains glaringly apparent. the vast majority of business and government executives are white, while most menial jobs are done by black and mixed-race workers. walk through ipanema, gávea or other upmarket districts and you are far more likely to see black nannies pushing strollers with white toddlers than a white nanny pushing a black child.defining colour is complex. people who define themselves as white were in the minority for the first time in the most recent census in 2010. among the 197 million population, 82 million said they were “pardu” (mixed race), 15 million black, two million asian and 0.5% indigenous.sylvio ferreira, a psychology lecturer at the federal university of pernambuco, believes anitta has won the hearts of the middle class by taking a rebellious sound and making it tamer and more palatable to everyone.“was this achieved by racial whitening? no,” he said. “what happened was a change of the social space where anitta produced her art: from the periphery to the centre.”others agree that the issue of colour is overblown. maycon de mattos batista, a financial analyst who worked with anitta while she was an intern, said there had been a huge change in anitta’s image, but not of her colour.“i don’t believe it’s whitening; it’s more the way they are producing her with makeup, hairstylists and the way she dresses,” he said. “i don’t think that was because of pressure being put on her. she always liked to show off, sing and dance. that was a natural thing for her. i believe that it is because of this naturalness that she is where she is today.”leandro silva de souza, a racial equality activist in the north-eastern city of salvador, said the prejudice lay not with society but with music producers and media executives. the public, he said, proved they were interested in music for its own sake by choosing ellen oléria – a black lesbian – as the recent winner of the talent show the voice brazil.the guardian was unable to reach anitta for comment. but, in a recent interview, she described the need for identity to be self-defined.“all-powerful is a woman who doesn’t need to be beautiful, but she has so much attitude that she is marvellous, she is powerful. what i try to pass on in my work for everyone is that we can be who we want.”
advanced	throughout a momentous day at liverpool’s anglican cathedral for the families of the 96 people who died so needlessly at sheffield wednesday’s hillsborough football ground, one phrase dominated above all else: the truth. these were the words most infamously abused by a headline in the sun newspaper, above stories which we now know, in extraordinarily shocking detail, were fed by the south yorkshire police to deflect their own culpability for the disaster on to the innocent victims.margaret aspinall, whose son james, then 18, died at what should have been a joyful day out, an fa cup semi-final between liverpool and nottingham forest, said the families had been forced to fight, for 23 years, for just that: the truth. aspinall, chair of the hillsborough family support group, said that, although the families’ loss would never fade, she was “delighted” at the unequivocal, “profound” apology given for hillsborough’s savage failings by david cameron.the hillsborough independent panel had inspected 450,000 documents generated by the police, sheffield wednesday and all other bodies responsible, and delivered its remarkable 395-page report indicting official failings and vindicating the victims and football supporters.some of what happened to cause the disaster, and the police’s subsequent blame-shifting, has been exposed before. but the depth of what the families call a cover-up, in particular the deliberate police campaign to avoid its own responsibilities and falsely blame the supporters, was still startling.in a concerted campaign – led, the panel found, by the chief constable, peter wright – the south yorkshire police put out their story that drunken supporters or those without tickets had caused the disaster. the victims had their blood tested for alcohol levels. this was “an exceptional decision”, the panel said, for which it found “no rationale”. when victims had alcohol in their blood, the police then checked to find if they had criminal records.the report, substantially authored by professor phil scraton of queen’s university, belfast, and unanimously agreed by the panel of eight experts, found there was “no evidence … to verify the serious allegations of exceptional levels of drunkenness, ticketlessness or violence among liverpool fans”.the report found that even as the nightmare began for the families of the victims, wright was meeting his police federation in a sheffield restaurant to prepare “a defence” and “a rock-solid story”. the secretary of the south yorkshire police federation branch, constable paul middup, told the restaurant meeting before wright turned up: “the chief constable had said the truth could not come from him, but had given the secretary a totally free hand and supported him,” as had many senior officers.the meeting was held just four days after the disaster. it was the day that the sun splashed its headline “the truth” over lies fed to it by four senior south yorkshire police officers. middup was encouraged to continue this police campaign of defaming liverpool supporters for supposed drunkenness and misbehaviour and “to get the message – togetherness – across to the force”.the panel’s report sustained the allegation made in parliament that the orchestrated changing of junior officers’ statements by senior south yorkshire police officers amounted to a “black propaganda unit”. the officers’ statements, presented as official police accounts to the subsequent inquiry, were changed to delete criticism of the police themselves on the day, and, largely, emphasize misbehaviour by supporters. the panel found that 116 of 164 statements were amended “to remove or alter comments unfavourable to south yorkshire police”.the police had claimed this was done only to remove “conjecture” and “opinion” from the statements, but the panel had no doubt the operation, to craft a case rather than deliver truthful police accounts, went further. “it was done to remove criticism of the police,” scraton said.this propaganda did not convince the original inquiry, which ruled as quickly as august 1989 that the police stories of fan drunkenness and misbehaviour were false, and criticized the police for making the claims. the report revealed that sheffield wednesday’s football ground was unsafe in crucial respects, that the football association had selected it as the venue for the match without even checking if hillsborough had a valid safety certificate, which it did not.in that landscape of neglect, it was the mismanagement of the crowd by the police, commanded by an inexperienced chief superintendent david duckenfield, that was “the prime cause” of the disaster. the police lost control outside the ground, where 24,000 liverpool fans had to be funnelled through just 23 turnstiles, so duckenfield ordered a large exit gate to be opened and a large number of people to be allowed in. his “blunder of the first magnitude”, according to the inquiry, was the failure to close off the tunnel that led to the already overcrowded central section of the leppings lane terrace.the inquiry report established this but the police, undaunted, repeated their claims to the subsequent inquest. its procedure was marked by the coroner’s decision not to take evidence of what happened after 3.15pm on the day of the disaster, thereby excluding an emergency response the panel found to have been chaotic. the finding that 41 of the 96 who died could possibly have been saved had the police and ambulance service done their jobs decently is damning of those bodies and, aspinall said, difficult for the families to contemplate.in the light of the panel’s report, the attorney general will now consider whether to apply to the high court for the inquest verdict of accidental death to be quashed and a new inquest held. there may be prosecutions too, after all these years, of sheffield wednesday, south yorkshire police and sheffield city council, which failed in its duty to oversee the safety of the football ground. trevor hicks, the president of the hfsg, both of whose teenage daughters, sarah and victoria, died in the crush, said: “the truth is out today. tomorrow is for justice.”
advanced	crunchy, full of protein and to be found under a rock near you. insects have long been overlooked as food in all but a handful of places around the world – but now they are crawling closer and closer to our plates. spring 2013 will see a drive towards removing the yuck factor and putting insects not just on experimental gastronomic menus but also on supermarket shelves.in april, there will be a festival in london, pestival 2013 – a wellcome trust-backed insect appreciation event where the consumption of creepy-crawlies comes high on the agenda. it will feature a two-day “pop-up” restaurant by the nordic food lab, the scandinavian team behind the danish restaurant noma, which brought ants to the table for a sellout ten-day run at claridge’s hotel in mayfair in 2012.noma has been named the world’s best restaurant by restaurant magazine for three years running. its chef, rené redzepi, says that ants taste like lemon, and a purée of fermented grasshoppers and moth larvae tastes like a strong fish sauce. bee larvae make a sweet mayonnaise used in place of eggs and scientists are constantly coming up with new ways to use little creatures.in march, a bbc documentary will feature food writer stefan gates searching out and eating deep-fried locusts and barbecued tarantulas. but, behind all the gimmicks and jokes about flies in the soup there is a deeply serious message. many experts believe there is a clear environmental benefit to humans eating creepy-crawlies.the un’s food and agriculture organization (fao) has been funding projects since 2011 aimed at promoting the eating and farming of insects in south-east asia and africa, where an estimated two billion people already eat insects and caterpillar larvae as a regular part of their diet. in 2012, the fao published a list of 1,909 edible species of insect and, with sponsorship from the dutch government, plans a major international conference on “this valuable food source” in 2013.insects are plentiful – globally, for every human there are 40 tonnes of insects – so there is not too much chance of them being endangered, and they are unlikely to have been dosed with chemicals. “i know it’s taboo to eat bugs in the western world, but why not?”, redzepi has said. “you go to south-east asia and this is a common thing. you read about it from all over the world, that people are eating bugs. if you like mushrooms, you’ve eaten so many worms you cannot imagine. but also we eat honey, and honey is the vomit of a bee. think of that next time you pour it into your tea.”he said that the basic premise behind nordic food lab was: “nothing is not edible.”insects are critical to life on earth and, with more than a million species, are the most diverse group of creatures on the planet, yet they are misunderstood, hated and often put to death by humans just because they are there.over the next 30 years, the planet’s human population will increase to nine billion. already one billion people do not get enough food. the increase will mean more pressure on agricultural land, water, forests, fisheries and biodiversity resources, as well as nutrients and energy supplies.the cost of meat is rising, not just in terms of hard cash but also in terms of the amount of rainforest that is destroyed for grazing or to grow feedstuff for cattle. there is also the issue of methane excreted by cows. the livestock farming contribution, in terms of greenhouse gas emissions, is enormous – 35% of the planet’s methane, 65% of its nitrous oxide and 9% of the carbon dioxide.edible insects emit fewer gases, contain high-quality protein, vitamins and amino acids, and have a high food-conversion rate, needing a quarter of the food intake of sheep, and half of pigs and chickens, to produce the same amount of protein. they emit fewer greenhouse gases and less ammonia than cows and can be grown on organic waste. china is already successfully setting up huge maggot farms. zimbabwe has a thriving mapone caterpillar industry and laos was given nearly $500,000 by the fao to develop an insect-harvesting project. it’s already big business in the uk, though not always official: a man was recently detained by gatwick customs as he stepped off a flight from burkina faso with 94 kilos of mapone, worth nearly £40,000, in his luggage.a study by foodservicewarehouse.com suggested that swapping pork and beef for crickets and locusts could help to reduce greenhouse gas emissions by as much as 95%. but perhaps the fairest thing about eating worms and insects comes when we are dead – then they get a chance to nibble their own back.
advanced	the vast fortunes made by the world’s richest 100 billionaires are driving up inequality and hindering the world’s ability to tackle poverty, according to oxfam.the charity said the accumulation of wealth and income on an unprecedented scale, often at the expense of secure jobs and decent wages for the poorest, undermined the ability of people who survive on aid or low wages to improve their situation and escape poverty.oxfam said the world’s poorest could be lifted out of poverty several times over if the richest 100 billionaires would give away the money they made in 2012.without pointing a finger at individuals, the charity argued that the $240bn net income amassed in 2012 by the richest 100 billionaires would be enough to make extreme poverty history four times over.it is rare for charities to attack the wealthy, who are usually regarded as a source of funding. bill gates and warren buffett are among a group of 40 us billionaires who have pledged much of their wealth to aid projects, but there is little detail about the level of their annual donations. their actions have also not been matched by russian, middle eastern or chinese billionaires.in the report, the cost of inequality: how wealth and income extremes hurt us all, published just before the world economic forum in davos, the charity calls on world leaders to curb income extremes and commit to reducing inequality to at least 1990 levels.the report found that the richest 1% had increased their incomes by 60% in the past 20 years, with the financial crisis accelerating rather than slowing the process.barbara stocking, oxfam’s chief executive, said extreme wealth was “economically inefficient, politically corrosive, socially divisive and environmentally destructive”.she said studies show that countries suffer low levels of investment and growth as workers are forced to survive on a smaller share of total incomes.she said: “we can no longer pretend that the creation of wealth for a few will inevitably benefit the many – too often the reverse is true.”the report said the issue affected all parts of the world. “in the uk, inequality is rapidly returning to levels not seen since the time of charles dickens [the nineteenth-century novelist]. in china, the top 10% now take home nearly 60% of the income. chinese inequality levels are now similar to those in south africa, which is now the most unequal country on earth and significantly more unequal than at the end of apartheid.”in the us, the share of national income going to the top 1% has doubled since 1980 from 10 to 20%, the report says. for the top 0.01% the share of national income is above levels last seen in the 1920s.the world bank and international monetary fund have argued that extreme income inequality undermines growth and both organizations have attempted to tie their loans to programmes that limit the growth of inequality.members of the richest 1% are estimated to use as much as 10,000 times more carbon than the average us citizen.oxfam said world leaders should learn from countries such as brazil, which has grown rapidly while reducing inequality.stocking said: “we need a global new deal to reverse decades of increasing inequality. as a first step, world leaders should formally commit themselves to reducing inequality to the levels seen in 1990.”she said closing tax havens, which the tax justice network says hold as much as $31 trillion, or as much as a third of all global wealth, could yield $189bn in additional tax revenues.
advanced	dna taken from the wisdom tooth of a european hunter-gatherer has given scientists an unprecedented glimpse of modern humans before the rise of farming. the mesolithic man, who lived in spain around 7,000 years ago, had an unusual mix of blue eyes, black or brown hair and dark skin, according to analyses of his genetic make-up.he was probably lactose intolerant and had more difficulty digesting starchy foods than the farmers who transformed diets and lifestyles when they took up tools in the first agricultural revolution.the invention of farming brought humans and animals into much closer contact and humans likely evolved more robust immune systems to fend off infections that the animals passed on. but scientists may have overestimated the impact farming had in shaping the human immune system, because tests on the hunter-gathererõs dna found that he already carried mutations that boost the immune system to tackle various nasty bugs. some live on in modern europeans today.òbefore we started this work, i had some ideas of what we were going to find,ó said carles lalueza-fox, who led the study at the institute of evolutionary biology in barcelona. òmost of those ideas turned out to be completely wrong.óthe spanish team started their work after a group of cavers stumbled upon two skeletons in a deep and complex cave system high up in the cantabrian mountains of northwest spain in 2006. the human remains, which belonged to two men in their early 30s, had been extremely well preserved by the cool environment of the cave.carbon dating put the remains at around 7,000 years old, before farming had swept into europe from the middle east. the timing fitted with ancient artefacts found at the site, including perforated reindeer teeth that were strung and hung from the peopleõs clothing.the scientists focused their efforts on the better preserved of the two skeletons. after several failed attempts, they managed to reconstruct the manõs entire genome from dna found in the root of a third molar. it is the first time researchers have obtained the complete genome of a modern european who lived before the neolithic revolution.the dna threw up a series of surprises. when lalueza-fox looked at the genome, he found that, rather than having light skin, the man had gene variants that tend to produce much darker skin. òthis guy had to be darker than any modern european, but we donõt know how dark,ó the scientist said.another surprise finding was that the man had blue eyes. that was unexpected, said lalueza-fox, because the mutation for blue eyes was thought to have arisen more recently than the mutations that cause lighter skin colour. the results suggest that blue eye colour came first in europe, with the transition to lighter skin ongoing through mesolithic times.on top of the scientific impact, artists might have to rethink their drawings of the people. òyou see a lot of reconstructions of these people hunting and gathering and they look like modern europeans with light skin. you never see a reconstruction of a mesolithic hunter-gatherer with dark skin and blue eye colour,ó lalueza-fox said.the spanish team went on to compare the genome of the hunter-gatherer to those of modern europeans from different regions to see how they might be related. they found that the ancient dna most closely matched the genetic make-up of people living in northern europe, in particular sweden and finland.the discovery of mutations that bolstered the immune system against bacteria and viruses suggests that the shift to a farming culture in neolithic times did not drive all of the changes in immunity genes that europeans carry today. at least some of those genetic changes have a history that stretches further back. òone thing we donõt know is what sort of pathogens were affecting these people,ó said lalueza-fox.martin jones, professor of archaeological science at cambridge university, said the immunity genes were the most striking result. òthere is a no doubt oversimplified grand narrative that the move from a hunter-gatherer lifestyle to settled farming was initially bad for our health. a number of factors contributed, particularly living closely together with other humans and animals, shrinking the food web and crowding out water supplies. the authors are drawing attention to the role of pathogens in pre-agricultural lives and that is interesting.ó
