intermediate	two mothers in south africa have found out that they are raising each otherõs daughters after they were mistakenly switched at birth in a hospital in 2010.but, while one of the women wants to correct the error and get her biological child back, the other is refusing to give back the girl she has raised as her own.henk strydom, a lawyer for one of the mothers, described the swap as a travesty and tragedy that is unlikely to have a happy ending.both mothers gave birth at the tambo memorial hospital in boksburg, east of johannesburg, on the same day in 2010. ònobody suspected anything,ó strydom said.but, in 2013, one of the mothers, who is 33 and unemployed, sued her ex-partner for maintenance for her daughter. strydom said: òthe man denied he was the father. a dna test was done and it was found it was not his baby and not her baby. she was devastated. she didnõt know what to do.óeventually, she met the other mother and, since december 2013, they have been attending joint counselling sessions, arranged by the hospital. here they have met their biological daughtersstrydom said of his client: òshe said there are resemblances to herself. she told me that it was traumatic. you can see itõs not easy for her. she has to care for a child that is not hers on her own while her child is with someone else.óthe woman became unhappy with the process and asked the childrenõs court to give her custody of her biological child, but the other mother refused.òitõs a tragedy. she wants the baby back, but itõs four years later: you can understand that the other mother doesnõt want to give up her baby,ó strydom said.the high court in pretoria has asked the university of pretoriaõs centre for child law to investigate what will now be in the best interests of the children.strydom added: òi donõt know what the court will decide. your guess is as good as mine. but, whatever happens, someone wonõt be happy.óhe said, at this point, he and his client do not want to sue the hospital or government health department, which is helping with the case and providing counselling.the centre for child law will interview the mothers and fathers, as well as any other person with a òsignificant relationshipó with either of the girls. the children and mothers will have clinical assessments and may be seen by a psychologist.karabo ngidi, a lawyer with the centre, said: òwhatõs going to happen must be in the best interests of the children. biology is an important aspect but not the only one.ó the families are of zulu ethnicity and so zulu tradition, culture and customary law will be a factor, she added. it is also still possible the ex- partner of the mother who is taking legal action could be the biological father of the girl who was switched.it is not the first child-swap case in south africa. in 1995, two mothers were awarded damages after their sons, born in 1989, were accidentally switched at the johannesburg hospital where they were born.in 2009, in oregon in the united states, dee ann angell and kay rene reed discovered that they had been mistakenly mixed up at birth in 1953 when a nurse brought them back from bathing.in 2013, in japan, a 60-year-old man swapped at birth from his rich parents to a poor family was given compensation. he grew up on welfare and became a truck driver, whereas his biological brothers and sisters ð and the boy brought up in his place ð attended private secondary schools and universities.bruce laing, a clinical psychologist in johannesburg, said the long-term effects of a baby swap could be òprofoundó, òterrifyingó and òincredibly traumatizingó. he told the times of south africa: òthe parents might always be thinking ôwhat if?õó
intermediate	will we soon live in a world where drones deliver packages? if you believe amazon, the answer is òyesó. others are not so sure: we need to make more technical progress in this area but there is also the problem of public safety.amazon spokesman paul misener told a us congress hearing recently that his company would be ready as soon as all the rules were in place. the federal aviation authority (faa) will  nally have regulations on the commercial use of unmanned aircraft by june 2016. but the technology has a long way to go before then and larger machines arenõt legal yet ð only drones up to 25kg will be legal. and the faa says that, if youõre going to crowd the skies with radio- controlled  ying robots, they must all use different radio frequencies that nobody can jam or hijack.professor sajiv singh, who runs a cargo delivery company called nearearth, said that, to pilot a state-of-the-art drone, you simply give it some basic instructions: go to this altitude, perform this short task, go back home. but even short  ights from a mobile landing pad could cause serious logistical problems, he said.òtheyõre not going to deliver from one uninhabited place to another uninhabited place; theyõre going to deliver from a warehouse to the consumer, which will probably be an urban area or a suburban area,ó he said. òin those particular cases, there are going to be hazards that the vehicle is going to have to see. maybe there will be terrain that the map doesnõt know about. then, maybe thereõs construction equipment that wasnõt there before but is there now. maybe gps signals are blocked, in which case itõs going to have an incorrect idea about where it is.ó all these problems can be solved, he said ð but itõs dif cult.one major problem is maintaining radio contact with a drone and planning for what happens if that contact breaks. òif you have an off-the-shelf uav [unmanned aerial vehicle], itõll just keep going and crash into the ground,ó said roboticist daniel huber.furthermore, òyou canõt do everything with a 25kg aircraftó, said jay mcconville, director of business development for unmanned systems at lockheed martin. òpeople in the aircraft business have to remind ourselves that the operator doesnõt really care about every little thing about the aircraft and wants instead to focus on the end result,ó he said. òoperators want to see vehicle status information; they want to see video on their handheld device or their laptop.óòtechnologically, most of the things that we need for this are in place,ó said huber. he is working on a program to allow drones to inspect infrastructure ð pipelines, telephone lines, bridges and so on. òweõve developed an exploration algorithm where you draw a box around an area and it will  y around that area and look at every surface and then report back.óhuber, who works on 3d systems imagery, said about amazon: òi have heard them say that many packages are lightweight ð a drone can carry a kilogram for 15 minutes. if you have a vehicle that can go into a neighbourhood, it can deliver from that base. you need a 15-minute distance and typical off-the-shelf drones have that distance.ó itõs one way, he said, of making sure the surrounding population is relatively safe. òthe larger you get, the more dangerous you get.óproblems with the use of drones can be solved in some very dramatic ways, huber said. at a recent conference, he said, a disaster relief drone company demonstrated a robot that could take off and, when it got tired, land on its own charging station and exchange its batteries.of course, safety is still a major concern ð singh says that, for a commercial aircraft to be allowed to  y, it has to prove a rate of one serious failure every one million hours. drones, he said, are a long way from that. òthe reaper drone has one failure in 10,000 hours,ó singh said. but they donõt consider an oil leak a catastrophic failure ð something has to fall out of the sky.part of the reason for this is that air travel is dangerous so standards are much higher. òif you  y commercial airlines, they often say, ôoh, a component has failed ð we have to go back to the gate,õó singh said. òand thatõs an established industry with 60 years of legacy! i hate to think that a drone might come down on a busy road.ó part of the solution, singh said, is planning for every situation: òif things fail, the vehicle has to do something reasonable.ónan
intermediate	some people call it ‘the hotel of mum and dad’. a fifth of young adults are staying in the family home until they are at least 26 and the same proportion are not paying a penny towards their keep. a recent survey found that the proportion of adults living at home varied around the country, from just under 9% in the east midlands to more than double that in london, where house prices and rents are highest. while many around the country contributed financially, it found that 20% were paying nothing at all.young adults are squeezed by low wages and high rents, while those who want to buy a property are finding the monthly cost of renting is preventing them from saving enough to get on the housing ladder. recent research showed half of tenants were unable to save a penny towards a deposit, while a quarter could only save £100 or less each month. mortgages are cheaper than ever before thanks to record low interest rates but the best deals are still only given to people with large deposits.as a result of this, young adults are increasingly returning to the family home to save money and parents who cannot afford to offer their children a large sum of money seem happy to help. the survey found that 28% of adults were living at home because they were trying to save for a deposit. however, it also found that 30% were not saving any money.michael day, 30, who lives with his parents in bristol, says he has been caught between paying high rents and saving for a mortgage deposit. rents for a one-bedroom home in the city are between £500 and £800 a month, while buying a similar property would cost about £130,000. “i don’t really want to move out to rent as it’s more than a mortgage but you need such a big deposit to get a mortgage so it’s a vicious circle.”he does not want to share with strangers so his options are limited. at home, he pays a nominal rent to cover bills and is able to keep the rest of his earnings from his job. he admits that, instead of saving, he spends his spare money on golf and holidays. “you need so much money that i will have to save for the foreseeable future,” he said. “because it’s been so difficult, i’ve been going on holiday and enjoying it.”sue green, of saga, a business that sells insurance to people over 50, said the majority of parents may not have planned to have their children living with them in their 20s or 30s. “most will be more than happy to have them in the family home rent-free because it might help their kids get on the property ladder sooner,” she said. “children who don’t pay rent may contribute in other ways like buying groceries, family takeaways or doing odd jobs around the home.”angus hanton, of the intergenerational foundation thinktank, said older generations were “the architects of the housing crisis” and children should not be blamed for staying at home. “the under-30s have suffered a reduction in average incomes of about 20% since the 2008 downturn. rents and car insurance have never been so high and mortgage lending rules are now stricter for the young but not for older buy-to-let investors, who squeeze out the young,” he said. “many jobs on offer – zero-hour and short-term contracts – are turning younger workers into second-class citizens. rather than blaming the young, we should help them so they can afford to build lives of their own.”jenna gavin, 29, lives in southport, merseyside, in the family home where she grew up. she works as a medical receptionist nearby so she wants to stay in the area. but renting a one-bedroom flat would cost more than £420 a month not including bills, which would use a lot of her earnings. “i don’t want to rent – i don’t want to spend all that money and have nothing at the end,” she said. “i’ve looked at buying and seen mortgage advisers but i just can’t borrow enough to get on the property ladder.”gavin is trying to save for a deposit. “it’s difficult to save enough money – even a 5% deposit is such a lot of money and i would like to have a bigger deposit,” she said. her parents are happy not to charge her rent. “they want me to try to save up and i contribute in other ways – i buy food and i do things around the house.”gavin gets on with her parents and has her own space in a room that she moved into when she was 14 but she said she had always imagined she would have her own place by the time she was 30. “i don’t see that happening, as it’s next year. but, hopefully, in a couple of years, i’ll move out.”nan
intermediate	margaret thatcher, the best known british prime minister since winston churchill in 1940 and a global supporter of free market economics, has died. the british government announced that she would receive a ceremonial funeral at st paul’s cathedral.the british prime minister, david cameron, said: “it was with great sadness that l learned of lady thatcher’s death. we’ve lost a great leader, a great prime minister and a great briton.” he added: “as our first woman prime minister, margaret thatcher succeeded against all the odds, and she didn’t just lead our country, she saved our country.” he added that he believed she would be remembered as the greatest british peacetime prime minister.in a statement, president barack obama said, “here in america, many of us will never forget her standing shoulder to shoulder with president reagan, reminding the world that we can shape the currents of history with our moral beliefs, courage and iron will.”the first woman elected to lead a major western state, margaret thatcher served 11 years at no 10 downing street before members of her own party removed her in 1990.thatcher, who was 87, had been in poor health for some years, suffering from dementia. when they heard of her death, politicians from all parties sent tributes.labour party leader, ed miliband, said: “she will be remembered as a unique figure. she reshaped the politics of a whole generation. she was britain’s first woman prime minister. she moved the centre ground of british politics and was a huge figure on the world stage. the labour party disagreed with a lot of what she did and she will always be a controversial figure. but we can disagree and also greatly respect her political achievements and her personal strength.”the deputy prime minister, nick clegg, said: “margaret thatcher was one of the most important figures in modern british politics. whatever party you support, no one can deny that as prime minister she left a unique and lasting imprint on the country she served.”describing her as a political phenomenon, the former conservative prime minister sir john major said: “her outstanding characteristics will always be remembered by those who worked closely with her: courage and determination in politics, and humanity and generosity of spirit in private.”the “iron lady” was a cold war ally of the us president ronald reagan in the final showdown with the soviet union, which broke up as a result of reformist pressures led by mikhail gorbachev, a kremlin leader with whom thatcher famously said she could “do business”. as a result, many ordinary voters in ex-soviet bloc states saw her as someone who supported their liberty.thatcher was an unremarkable conservative until she unexpectedly became party leader in 1975. within ten years, she had become known around the world – both admired and hated – for her pro-market reforms in the uk and her implacable attitudes in foreign policy, including her long battle with the ira, which almost succeeded in murdering her with a bomb in 1984.at home, thatcher was associated with denationalization of state-owned industry – the new word “privatization” became used in many countries – and defeat of militant trade unions, particularly the national union of miners, whose one-year strike (1984–85) was traumatic. with money from britain’s north sea oil fields, thatcher was able to change the ageing industrial economy and she used the opportunity to defeat her enemies – including moderate members of her own party.in the european union she got a rebate for britain – “my money” as she called it. she was less successful in controlling the european commission, who wanted to centralize power in europe, especially in the years when it was led by the french socialist jacques delors.as the british economy recovered from the very bad recession that her policies had caused, she seemed invincible for a short time. but unlimited power and the defeat or retirement of allies led to mistakes and increasing unpopularity. when her deputy finally fell out with her – mainly on the subject of europe – his damaging resignation speech led to a leadership challenge. after a vote among conservative mps failed to support her, john major took control of the party.after she retired, she wrote highly successful memoirs and campaigned energetically for the thatcher foundation, which aimed to promote her values around the world.nannannan
elementary	at addis ababa airport, visitors see pictures of golden grains, tiny red seeds and a group of men around a giant pancake. the words say: “teff: the best gluten-free crop!”ethiopia is one of the world’s poorest countries, well known for its difficult food situation. but it is also the home of teff, a highly nutritious grain that you can now buy in health-food shops and supermarkets in europe and america.teff’s tiny seeds – the size of poppy seeds – are high in calcium, iron and protein, and also amino acids. you can use the gluten-free grain instead of wheat flour in anything from bread and pasta to waffles and pizza bases.in ethiopia, teff is a national obsession. it is grown by about 6.3 million farmers – fields of the crop cover more than 20% of all farmland. they make it into flour and use it to make injera, the flatbread that is basic to ethiopian cooking. the grain is also important in many religious and cultural ceremonies. across the country, people meet around large pieces of injera. they use it to scoop up stews and to feed one another as a sign of loyalty or friendship – a tradition known as gursha.teff is now called ethiopia’s “second gift to the world”, after coffee.ethiopia’s growing middle class want more teff. this has increased the price of teff, so it is now too expensive for the poorest people. today, most small farmers sell most of what they grow to people in ethiopian cities.teff is the most nutritionally valuable grain in the country. in urban areas, people eat up to 61kg of teff a year. in rural areas, they eat 20kg. the type of teff people eat is different, too: the rich eat the more expensive magna and white teff; poorer people usually eat less-valuable red and mixed teff. they also mix it with cheaper cereals such as sorghum and maize.the ethiopian government wants to double teff production by 2015. it says that the grain could play an important role in school meals and emergency aid programmes, and help reduce malnutrition – particularly among children.in ethiopia, around 20% of children under five are malnourished.the government does not allow the export of raw teff grain, only of injera and other processed products. but this could change: the goal is to produce enough teff for ethiopia and for export.mama fresh is a family company that sells injera to top restaurants and hotels in the ethiopian capital. it also exports the flatbread to finland, germany, sweden and the us, mostly for ethiopians who live there. but the company wants to double exports to america in 2014 and will soon start producing teff-based pizzas, bread and cookies.regassa feyissa, an ethiopian agricultural scientist, says that, without careful planning, growing more teff for export may mean that farmers do not grow other important crops.there is not much ethiopian teff on the international market, so farmers in the us have started planting the crop. farmers in europe, israel and australia have also experimented with growing it.nannannannannan
elementary	it is no secret that millenials use social media a lot. more than eight in ten say they sleep with a mobile phone by their bed, almost two thirds say they text while driving and three quarters have created a pro le on a social networking site. but some millenials donõt use social media at all. here are four of them.celan beausoleil, 31, oakland, california beausoleil is a social worker and has had an òon and offó relationship with facebook. she deleted her account recently because the amount of personal information about other people was too much for her.òin my job, i spend a lot of time listening to peopleõs lives all day, every day and it started to feel too much to go on social media and see every detail of everybodyõs lives, including people that i donõt know very well,ó she said.but she loves the way social media connects the world in a unique way. òone thing i really liked about facebook was that i could sit for hours and click on a friend and then click on one of their friends and  nish on someoneõs facebook page from the other side of the world,ó she said. òi used to do that all the time.ójason mathias, 26, baltimore, maryland òone day, i realized: iõm spending so much time doing this. i wonder what it would be like if i didnõt spend this time here and spent it doing something else. what if i was doing other things with these seconds? what would they become? would i enjoy it?ómathias had facebook and twitter accounts for years but deleted them in november 2012. he òquickly forgot that facebook existed but he can still understand the bene ts of having social media accounts, for example how easy it is to organize large events online.but now he loves his extra free time. he spends his spare moments at work reading news articles and books. and with no friends to follow online, he has to òpick up the phone and call themó, something he now enjoys.lauren raskauskas, 22, naples, florida raskauskas describes herself as a òprivateó person. so she doesnõt like social media much. she has deleted her twitter account and deleted her facebook account two years ago when she realized that she òdidnõt like everyone knowing what i was doingó.she recently broke up with her partner. the last time she broke up with someone and she was online, it was not nice. òone time, i broke up with somebody while i was on facebook and i thought ôoh my gosh, should i change my pro le photo? should i change my status?õ and this time i donõt have to worry about that,ó she said.hariharan rajagopalan, 18, boston, massachusetts rajagopalan,a student at boston college, doesnõt see a problem with not using social media. he says that he òhasnõt seen any effect at this pointó. his classmates post about parties and events on facebook but they send him a text message, too, he said.rajagopalan has only used social media once: it was the only way to contact his new roommate at college. before starting his  rst year at college, he joined facebook to contact his future roommate and talk about their plans for that year.he still has the account but he says: òi donõt use it. i donõt check it.ónannan
elementary	seaworldõs pro ts fell by 84% and customers are staying away from the water theme park company because a  lm claimed that it mistreated orca whales.the company teaches dolphins and killer whales to do tricks in front of large crowds of people. it says fewer people are going to its parks and pro ts have reduced.seaworld has been in the news since the 2013 documentary  lm black sh, which said that seaworld mistreated orca whales ð this made the whales act violently and caused the deaths of three people.animal rights organizations say that orcas kept in tanks die at a younger age than wild whales. seaworld started a national marketing campaign to show this isnõt true.seaworld has reduced ticket prices and spent $10m on a marketing campaign. but seaworld ceo joel manby said that the company still  nds it dif cult to convince people that it treats its whales well.òwe realize we have much work to do,ó manby said. talking about the companyõs reputation, he said, òearly feedback on our marketing campaign has been positive.óòwe will continue to  ght with the facts because the facts are on our side,ó he said.manby joined the company as ceo in 2015 to help the company recover. he will give a presentation about his ideas for the future of the company on 6 november.there are already plans for a new shark exhibition in orlando and an attraction in san antonio that will allow customers to swim with dolphins.the companyõs  nancial report from 6 august showed that their pro t in the second quarter dropped from $37.4 million in 2014 to $5.8 million in 2015. this is an 84% decrease. at the same time, the number of visitors dropped by more than 100,000 from 6.58 million to 6.48 million.people for the ethical treatment of animals (peta) is an organization that is against seaworld. jared goodman from peta said: òseaworld has lots of problems. animals are dying in its tanks and tens of thousands of people do not want it to build a new orca prison. families donõt want to buy tickets to see orcas going insane inside tiny tanks and seaworldõs pro ts wonõt increase until it closes its parks and builds sanctuaries by the coast.óseaworldõs shares, which were worth $39 in 2013, fell to just under $18 in august 2015.ó nan
