intermediate	a mirror that sends heat into cold space has been designed by scientists to replace air-conditioning units that keep buildings cool on earth.researchers believe the mirror could slash the amount of energy used to control air temperatures in business premises and shopping centres because they wonõt need to use cooling systems.around 15% of the energy used by buildings in the usgoesonairconditioningbuttheresearchersõ say that, in some cases, the mirror could completely offset the need for extra cooling.in a rooftop comparison in stanford, california, scientists found that a roof that had been painted black reached 60c more than the air temperature in sunlight and aluminium reached 40c more. however, the mirror was up to 5c cooler than the surrounding air temperature.òif you cover signi cant parts of the roof with this mirror, you can see how much power it can save. you can signi cantly offset the electricity used for air conditioning,ó said shanhui fan, an expert in the study of light at stanford university, who led the development of the mirror. òin some situations, you will be able to completely offset the air conditioning.óbuildings warm up in a number of different ways. hot-water boilers and cooking areas release heat into their immediate surroundings. in hot countries, warm air comes in through doors and windows. then, there is visible light and infrared radiation from the sun, which also heat up buildings.the stanford mirror was designed to re ect 97% of the visible light that falls on it. but, more importantly, it works as a thermal radiator. when the mirror is warmed up, it releases heat at a speci c wavelength of infrared light that passes easily through the atmosphere and out into space.to make anything cool, you need what engineers call a heat sink: somewhere to put unwanted heat. the heat sink has to be cooler than the object that needs cooling or it will not do its job. for example, a bucket of ice will cool a bottle of wine because it becomes a sink for heat in the liquid. the stanford mirror relies on the best heat sink: the universe itself.the mirror is built from several layers of very thin materials. the  rst layer is re ective silver. on top of this are layers of silicon dioxide and hafnium oxide. these layers turn the mirror into a thermal radiator. when silicon dioxide heats up, it radiates the heat as infrared light at a wavelength of around ten micrometres and the heat passes straight out to space. the total thickness of the mirror is around two micrometres or two thousandths of a millimetre.òthe cold darkness of the universe can be used as a renewable thermodynamic resource, even during the hottest hours of the day,ó the scientists write in nature. in tests, the mirror had a cooling power of 40 watts per square metre at outside temperatures. writinginthejournal,fansaysthatthecostofthe mirrors is between $20 and $70 per square metre. he calculates an annual electricity saving of 100mwh on a three-storey building.fan said that the mirror could cool buildings but he said that the mirrors would not slow down global warming. òroof space is only a small portion of the earthõs surface so the mirror is not a solution to the problem of global warming. but our mirror will help limit greenhouse gas emissions by reducing electricity consumption,ó he said.òiõm really excited by the potential it has,ó said marin solja__i__, a physicist at the massachusetts institute of technology. òyou could use this on buildings and spend much less money on air conditioning or maybe you wouldnõt need it at all. you could put it on top of shopping malls.ó òiõm really excited by the potential it has,ó said marin solja__i__, a physicist at the massachusetts institute of technology. òyou could use this on buildings and spend much less money on air conditioning or maybe you wouldnõt need it at all. you could put it on top of shopping malls.ó òiõm really excited by the potential it has,ó said marin solja__i__, a physicist at the massachusetts institute of technology. òyou could use this on buildings and spend much less money on air conditioning or maybe you wouldnõt need it at all. you could put it on top of shopping malls.ó nan
intermediate	according to a new census, there are more tigers in nepal than at any time since the 1970s. this has given conservationists hope that the big cats, whose numbers have been dropping across south asia for 100 years, can be saved.the number of wild royal bengal tigers in nepal has increased to 198 – a 63.6% rise in five years – the government survey showed. “this is very good news,” said maheshwar dhakal, an ecologist with nepal’s department of national parks and wildlife conservation.the census is based on the examination of pictures from more than 500 cameras in five protected areas and three wildlife corridors. more than 250 conservationists and wildlife experts worked on the survey, which cost about £250,000. dhakal said that a similar survey was done in india and the results from both countries will be published later in 2013. “it will take a few more months for india, which now has 1,300 big cats in several huge protected areas, to finish the survey,” he added. nepal has promised to double the population of tigers by the year 2022 from 121 in 2009 when the last systematic tiger count took place.increasing wealth in asia has led to higher prices for tiger skins and the body parts used in traditional chinese medicines. international gangs pay poor local nepali large amounts of money to kill the cats. the skin and bones are given to middlemen, who pass easily through the border with india, where the major dealers are based.one major problem is that some senior officials help mafia networks involved in the trade. conservation experts believe that the increase in tiger numbers is the result of better policing of national parks and better management of tiger habitats in nepal, where forests cover 29% of the land. but they say nepal needs to do more to protect the habitat and animals on which tigers feed so the big cats have enough space to roam and food to eat.as the number of tigers has increased over the years, conflict with villagers has increased, too. seven people were killed in attacks by tigers around national parks in 2012 compared to four in 2011, park officials said. villagers also want better protection. “the government is making conservation plans for tigers. but it should also produce plans to protect people from tigers,” krishna bhurtel, a village headman, told a nepali newspaper. wildlife authorities captured a tiger after it killed two people, including a villager who was pulled from his bed in may.thousands of tigers once roamed the forests in bangladesh, india and nepal. but their numbers have dropped to about 3,000, a 95% drop over a century. chitwan national park in central nepal has the highest number of adult tigers, with 120, followed by bardiya national park (50) and shukla phanta wildlife reserve (17).diwakar chapagain, head of a world wildlife fund nepal unit that monitors wildlife trade, said tiger skins were in demand in tibet, where rich people use them as festival costumes.in nepal, kings used to stand on tiger skins for special occasions. some wealthy nepali have tiger heads on the walls of their living rooms. tiger bones are used in traditional chinese medicines. “the trade in tiger parts is lucrative and fetches thousands of dollars in illegal markets,” chapagain said.
intermediate	not many exercise classes have a tea break halfway through. but margaret allen’s does. after a gentle warm-up and a few quick exercises, the 93-year-old great-grandmother lets her group relax with a cup of tea and a quick rest.some of the class of eight look as if they need to rest more than others. allen herself, wearing a thick shirt, knitted waistcoat, slacks and sensible shoes, is not even sweating. despite an extremely painful trapped nerve in one leg and a knee in need of replacement, she looks like she could go on for hours.the general rule is that eating just before doing sport is not a good idea and especially not halfway through the class. but, on the afternoon i visit allen’s class in saltburn-by-the-sea near middlesbrough, slices of fruitcake are being passed around during the break. the cake has been baked to celebrate allen’s recent birthday by her 89-year-old sister, joan.the ladies have just finished their cake when allen is up again, leading the group through a lively scottish tune with lots of toe pointing and leg kicking. forty-five minutes later, the class is finally over.allen, a former volunteer with the charity red cross, has been leading classes in the north-east town for 45 years. she wasn’t particularly sporty at school, but she started playing the piano for a keep-fit class during the second world war and eventually took over in her 40s when the previous instructor retired.at one time, allen’s class had more than 18 regulars, each paying £1 a time. but, these days, the group is getting smaller – during the tea break, the ladies discuss a funeral that most of them had attended that week for one of the younger members of the group who had just died, aged 68.allen is the oldest, followed by her sister. the baby of the group is 60-year-old jean cunion, who is a bit embarrassed to admit that she is perhaps the least fit of the group. “i remember, the first time i came, margaret said, ‘who’s that huffing and panting?’ and i had to admit it was me.” ruth steere, 76, says allen always knows what’s going on, although her back is always to the class: “she always shouts at us if we go wrong. she’s remarkably good at knowing what we are doing.”allen, a keen dancer, has never done any formal training to be a fitness instructor. instead, she choreographs her own moves based on five tapes from the bbc’s first ever fitness guru, eileen fowler. allen thinks her good health is largely a result of keeping busy, especially since her husband died in 1997. she started writing poetry when she was 80.“i write poems about everything. i’m a prolific writer. i just can’t stop,” she says, when she phones me a few days after the interview to read out a poem she has written about the joys of exercise. one of the class, 84-year-old former teacher winnie robertson, thinks the secret to staying fit is never letting yourself go: “use it or lose it, that’s what i say.”allen still plays the piano and gives speeches. she did a computer course when she was 88. ageing is no fun, she admits, reading me a few lines from a poem she has written called ‘that beast called age’. she happily remembers a doctor who saw her for the first time a few years ago, who said she couldn’t possibly be more than 78: “i said, ‘thank you, doctor. you can go now.’”she also has a no-nonsense attitude to weight gain: “i just think people shouldn’t eat too much. whenever i hear someone saying, ‘oh, i can’t lose weight’, i say: ‘sellotape.’” she mimes taping her mouth shut. “i said this just the other day to a big fat man. everything in moderation is my motto.”earlier in 2013, allen was watching the news and saw a woman being given the british empire medal. “she was saying: ‘i’m 80 and i’m the oldest fitness instructor in the country!’ i was thinking: ‘no, you’re not.’ but i shan’t be writing to buckingham palace.”nan
intermediate	clay cockrell is sitting in his of ce across the street from 1 central park west, the address of the trump international hotel and tower. in front of the tower is central park, where cockrell holds his popular walk and talk therapy sessions.cockrell, a former wall street worker who is now a therapist, spends large parts of his days walking through central park or the battery park in downtown manhattan near wall street, as a con dant and counsellor to some of new yorkõs wealthiest peopleòmany of the extremely wealthy ð the 1% of the 1% ð feel that their problems are really not problems. but they are,ó he says.so, what issues do americaõs 1% have? òthere is guilt because they are rich,ó he said. òthere is the feeling that they have to hide the fact that they are rich. and, then, there is the isolation ð being in the 1% can be lonely.ócounsellors argue that things have become worse since the  nancial crisis and the discussion about income inequality brought on by movements like occupy wall street.òthe occupy wall street movement was a good one and had some important things to say about income inequality but it singled out the 1% as something negative,ó said jamie traeger-muney, a wealth psychologist and founder of the wealth legacy group. the media, she said, is partly to blame for making the rich òfeel like they need to hide or feel ashamedó.traeger-muney runs a global business and specializes in working with inheritors, who often get a bad reputation in the press. òsometimes, i am shocked by things that people say. you would never refer to another group of people in the way that it seems perfectly normal to refer to wealthy people.óòitõs really isolating to have a lot of money. peopleõs reactions to you can be scary,ó said barbara nusbaum, an expert in money psychology. òwe are all taught not to talk about money. itõs not polite to talk about money. but itõs harder to talk about having money than it is to talk about not having money. itõs much more socially acceptable to say ôi am broke. things are hard.õ you canõt say ôi have a ton of money.õ you have to keep a lot of your life private.óas a result, cockrell says, the rich usually hang out with other rich americans who understand them and their problems.in the us, over the last three decades, the number of extremely wealthy people has been increasing. according to research from spectrem group, in 2014, the number of us households with $1m or more ð excluding the value of their main home ð increased by 500,000 to 10.1m. households worth $5m or more reached 1.3m and 142,000 households are now worth $25m or more.since the 2008  nancial crisis, the income gap has grown and the situation òhas gotten worse for the wealthyó, cockrell said. the main reason? not knowing if your friends are friends with you or with your money.òsomeone else who is also a billionaire ð they donõt want anything from you. never being able to trust your friendships with other people, i think that is dif cult,ó said cockrell. òas the gap has widened, the rich have become more and more isolated.óthese are real fears of the richest of the rich. in 2007, the gates foundation and boston collegeõs center on wealth and philanthropy started to document what it felt like to be in americaõs 1%. for the next four years, researchers surveyed 165 of americaõs richest households ð 120 of those households have at least $25m. the report, the joys and dilemmas of wealth, was 500 pages long and seemed to prove the old saying that money canõt buy happiness.òwealth can stop you from connecting with other people,ó said the wife of a tech entrepreneur who made about $80m. some americans keep their wealth secret. òwe talk about it as stealth wealth. there are a lot of people that hide their wealth because they are worried about negative judgment,ó said traeger-muney. if wealthy americans talk about the problems that come with their wealth, people often say ôoh, poor you.õ there is not a lot of sympathy there,ó she said.speaking in his soft, soothing voice that makes you want to tell him all your worries, cockrell said that a common mistake that many of his wealthy clients make is letting their money define them.òif you are part of the 1%, you still have problems and they are real to you. even when you say, ôi donõt have to struggle for moneyõ, there are other parts of your life. money is not the only thing that de nes you,ó he said. òyour problems are real.ó nannannannan
elementary	lego’s profits rose strongly in the first half of 2014, helped by the success of its lego movie in the us and uk.the danish toy company sold a lot more products in europe, north and south america, and asia as children bought products linked to the film. the film took more than $250 million in the us and £31 million in the uk between february and april 2014.the movie cost about $60 million to make. it is entertaining and aimed at people who are likely to buy the company’s products.lego’s finance director, john goodwin, said that the lego movie products had a positive effect on profits during the first half of 2014. they are now waiting to see what will happen after the movie comes out on dvd in the second half of 2014.jørgen vig knudstorp, lego’s chief executive, said that lego were very happy that they have sold more products in the first half of 2014. he said this was a result of lego’s ability to develop, launch and distribute lego products, which children all over the world put at the top of their wishlists.lego, based in the small town of billund in denmark, started producing its plastic bricks in 1949 and became a popular and well-known children’s toy around the world by the 1970s.in 2003, the company nearly collapsed. then, knudstrop became lego’s new chief executive. he got rid of hundreds of products and, then, refocused the business on its bricks.the company opened its first factory in china in april 2014.
elementary	governments in europe dream of  nding a magic solution to rising unemployment. but, in the poorest parts of the eu, unemployment continues to rise.now, in sardinia, italy, a mayor thinks he has found an answer to his townõs unemployment problem. valter piscedda, the mayor of elmas, a small town near sardiniaõs capital, cagliari, wants to pay residents to leave. the town will pay for ten unemployed local people to take english lessons, get on a cheap  ight and look for jobs in other parts of europe.òthis idea comes from common sense and experience,ó he told the guardian. òin the past year and a half ð especially in the past few months ð i have seen young people, almost every day, who have lost hope that they will  nd work. some ask for help in  nding work here. others have tried everything and, now, they want to go and gain work experience abroad; life experience, too.óso he decided to help people who want to gain experience abroad.sardinia, and also much of southern and central italy, is struggling with high unemployment. unemployment was at 17.7% in the second quarter of 2014, according to italyõs national institute of statistics. more than 54% of people under 25 are out of work.for the adesso parto (now iõm leaving) programme, elmas will give û12,000 to the  rst ten applicants aged between 18 and 50. the applicants must be out of work and have lived in the town for three years. they do not have to be university educated and they must not earn more than û15,000.the idea of helping people to leave is sensitive at a time when many italians ð many of them clever young graduates ð are leaving their country every year. but piscedda believes that the people he is sending away might return òand give me back 100 times what we gave themó. more importantly, he wants the scheme to help the people most in need.in elmas, the scheme has got mixed reactions. òthere is little work here,ó said alessandro macis. òthe opportunity to go abroad to learn about the workplace and experience other cultures can be very worthwhile. the son of a friend of mine who didnõt study much is in london and heõs doing very well. he started as a waiter. now, heõs a cook and heõs learning english.óothers were not sure. i heard about it but i thought it was strange. if you have that money to pay for people to go away, why dont you use that money to keep them here? said consuelo melis, who works in a local cafe.but piscedda says, òthe work i can create, as mayor, is temporary. i can ask someone to clean a piazza. i can ask them to clean it again. i can ask someone to clean the streets. but these are all temporary things that give nothing more than a little bit of money for a few months.ónannannan
elementary	you’ve spent eight hours in the office. you’ve finished the most important work of the day. this is the time when most workers would think about going home.but, for millions of japanese employees, if they leave work and arrive home in time for dinner, people say that they are disloyal to their company.but now, the government is trying to do something about japan’s culture of overwork. it wants to make workers take at least five days’ paid holiday a year.japanese employees are allowed an average of 18.5 days’ paid holiday a year. companies must allow them a minimum of ten days’ paid holiday, plus 15 one-day national holidays. but very few employees take these days. most take only nine days of holiday, according to the labour ministry. many british workers think that a two-week summer holiday is their right but workers in japan think that a four-night vacation in hawaii is a big self-indulgence.by 2020, the government hopes that the law will make japanese employees follow the example of british workers, who take an average of 20 days’ paid annual leave, and workers in france, who take an average of 25.japan’s employees are respected and admired in the rest of the world for their commitment to the company. but they often have no time for anything else.couples don’t have time to start families. so, japan has a low birth rate and the population is declining. more employees are falling ill from stress or even dying through overwork.about 22% of japanese work more than 49 hours a week, compared with 16% of us workers and 11% in france and germany, according to data from the japanese government.“nobody else uses their vacation days,” says erika sekiguchi, a 36-year-old worker. she spends 14 hours a day at work and used only eight of her 20 days of paid vacation in 2014, six of which were sick leave.yuu wakebe, who works at the health ministry, admits that he does 100 hours of overtime a month. “it is a worker’s right to take paid vacations,” wakebe said. “but workers in japan have to do a lot of extra work for no money.”workers are scared that their colleagues will think they are not working hard enough. this is one reason for a rise in stress-related illness, early death and suicide. about 200 people die every year from heart attacks and strokes in japan, caused by long hours and hard work.nannannannan
