elementary	the vice-president of google has warned that digitized material from blogs, tweets, pictures, videos and official documents such as emails could be lost forever because the programs we need to view them will no longer exist. our first steps into the digital world could be lost to future historians, vint cerf told the american association for the advancement of science’s annual meeting. he said that we might become a “forgotten generation or even a forgotten century” because of “bit rot”, where old computer files become useless junk.cerf said we should develop digital methods to preserve old software and hardware to read old files. “so much of the information about our daily lives is in digital form, like our interactions by email, people’s tweets and all of the world wide web. so it’s clear that we could lose a lot of our history,” he said. “if we want to keep it, we need to make sure that people can still see the digital objects we create today in the future,” he added.what is ‘bit rot’ and is vint cerf right to be worried? his warning highlights an irony about modern technology: we digitize music, photos, letters and other documents so that they survive for centuries but the programs and hardware people will need to read those files don’t survive.“we are throwing all of our data into an information black hole. we digitize things because we think we will preserve them. but what we don’t understand is that, if we don’t do something, those digital versions may not be any better than the things that we digitized. in fact, they may be worse,” cerf says. “if there are photos you really care about, print them out.”ancient civilizations did not have these problems because people wrote histories down and we need only eyes to read them. to study today’s culture, future historians will have to read pdfs, word documents and hundreds of other file types, using special software and sometimes hardware, too.the problem is already here. in the 1980s, it was normal to save documents on floppy disks and buy computer games on cassettes. even if the disks and cassettes are in good condition, we can now only find the equipment to view them in museums.cerf warns that we will also lose important political and historical documents because of bit rot. in 2005, american historian doris kearns goodwin wrote a book about abraham lincoln. she went to libraries around the us and found the paper letters of the people involved. “in today’s world, those letters would be emails and it will be almost impossible to find them one hundred years from now,” said cerf.he admits that historians will try to preserve important material. but he says that people often don’t understand the importance of documents until hundreds of years later. historians have learned how archimedes thought about infinity in 3bc because they found his writings hidden under the words of a thirteenth-century book. “we’ve been surprised by what we’ve learned from objects that have been preserved by accident,” he said.researchers in pittsburgh are trying to find a solution to bit rot. they are creating a computer that can read old files.inventing new technology helps but it is only part of the solution. it could be even more difficult to get the legal permissions to copy and store software before it dies. “to do this properly, we might need to think about things like copyright. we’re talking about preserving documents for hundreds to thousands of years,” said cerf.
elementary	barack obama has told young people to reject pessimism and meet people who have different political beliefs if they want to change the world.on the last day of his last visit to britain as us president, obama told 500 youth leaders at a meeting in london: “reject the idea that there are things we can’t control. as jfk said, our problems are manmade and can be solved by man.”“you’ve never had better tools to make a difference,” he told the students at the question-and-answer session. “reject pessimism and know that progress is possible.”but obama said he knew that young people had many challenges. he said it was a time of great change, with 9/11, 7/7, and with so much information and bad news, for example on twitter.the president told the audience to meet and talk with people who have different political beliefs: “look for people who don’t agree with you and it will also help you to compromise.”obama said he was proud of his healthcare reforms and talked about the 2008 financial crisis: “i saved the world from depression – that was quite good.”he also said that his talks with iran and the response to the ebola crisis were some of the best things about his presidency.tanya williams, a community officer, said: “i like barack obama and it’s exciting to hear someone who has changed so much.”oliver sidorczuk, 26, said: “everyone is extremely excited to listen to what he has to say.”furqan naeem, from manchester, said: “i recently visited the united states and i saw some really important work the president did – the work brought different people together.”later, obama met labour party leader, jeremy corbyn, who said they had an “excellent” 90-minute discussion. they also talked about britain’s membership of the eu.after the meeting, obama played golf with british prime minister, david cameron. obama had dinner with cameron and the us ambassador, matthew barzun, and, then, travelled to germany.nannannannannannannannannan
elementary	passing clouds one of the good things about flying is seeing clouds very close. they seem to be light, but they carry a lot of water – around 500 tonnes in a small cloud. and water is heavier than air. so why don’t clouds fall out of the sky like rain? they do, but they take a very long time. an average cloud would take a year to fall one metre.on cloud nine most of us are happy to call clouds “fluffy ones” or “nasty black ones”, but there are more than 50 cloud types. the 50 cloud types fit into nine categories. cloud nine is the very big cumulonimbus, so to be “on cloud nine” means that you are on top of the world or very, very happy.around the rainbow the best place to see a rainbow is from a plane. rainbows are made when sunlight hits raindrops. we see a bow because the earth is in the way, but, from a plane, a rainbow is a complete circle.mr blue sky sunlight is white. it includes all the colours of the spectrum. as it passes through air, some of the light is scattered. blue light scatters more than other colours, so the blue looks like it comes from the sky.there’s life out there we usually only see clouds and other planes from a flying aircraft’s window, but the air is full of bacteria – 1,800 different types of bacteria.turbulence terror even someone who flies all the time can feel sick because of turbulence. the good news is that no modern airliner has ever crashed because of these sudden and violent movements of air. people have been hurt when they are not strapped in or falling luggage may hit them – but the plane is not going to fall out of the sky.you can’t cure jet lag the world is divided into time zones. when you take a long flight, the difference between local time and your body’s time causes jet lag. but jet lag can be reduced if you keep food bland for 24 hours before travel, drink a lot and live on your destination time from the moment you get on the aircraft.supersonic 747s many of us have travelled faster than sound. there are many jet streams in the air around the earth, especially on the journey from the us to europe. a jet stream can move as fast as 250 miles per hour. if an airliner flying at 550mph enters a jet stream, the result can be that the plane flies at 800mph. that’s faster than the speed of sound.flying through time flying across time zones means that we travel through time. but this time travel is so small that crossing the atlantic every week for 40 years would only move you 1/1,000th of a second into the future.terrible tea don’t blame the cabin attendant if your tea isn’t great. water should be just under 100°c when you pour it on to tea leaves – but that isn’t possible on a plane. it’s impossible to get water hotter than 90°c during flight – so choose coffee.i can’t hear my food people often say that airline food is bland and without taste. but some of the problem may not be bad food. a plane is a noisy place and food loses some of its taste when there are loud noises.needle in a haystack with modern technology, it seems strange that malaysian flight mh370 could disappear – but finding a missing aircraft is a needle-in-ahaystack problem. the plane knows where it is but it does not send this information anywhere. the problem is not technology – the problem is that there is no law that says that planes must send this information.volcanic fallout air travel can be cancelled by volcanic activity. ash melts in the heat of the engine, then solidifies on the rotors. it is very dangerous to ignore the volcanic ash.the wing myth for many years, we taught the wrong explanation for the way wings keep planes in the air. but now we know that a plane stays in the air because of newton’s third law of motion. the shape of the wing pushes air down. as the air is pushed down, the wing gets an equal and opposite push up, and this lifts the plane.nannannannan
elementary	we do not yet live in an age of  ying cars, as predicted in the 1985  lm back to the future ii, but smartphones and other new technologies are creating exciting possibilities. experts agree that economic and population changes, new technology, and environmental concerns are having a big effect on transportation.with an ageing transport infrastructure, cities in the us have to change and improve their transportation. experts and scientists now realize that old ways of reducing traf c congestion arenõt enough to solve the problems of population growth and carbon emissions, and transportation is now an environmental problem.big us cities like los angeles and chicago are adding more bus lanes and pedestrian walkways, and expanding rail networks. at the same time, they are creating advanced technologies that will allow a vehicle to drive itself and communicate with other vehicles and its environment.here are three of the key ideas that experts predict will change transportation in the future.connectivity taxi-sharing services like uber and apps like waze, which  nds the quickest routes for drivers, are completely changing how people move around and affecting the way traf c moves through a city. communication between riders and drivers, between different vehicles and between cars and infrastructure is bringing transportation into a new era.according to a recent study, people born in the 1990s are using cars less than older generations. according to the study, people born in the 1990s are making 4% fewer car trips and travelling 18% fewer miles per year, on average, than older generations did at the same time in their lives. and, people who still drive cars are experiencing less traf c thanks to waze.traf c congestion is improving in other ways, too. at the moment, a traf c light knows when a car is getting close but thatõs all. companies are developing technology that allows a vehicle to tell traf c control systems not only that it is present but also where it is going and how fast it is travelling.automation we have known about driverless cars ever since google began testing the vehicles in 2012 but no-one really knows when driverless cars will become commonplace. but, there is already some automation of cars. automation will probably happen in stages:  rst, there might be automated buses with their own lanes, then perhaps lorries in ports or mining towns: vehicles that are connected electronically and travel one behind another.the idea of a fully automated transportation system is interesting because it could improve safety ð peopleõs mistakes wonõt cause accidents any more. it could also help reduce carbon emissions and traf c congestion. but, it will take a long time to get fully automated because the average age of cars on the road is 11.5 years old.to see what driverless cars might look like on the road, go to the video at: vimeo.com/37751380.environmental concern the world is trying to slow down climate change and countries and cities are trying to reduce emissions. these things could have a big effect on the future of transportation and lead to zero- and low-emission vehicles and apps that encourage more walking, cycling and carpooling. when thinking about the future of transportation, itõs also important to think about why people travel: they may be going to work, to meet friends or family, or to do the shopping. technologies that reduce the need for those trips ð for example, online meetings or online work ð could also have a big effect on transportation.nannannan
elementary	on the market square in rjukan stands a statue of the person who created the town, a norwegian engineer and businessman called sam eyde. the great man looks north across the square at the side of a mountain in front of him.behind him, to the south, is the 1,800-metre mountain known as gaustatoppen. between the mountains, along the narrow vestfjord valley, is the small town that eyde built at the beginning of the last century for his factory workers.eyde used the power of the 100-metre rjukanfossen waterfall to make hydroelectricity in what was, at that time, the world’s biggest power plant.but one thing he couldn’t do was change the sun. deep in its east–west valley, with high mountains all around, rjukan and the 3,400 people who live there are in shadow for half the year. in the daytime, from late september to mid-march, the town, three hours north-west of oslo, is not completely dark, but it’s certainly not bright.now, high on the mountain opposite eyde’s statue, 450 metres above the town, three large, solar-powered, computer-controlled mirrors follow the movement of the sun across the sky. they reflect the sunshine down on to the square and fill it in bright sunlight.“it’s the sun!” says ingrid sparbo – she lifts her face to the light and closes her eyes. sparbo has lived all her life in rjukan and says, “this is so warming. not just physically, but mentally. it’s mentally warming.”two young mothers bring their children into the square and stand in the sun. on a freezing day, an elderly couple sit on one of the new benches and they smile at the warmth on their faces. children smile. lots of people take photographs. a shop assistant, silje johansen, says it’s “awesome. just awesome.”electrical engineer eivind toreid says “it’s a funny thing. not real sunlight, but very similar. like a spotlight.”heidi fieldheim says she heard all about it on the radio. “this will bring much happiness,” she says.across the road, in the nye tider café, sits the man who created this happiness. martin andersen is a 40-year-old artist who moved to rjukan in the summer of 2001.andersen had the idea for an artwork he calls the solspeil, or sun mirror, at the end of september one year: “every day, we took our young child for a walk,” he says, “and, every day, i realized we had to go a little further down the valley to find the sun.” by 28 september, the sun completely disappears from rjukan’s market square. it doesn’t reappear until 12 march.in the months between september and march, andersen says: “we would look up and see blue sky above, and the sun high on the mountain, but the only way we could get to it was to go out of town.”twelve years after he first dreamed of his solspeil, a german company that specializes in csp – concentrated solar power – brought in, by helicopter, the three 17-square-metre glass mirrors that are now high above the market square in rjukan.and it really works. some people were against the mirrors at first, but now even they agree that it works“i was strongly against it,” says nils eggerud. like many others, he felt they needed the money for other things – for extra carers to look after rjukan’s old people, perhaps, or better schools, cycle paths and roads.“and i still don’t know about the maintenance costs,” he says. “what will they be, who will pay them? but ... well, it feels nice, standing here. and, really, you just have to look at the people’s faces.”in his office with a view of the square, rjukan’s young mayor, steinar bergsland, is less interested in the cost and more interested in the benefits the mirrors might bring to the town.already, bergsland says, there are more visitors than usual and rjukan’s shopkeepers are making more money than usual.the town had to pay just 1 million krone – £100,000 – of the mirror’s total 5-million krone cost. the rest came from the government and a local business. “and”, says bergsland, “just look out of the window. look at those happy faces. now it’s here, people love it.”nan
elementary	a new computer-assisted autopsy system is becoming more and more popular in european hospitals. its inventor says that the system could mean that now there will be no such thing as a ‘perfect murder’.the method, called ‘virtopsy’, is being used at some forensic medical institutes in europe. it was invented by a group of scientists at the university of zurich. instead of cutting the chest, like in a traditional autopsy, pathologists are now able to examine the dead body in 3-d via computer screens.michael thali, the director of zurich’s institute for forensic medicine in europe, and one of the inventors of virtopsy, said it could completely change criminal investigations. “basically there will be no such thing as the perfect murder any more because a virtual autopsy allows you to find every piece of evidence,” he said.virtopsies use powerful machines. together, the machines are called a ‘virtobot’. virtopsies can find injuries that are not seen during a traditional autopsy, as well as air pockets, heart attacks and even cancer.“the virtopsy could replace the autopsy one day,” said richard dirndorfer, one of the first people to use dna analysis in criminology. “i think we’ll see it happen slowly, just like dna analysis slowly replaced blood group analysis”.the method allows doctors to see deep inside dead bodies. it can see things that cannot be found during traditional autopsies.criminologists from around the world have been travelling to switzerland over the past few years to see the new method. forensic scientists and pathologists think the method can be used together with the traditional autopsy.“in order to analyze the colour of the blood, the thickness of body fluids or smells, we’ll need to use traditional autopsy methods,” said lars oesterhelweg, deputy director of the institute of forensic medicine at the charité hospital in berlin, which is using a version of the virtopsy.he added that the new method was very helpful in re-examining cases where the cause of death was unclear. “it means that investigations can be re-examined and we can try again to find the murderer,” he said.scientists said that relatives of the dead prefer the virtopsy method because, during a traditional autopsy, scientists have to cut and damage the dead body.nannan
elementary	tea, baked beans on toast and fish and chips have always been popular in britain. but, things are changing, according to data published recently in the national food survey.everyone knows that the british love tea but they drink more than 50% less tea than in the 1970s – 68g of tea per person per week compared to only 25g. britons are now drinking on average only eight cups of tea a week – they drank 23 cups in 1974. tea is still the most popular hot drink in the uk but people now spend more money on coffee.the data comes from 150,000 families who took part in the survey between 1974 and 2000, combined with information from 2000 to 2014. it shows a move towards healthier food in recent years – people have changed to low-calorie soft drinks, from whole to skimmed milk and they eat more fresh fruit. but, the amount of chips, pizza, crisps and ready meals they eat each week has increased a lot.there has also been an enormous change from white to brown bread. the survey also shows the amount of bread people eat has fallen from 25 to 15 slices a week over the past forty years. the amount of baked beans people eat has reduced by 20%. but, there has been an increase in other types of convenience food, particularly italian dishes. adults in the uk now eat an average of 75g of pizza every week compared with none in 1974. the amount of pasta they eat has almost tripled over the same period.fresh potatoes are also becoming less popular with a 67% decrease from 1974, when adults ate around 188g every day. people eat more of other vegetables such as cucumbers, courgettes, aubergines and mushrooms. the amount of takeaway food they eat has almost doubled since 1974, from 80g per person per week to 150g. around 33g of this amount is chips and 56g is meat, with kebabs (10g), chicken (7g), burgers (5g) and “meat-based meals” (32g) particularly popular.it seems that british people are now more careful about what they eat – the amount of fruit has increased by 50% since 1974. in 2014, uk adults ate an average of 157g of fruit per day. bananas have been the most popular fruit in the uk since 1996 – adults ate 221g per adult per week in 2014, much more than apples (131g) and oranges (48g). half of all soft drinks british people drink are now low-calorie soft drinks. britons also spend a smaller percentage of their salaries on food today – 11%, compared with 24% in 1974.the uk environment secretary, elizabeth truss, said: “food is the heart of our society. this data shows what we were eating 40 years ago but, also, how a change in culture has led to a food revolution. people care more about where their food comes from than before, we can order quality food on the internet, fashionable restaurants give us the latest trends and exciting global cuisines are now as common as fish and chips.”she added that this data can show us more than what, where or how older generations ate. it can also show us when our habits changed. the national food survey can tell us a lot and help us to predict new food trends. “i look forward to seeing how we can use this data to learn more about our past and grow our world-leading food and farming industry in the future,” she said.nan
