advanced	they may not know who steve jobs was or even how to tie their own shoelaces, but the average six-year-old child understands more about digital technology than a 45-year-old adult, according to an authoritative new report.the advent of broadband in the year 2000 has created a generation of digital natives, ofcom (which checks standards in the uk communications industries) says in its annual study of british consumers. born in the new millennium, these children have never known the dark ages of dial-up internet and the youngest are learning how to operate smartphones or tablets before they are able to talk.òthese younger people are shaping communications,ó said jane rumble, ofcomõs media research head. òas a result of growing up in the digital age, they are developing fundamentally different communication habits from older generations, even compared to what we call the early adopters, the 16-to-24 age group.óofcom devised a òdigital quotientó, or dq, test to put 800 children and 2,000 adults through their paces, which, rather than measuring intelligence, as an iq test would, attempts to gauge awareness of and self-con dence around gadgets from tablets to smart watches, knowledge of superfast internet, 4g mobile- phone networks and mobile apps.among 6- to 7-year-olds, who have grown up with youtube, spotify music streaming and online television, the average dq score was 98, higher than for those aged between 45 and 49, who scored an average of 96. digital understanding peaks between 14 and 15 years of age, when the average is a dq of 113, and then drops gradually throughout adulthood, before falling rapidly in old age.people are now being invited to test their digital knowledge with an abbreviated version of the questionnaire that will give any member of the public a dq score, along with advice on how to improve their understanding and protect themselves and their families online.the ways in which millennial children contact each other and consume entertainment are so different from previous generations that forecasters now consider their preferences a better indication of the future than those of trendsetting young adults.the most remarkable change is in time spent talking on the phone. two decades ago, teenagers devoted their evenings to monopolizing the home telephone line, dissecting love affairs and friendships in conversations that lasted for hours.for those aged 12 to 15, phone calls account for just 3% of time spent communicating through any device. for all adults, this rises to 20% and, for young adults, it is still three times as high at 9%. todayõs children do the majority of their remote socializing by sending written messages or through shared photographs and videos. òthe millennium generation is losing its voice,ó ofcom claims.over 90% of their device-time is message based, chatting on social networks like facebook, sending instant messages through services like whatsapp or even  ring off traditional mobile- phone text messages. just 2% of childrenõs time is spent emailing, compared to 33% for adults.away from their phones, 12- to 15-year-olds have a very different relationship with other media, too. a digital seven-day diary shows live television accounts for just half of viewing for this age group, compared to nearly 70% for all adults. they spend 20% of their time viewing short video clips, for example on youtube, or news clips distributed via facebook and other social sites. the rest of their viewing is shared between dvds, streamed content through net ix or itunes and recorded television programmes.young adults aged 16 to 24 are voracious consumers of almost all media. however, live radio and print-based media have all but disappeared from their daily diet.younger people are moving away from live television and moving to streaming and catch- up services. even among adults, television is becoming less important. television viewing among 16- to 24-year-olds has been dipping each year since 2010, but 2013 was the  rst year where researchers found viewing fell across all age groups. the theory is that tablet computers ð among the most popular christmas presents in 2012 and 2013 ð have brought many older people online for longer. with large screens and simple, touch-based interfaces, tablets are being credited with a jump in internet access among the over-65s.òfor years, there has been a very stubborn resistance by the over-65s to accessing the internet,ó said james thickett, research director at ofcom. òin the last three years, we have seen that change and we think thatõs down to tablets.ó britain is embracing internet-enabled devices across the generations, to the extent that the balance between sleep and screen-based activities has now tipped. the typical adult spends eight hours and 41 minutes each day communicating or consuming media, including old-fashioned books and newspapers, and just eight hours and 21 minutes asleep.
advanced	the international monetary fund (imf) has appealed to washington to sort out its finances after the us pulled back from the brink of a debt default and hundreds of thousands of federal employees returned to work after a 16-day government shutdown.as the us president, barack obama, warned “we’ve got to get out of the habit of governing by crisis,” the imf’s managing director, christine lagarde, appealed for more stability.“it will be essential to reduce uncertainty surrounding the conduct of fiscal policy by raising the debt limit in a more durable manner,” she said.“we also continue to encourage the us to approve a budget for 2014 and replace the sequester with gradually phased-in measures that would not harm the recovery, and to adopt a balanced and comprehensive medium-term fiscal plan.”a senate-drafted peace deal that contained almost no concessions to the conservatives who had driven the country to the precipice of a new financial crisis was passed by the republican-dominated house of representatives just hours before a deadline to extend the us debt limit was to pass.the world bank, too, expressed its relief that the global economy had “dodged a potential catastrophe”, with its president, jim yong kim, urging policymakers in all countries to “continue to focus on crafting and implementing policies that promote economic growth and boost jobs and opportunity for all”.stock markets in japan, china, hong kong and south korea initially reflected relief after the republicans finally capitulated in their failed attempt to undermine obama’s healthcare reforms. but, in asia and europe, stock markets overall displayed a muted reaction, with traders apparently expecting another battle in washington early in 2014.the shutdown is estimated to have cost the us $24bn, according to the ratings agency standard & poor’s. china’s official xinhua news agency had accused washington of jeopardizing other countries’ dollar assets. china is the us government’s largest creditor.obama signed the necessary legislation to fend off a default shortly after midnight on thursday after a republican split in the house of representatives. the bill had passed easily with broad bipartisan support in the senate, where democratic and republican leaders forged the agreement. it offers a temporary fix, funding the government until 15 january and raising the debt ceiling until 7 february.but the president made clear he did not expect another bitter budget fight and shutdown in 2014.in brief remarks at the white house shortly before the house vote, obama said he hoped the deal would “lift the cloud of uncertainty” that had hung over the country in recent weeks.“once this agreement arrives on my desk, i will sign it immediately,” he said, in a statement delivered at the white house. “hopefully, next time it won’t be in the eleventh hour. we’ve got to get out of the habit of governing by crisis.”as he left the lectern after his wednesday night press briefing, the president was asked by a journalist whether the crisis would happen all over again in a few months. speaking over his shoulder, obama replied, “no.”earlier, the republican senator mike lee had struck a defiant tone, perhaps indicating more trouble ahead: “the media keeps asking: ‘was it worth it?’ my answer is, it is always worth it to do the right thing.” he added: “this is not over.”however, the political deal was one of the worst of all possible outcomes for republicans. none of their stated goals was achieved and polls showed that voters overwhelmingly blamed them for the crisis.
advanced	scientists have connected the brains of a pair of animals and allowed them to share sensory information in a major step towards what the researchers call the world’s first “organic computer”.the us team fitted two rats with devices called brain-to-brain interfaces that let the animals collaborate on simple tasks to earn rewards, such as a drink of water. in one radical demonstration of the technology, the scientists used the internet to link the brains of two rats separated by thousands of miles, with one in the researchers’ lab at duke university in durham, north carolina, and the other in natal, brazil.led by miguel nicolelis, a pioneer of devices that allow paralyzed people to control computers and robotic arms with their thoughts, the researchers say their latest work may enable multiple brains to be hooked up to share information. “these experiments showed that we have established a sophisticated, direct communication linkage between brains,” nicolelis said in a statement. “basically, we are creating what i call an organic computer.”the scientists first demonstrated that rats can share, and act on, each other’s sensory information by electrically connecting their brains via tiny grids of electrodes that reach into the motor cortex, the brain region that processes movement.the rats were trained to press a lever when a light went on above it. when they performed the task correctly, they got a drink of water. to test the animals’ ability to share brain information, they put the rats in two separate compartments. only one compartment had a light that came on above the lever. when the rat pressed the lever, an electronic version of its brain activity was sent directly to the other rat’s brain. in trials, the second rat responded correctly to the imported brain signals 70% of the time by pressing the lever.remarkably, the communication between the rats the rats collaborated on a task that required them to distinguish between narrow and wide openings using their whiskers. was two-way. if the receiving rat failed at the task, the first rat was not rewarded with a drink, and appeared to change its behaviour to make the task easier for its partner. in further experiments,in the final test, the scientists connected rats on different continents and beamed their brain activity back and forth over the internet. “even though the animals were on different continents, with the resulting noisy transmission and signal delays, they could still communicate,” said miguel pais-vieira, the first author of the study. “this tells us that we could create a workable network of animal brains distributed in many different locations.”nicolelis said the team is now working on ways to link several animals’ brains at once to solve more complex tasks. “we cannot even predict what kinds of emergent properties would appear when animals begin interacting as part of a ‘brain-net’,” he said. “in theory, you could imagine that a combination of brains could provide solutions that individual brains cannot achieve by themselves.” the research is published in the journal scientific reports.anders sandberg, who studies the ethics of neurotechnologies at the future of humanity institute at oxford university, said the work was “very important” in helping to understand how brains encode information. but the implications of the technology and its potential future uses are far broader, said sandberg. “the main reason we are running the planet is that we are amazingly good at communicating and coordinating. without that, although we are very smart animals, we would not dominate the planet.”“i don’t think there’s any risk of supersmart rats from this,” he added. “there’s a big difference between sharing sensory information and being able to plan. i’m not worried about an imminent invasion of ‘rat multiborgs’.”very little is known about how thoughts are encoded and how they might be transmitted into another person’s brain, so that is not a realistic prospect any time soon. and much of what is in our minds is what sandberg calls a “draft” of what we might do. “often, we don’t want to reveal those drafts; that would be embarrassing and confusing. and a lot of those drafts are changed before we act. most of the time i think we’d be very thankful not to be in someone else’s head.”
advanced	they call him the robin hood of the banks, a man who took out dozens of loans, worth almost half a million euros, with no intention of ever paying them back. instead, enric duran handed the money out to projects that created and promoted alternatives to capitalism.after 14 months in hiding, duran is unapologetic, even though his activities could land him in jail. òiõm proud of what i did,ó he said in an interview by skype from an undisclosed location. the money, he said, had created opportunities. òit generated a movement that allowed us to push forward with the construction of alternatives. and it allowed us to build a powerful network that groups together these initiatives.ófrom 2006 to 2008, duran took out 68 commercial and personal loans from 39 banks in spain. he farmed the money out to social activists, funding speaking tours against capitalism and tv cameras for a media network. òi saw that, on one side, these social movements were building alternatives but that they lacked resources and communication capacities,ó he said. òmeanwhile, our reliance on perpetual growth was creating a system that created money out of nothing.óthe loans he swindled from banks were his way of regulating and denouncing this situation, he said. he started slowly. òi  lled out a few credit applications with my real details. they denied me, but i just wanted to get a feel for what they were asking for.ófrom there, the former table-tennis coach began to weave an intricate web of accounts, payments and transfers. òi was learning constantly.ó by the summer of 2007, he had discovered how to make the system work, applying for loans under the name of a false television production company. òthen, i managed to get a lot.ó û492,000, to be exact.duran was arrested in spain in 2009, on charges brought against him by six of the 39 banks that had lent him money. he spent two months in prison before being bailed for û50,000. in february 2013, facing up to eight years in prison, he decided to  ee rather than stand trial. òi donõt see legitimacy in a judicial system based on authority, because i donõt recognize its authority,ó he said.his actions, he said, were in the vanguard of a worldwide debate on the economic crisis. the timing pushed the anti-capitalist movement into the light, just as many spaniards were seeking alternatives to a system that had wreaked havoc on their lives.while the same actions would probably be better understood in todayõs spain, he said that they would not be needed. the anti-capitalist movement has grown from a fringe movement to one supported by thousands of spaniards, he said, evidenced by the widely supported movements such as the indignados.success has helped the movement become self- suf cient. òwe now have the capacity to generate resources,ó said duran, adding somewhat ironically that this was exactly what banks issue credit for ð òto advance and generate a situation that allows you to be independentó. duran is widening his focus to include spainõs justice system, by promoting restorative justice. òthe people in spain who believe that banks donõt work, they think that i donõt owe anything. iõve already done my work,ó he said. òbut there is a part of a population that is not in agreement with us and i think i should respond to that.óin his case, he said, the element of reciprocity he could offer to banks might lie in the insight he gleaned from years of obtaining bank loans fraudulently. he could share his thoughts on òwhich best practices work and the bad ones that donõt,ó he suggested, òfor the general population and for bank workersó.
advanced	up to a billion people will remain in extreme poverty by 2030 unless countries focus on inequalities and confront social, economic and cultural forces that block their escape or pull them back into impoverishment, a major report warns. the report by the chronic poverty advisory network (cpan) asserts that many people may rise above the poverty line of $1.25 a day, only to tumble back when they are hit by a combination or sequence of shocks such as drought, illness and insecurity or con ict.drawing on household panel surveys, the report found that, in parts of rural kenya and in south africa, 30 to 40% of those who escaped from poverty fell back, rising to 60% in some areas of ethiopia between 1999 and 2009. even in successful countries such as indonesia and vietnam, the proportion has been 20%.individual cases highlight the ease with which people can slip back into poverty. amin, 61, from rural bangladesh, has seen his livelihood gradually decline, due to his own and his wifeõs illnesses, the cost of his sonõs marriage, the death of his father and loss of goods such as  shing nets. lovemore, 74, from zimbabwe, has become one of the poorest people in his village. he recently lost his job as a car-park attendant due to ill health and had to take in his  ve grandchildren after the death of his daughters.òwe need to ensure that people lifted out of poverty remain above the poverty line permanently. too many families are experiencing ôtwo steps forward, one step backõ, where they struggle to recover from personal or bigger setbacks. governments shouldnõt assume that, just because somebodyõs income hits $1.25, that means job done,ó said andrew shepherd, research fellow at the overseas development institute, a partner of cpan, and lead author of the report.a un high-level panel considering a new development framework to succeed the millennium development goals after 2015 said the goal of eliminating extreme poverty by 2030 was within reach. the report, however, argues that òmore of the sameó will not get to zero.despite a drop in extreme poverty from 1.9bn in 1990 to 1.2bn in 2010, the report says that progress in the next 15 years will be much harder. the big gains in china are unlikely to be matched by similar progress elsewhere, while climate-related shocks and deep poverty in parts of sub-saharan africa will slow momentum.the report calls for a shift in thinking about poverty to focus on the chronically poor ð those who are poor for many years or their entire lives ð and for more emphasis on stopping impoverishment, the descent into poverty. ògovernments have been quite good at moving people over the poverty line because that is relatively easy ð there is a tendency to pick the low-hanging fruit, but they have shied away from the more dif cult job of tackling chronic poverty,ó said shepherd.the report says progress on poverty reduction, while impressive to date, has had less of an impact on the chronically poor than on those who were already closer to the poverty line. it will not be possible to get to zero unless development policies prioritize those living in chronic poverty, it adds. policymakers must aim for a òzero tripodó of separate but interdependent objectives: tackle chronic poverty; stop impoverishment; sustain poverty escapes. they put forward a trio of policies, all of which require massive global investment.the  rst is social assistance ð a safety net ð to bring the poorest people closer to a decent standard of living. an example of such a scheme is ethiopiaõs productive safety net programme that allowed thousands of vulnerable households to withstand drought without having to curtail education spending. the second is education, from early childhood to the start of work, to enable people to escape and stay out of poverty. education also has the advantage of being a òportableó asset. the third is pro-poorest economic growth policies to ensure that the bene ts of increasing national prosperity reach the very poorest people.òeconomic growth really is critical, but not just any old growth,ó shepherd said. òit has to generate not just employment but decent jobs, not just insecure low-paying jobs. there are ways of doing this, like indiaõs rural employment guarantees scheme, which has boosted urban not just rural wages.ó another example cited by the report is south africaõs extension of the minimum wage to groups such as domestic workers.all this will take money and the report says one obvious implication is that stronger domestic tax systems and greater tax revenues will be required. aid will also be needed for the start-up costs for social assistance, universal health coverage and to  nance education, including scholarships for the poorest children. òthere remains a huge role for aid in the next 20 years, as many developing countries spend less than $500 on each of their citizens a year. even nigeria, with its oil wealth, spends only $650 per capita,ó shepherd said.against a backdrop of crises in syria, south sudan and the central african republic, con ict and environmental disasters have to be addressed, and the report says it is essential that governments work to reduce the risk of con ict and to establish inclusive peace settlements.incorporating òreducing (income) inequalityó as a post-2015 goal would steer the international agenda in the right direction, given that lessening or containing inequality speeds up the impact of economic growth on poverty reduction. the report argues that if the inequalities that affect the poorest people ð such as access to land, labour markets and the power relationships between men and women ð are addressed, this would tackle two goals at the same time: reducing chronic poverty and inequality.the authors urge governments to develop an inclusive national development plan and to work with civil society to ensure the poorest people are represented politically as well as tackling dif cult social norms such as dowries and witchcraft that contribute to extreme poverty: òthis often means challenging and, perhaps, sweeping away aspects of the status quo and represents the most marked departure from ôbusiness as usualõ.ó
