elementary	clay cockrell is sitting in his of ce opposite the trump international hotel and tower. in front of the tower is central park, where cockrell holds his popular walk and talk therapy sessions.cockrell is a former wall street worker who is now a therapist. he spends large parts of his days walking in central park or the battery park in downtown manhattan near wall street, talking to some of new yorkõs wealthiest people.òmany of the very wealthy ð the 1% of the 1% ð feel that their problems are really not problems. but they are,ó he says.so, what problems do americaõs 1% have? òthere is guilt that they are rich,ó he said. òthere is the feeling that they have to hide that they are rich. and, then, there is the isolation ð being in the 1% can be lonely.ócounsellors say that things have become worse since the  nancial crisis in 2008. people now talk about the gap between rich and poor more because of groups like occupy wall street.òoccupy wall street had some important things to say about the gap between rich and poor but it was negative about the 1%,ó said jamie traeger-muney, a wealth psychologist. the media, she said, makes the rich òfeel like they need to hide or feel ashamedó.òsometimes, i am shocked by things that people say. you would never talk about another group of people in the way that it seems perfectly normal to talk about wealthy people.óòitõs really isolating to have a lot of money. peopleõs reaction to you can be scary,ó said barbara nusbaum, an expert in money psychology. òwe are all taught not to talk about money. itõs not polite to talk about money. but itõs harder to talk about being rich than it is to talk about being poor. people donõt mind if you say ôi am broke. things are hard.õ you canõt say ôi have a ton of money.õ you have to keep a lot of your life private.óas a result, cockrell says, the rich hang out with other rich americans who understand them and their problems.in the us, over the last 30 years, the number of very wealthy people has grown. in 2014, the number of us households with $1m or more ð excluding the value of their main home ð was 10.1 million. there were 1.3 million households worth $5 million and 142,000 worth $25 million or more.since the 2008  nancial crisis, the gap between the rich and the poor has grown and the situation òhas gotten worse for the wealthyó, cockrell said. the main reason? not knowing if your friends are friends with you or with your money.òsomeone else who is also a billionaire ð they donõt want anything from you. never being able to trust your friendships with other people, i think that is dif cult,ó said cockrell.òwealth can stop you from connecting with other people,ó said the wife of a man who made about $80 million. some americans keep their wealth secret.òthere are a lot of people hiding their wealth because they are worried about negative judgment,ó said traeger-muney. if wealthy americans talk about their problems, people donõt have a lot of sympathy,ó she said.cockrell said that there is a common mistake that many of his wealthy clients make ð they let their money be the most important thing in their lives.òif you are part of the 1%, you still have problems. there are other parts of your life. money is not the only thing,ó he said. òyour problems are real.ónannannannan
elementary	margaret thatcher, the most famous british prime minister since winston churchill, has died at the age of 87. she was in poor health for many years, suffering from dementia. the british government says that her funeral will be at st paul’s cathedral.the british prime minister, david cameron, said: “i was very sad when l heard of lady thatcher’s death. we’ve lost a great leader, a great prime minister and a great briton.” he added: “she was our first woman prime minister – and she didn’t just lead our country, she saved our country.” he added that he believed she would be remembered as the greatest british peacetime prime minister.president barack obama said, “here in america, many of us will never forget her close friendship with president reagan.”margaret thatcher was the first woman leader of an important western state. she was prime minister for 11 years until members of her own party removed her in 1990.when they heard of her death, politicians from all parties sent tributes.british labour party leader, ed miliband, said: “she will be remembered as a unique person. she changed the politics of a whole generation. she was britain’s first woman prime minister. she was a huge figure in the world. the labour party disagreed with a lot of what she did, but we can disagree and also greatly respect her political achievements and her personal strength.”the former conservative prime minister, sir john major, said that people who worked closely with her would always remember her courage and determination in politics and her humanity and generous spirit in private.the “iron lady” was a close ally of the us president ronald reagan in the final years of the soviet union. the union broke up because of reforms introduced by mikhail gorbachev. he was the russian leader who thatcher liked and worked closely with. as a result, many ordinary people in ex-communist countries still think of her as someone who supported their freedom.it was a surprise when thatcher became party leader in 1975. within ten years, she had become famous around the world – people both admired and hated her – for her reforms in the uk and her strong beliefs in foreign policy. she had a long battle with the ira, which almost killed her with a bomb in 1984.in the uk, thatcher’s main economic policy was the denationalization of state-owned industry – the new word “privatization” became used in many countries. she also defeated militant trade unions, particularly the national union of miners, after a long and terrible strike that lasted almost a year. with money from britain’s north sea oil fields, she was able to change the ageing industrial economy and she used the opportunity to defeat her enemies – including some members of her own party.as the british economy became healthy again after the problems that her policies caused, it seemed for a short time that no-one would ever defeat her. but, as her friends and supporters retired or were replaced, she started to make mistakes and became more and more unpopular. finally, in 1990, after a vote among conservative mps failed to support her, john major took control of the party.after she retired, she wrote her memoirs and continued to promote her values around the world.nannannannannan
elementary	36-year-old junior smart knows a lot about gangs. when he was a teenager, after his mother died, he joined a south london gang. at the time, it helped fill a big gap in his life. “they became my new support group,” he says. “at first it was just a bit of fun but then it became more serious and we got involved in crime.” after he left college, he got a full-time job but he was also making money illegally as part of the gang.eventually he was arrested for serious drug crimes and was sent to prison for 12 years. “the first night after i was arrested was the biggest shock of my life,” he says. “i had been living a double life. i had been living as one person to my peers and another person to my peers’ enemies.”today, junior smart runs a team of 12 full-time workers and six volunteers, working to help young criminals and gang members to stop committing crimes. most of the team are ex-criminals like smart. a few are still in prison but are allowed out during the day to help. they work with the police, the probation service and other, voluntary organizations to help members of the violent criminal gangs of london.smart’s extraordinary journey from gang member to mentor began when he was in prison. “i couldn’t believe that people kept coming back in and nobody did anything about it. i was talking to the prisoners and they knew what was wrong in their lives, but the problem is that the prison system only deals with the crime.”“one guy spent £300 a week on cocaine and burgled houses to get the money. he told me how he walked into houses, even when he knew people were there. so he had a drug addiction, but that problem was never solved.”smart started working as a prison “listener” – a prisoner who helps new arrivals during their first days inside. then he had an idea to run his own scheme when he left prison – using the experience of ex-offenders to help others reject crime. he left prison after five years and started his scheme.so what does he think now? does he believe that things are getting better? he says the police have done some good work in arresting gang members. but he criticizes the government because they believe that, when the leader of a gang is arrested, the problem is solved. he believes the arrest of gang leaders can even make things worse.“when you arrest the leader, people in the gang start fighting. who was the most loyal? who had the most respect? it is a bit like a violent family. it means that the arrest of the gang leaders has no long-term effect.”can it make the streets more dangerous? “yes, it can. if one gang knows that an elder [leader] has been arrested, then they suddenly think that gang’s weak ... and so we have fights between different gangs. and what happens when that elder is in prison? he makes friends with other gang members, or when he comes out of prison he tries to take control back. that is when violence happens.”smart says gangs are now recruiting members in primary schools. the youngest members are called “tinies”. “over the last years we have seen more and more of this. the tinies can be just eight to eleven years old.” the youngest members protect their seniors from risk. they often sell drugs or even stab people, he says.smart says that the challenges are very big, particularly because the economy is so bad. “i try to help a young person who has been earning £300 a week illegally. it was difficult before but, with lots of unemployment, it’s even more difficult now.” but his project, which has more than 1,000 clients, is bringing results. fewer than 20% of the people he helps reoffend. smart believes that everyone should get a second chance.nannan
elementary	angela erdmann never knew her grandfather. he died in 1946, six years before she was born. but, on tuesday april 8th, 2014, she described the extraordinary moment when she received a message in a bottle, 101 years after he threw it into the baltic sea. the bottle is possibly the world’s oldest message in a bottle. it was presented to erdmann by the museum that is now exhibiting it in germany.“it was very surprising,” erdmann, 62, said, when she described how she found out about the bottle. “a man came to my door and told me he had post from my grandfather. then, he told me that someone had found a message in a bottle and that on the card was my grandfather’s name.” her visitor was a family-tree researcher who found her in berlin after someone gave the letter to a museum in the northern city of hamburg.the brown beer bottle was in the water for 101 years. a fisherman found it. holger von neuhoff, a curator at the museum, said this bottled message was the oldest he had ever seen. “there are documents without the bottle that are older and they are in the museum,” he said. “but, with the bottle and the document, this is certainly the oldest at the moment. it is in very good condition.”researchers believe that erdmann’s grandfather, richard platz, threw the bottle into the sea when he was on a hike in 1913. he was 20 years old at the time. a lot of the message on the postcard was impossible to read, but the address in berlin on the front of the card was legible. platz asked the person who found it to send the postcard to his home address.“he also included two stamps from that time that were also in the bottle, so the finder would not have to pay for postage,” erdmann said. “but he did not think it would take 101 years.”she said she was moved by the arrival of the message, but she did not known her grandfather because he died, at the age of 54, six years before she was born.“i knew very little about my grandfather. but i found out that he was a writer. he was very openminded, and he believed in freedom and that everyone should respect each other,” she said. “he did a lot for the young and later travelled with his wife and two daughters. it was wonderful because i could see where my roots came from.”erdmann said she also liked culture and travelling around the world, just like her grandfather. she described herself as open-minded, too. she was very happy to receive the bottled message, she said, but she hoped other people would not do what her grandfather did and throw bottles with messages into the sea. “today, the sea is so full of bottles and rubbish that we shouldn’t throw more in there,” she said.the message and the bottle will be on display at hamburg’s maritime museum until the beginning of may 2014. then, experts will try to decipher the rest of the text. it is not clear what will happen to the bottle after that, but erdmann hopes it will stay at the museum.“we want to find a few photos to put with the bottle and give it a face, so visitors can see the young man who threw the bottle into the water,” she said.nan
elementary	all six numbers match, so now you can buy that audi, book the holiday in the us and look for a new house. that’s what most lottery millionaires do, says a study of what jackpot winners do with their money.since it started in 1994, the uk national lottery has created 3,000 millionaires. the 3,000 winners have won an average of £2.8 million each. that’s more than £8.5 billion in total. together, they have created 3,780 more millionaires among their children, family and friends, according to the writers of the study, oxford economics.most winners (59%) give up work straight away, but 19% carry on working and 31% do unpaid voluntary work. the good news for the british economy is that 98% of the money that the winners spent stayed in the uk. through their spending on property, vehicles and holidays, it is estimated that each winner keeps six people in a full-time job for a year.winners have contributed almost £750 million to the economy. most of their money was spent on property, with £2.72 billion spent on winners’ main properties, and £170 million in paying off existing debt and mortgages.£2.125 billion was spent on investments. £1.17 billion was given to family and friends, and £680 million was spent on cars and holidays.it found that in total the 3,000 winners have bought 7,958 houses or flats in the uk, or 2.7 each, spending £3.3 billion. most winners (82%) bought a new house, spending an average £900,000.the new home is likely to have a hot tub, with almost a third (29%) putting that on their shopping list. 28% bought a walk-in wardrobe, almost a quarter (24%) bought a property behind electric gates, and 22% had a games room, with 7% installing a snooker table.30% of winners employed a cleaner and 24% a gardener for their new houses. a small proportion (5%) employed a beautician.audis were the favourite cars of 16% of winners, with range rovers and bmws also popular (11% each), as well as mercedes (10%) and land rovers (5%). winners spent £463 million on 17,190 cars.holidays were also important. most (68%) choose five-star hotels overseas. the us was the preferred destination for 27%, followed by the caribbean (9%). over the past 18 years, 10% of millionaires have bought a caravan.some winners (15%) have started their own businesses, 9% have helped others to start a business, and 6% have invested in or bought other people’s businesses. businesses started or supported by lottery winners employ 3,195 people, according to the study.nan
elementary	google has made maps of the world’s highest mountains, the ocean floor, the amazon rainforest and even shown us a bit of north korea. they want to make maps of the whole world, but they have mostly stayed away from the arctic.now, however, google is starting a very important update to hundreds of years of polar map making – and it hopes that the map will help give a better understanding of life on the permafrost for millions of web users. a small google team has flown to iqaluit, the largest town in the canadian territory of nunavut. they have taken their warmest winter clothes, many laptop computers and an 18kg telescopic camera that they can fix to their backpacks.the team spent four days collecting the images and information that will give the isolated community on baffin island something that people across the world who live in cities now take for granted. an inuit mapping expert helped the google team and curious locals followed them around.the town of 7,000 people will go on display via google’s popular street view application in july 2013.when google made maps of other parts of the world it used a special camera on a car roof. in iqaluit that was not possible, so google’s map makers walked the town’s snowy roads and trails. some roads are made of ice and disappear in the short summer months.the team also walked along part of a 15km road known as the road to nowhere, despite warnings about meeting polar bears.the online map that google had already created using satellite images was mostly correct, but one road was missing that had been built in the last year.one difficulty was how to place on the map many businesses and homes that have mail sent to the local post office and not delivered to their address. putting the po box addresses on the map would mean the new map would show all the companies, banks and schools in the same place, around the canada post building in the centre of town.about 30 inuit elders, business people and high-school pupils helped google to correct this problem. they were given a laptop computer and told how to make sure their homes, shops and meeting places would show up correctly on the map.the project is more than a novelty. arif sayani, the town’s director of planning, said that people who are thinking of visiting or moving to the area would be able to use the maps to see the area. it may also help planning decisions in iqaluit happen more quickly.the project leader for google said he hoped to see the work continue in other northern towns. but moving people and equipment around the vast arctic territory is very expensive. so, in the future, google might send equipment to the area and ask volunteers to complete the map.nannannannannannannan
elementary	like a typical bad boyfriend, dan sullivan arrived late to breakfast with the guardian because the police stopped him on his motorcyclesullivan works too much, he says. he misses dinner dates. he forgets to give presents.and so, like many others in silicon valley, the 27-year-old has started a business: betterboyfriend.me, a service that sends girlfriends and wives a present every month for about $70.sullivan is testing the service and has about 350 boyfriends as his clients. most clients, he says, are his friends from university and other friends who are founders of start-ups or work for companies like apple, google and facebook. the girlfriends of these men get presents from sullivan.each month, sullivan’s clients choose from a list of seven possible gifts (chocolate, tea sets, etc). then, sullivan sends the gift to the boyfriend.for sullivan, the surprise was the real relationships that he has formed with his clients. sullivan says he has begun to see himself as a sort of relationship consultant for the boyfriends.sullivan says he’s made mistakes. in the beginning, the gifts he sent included receipts with his name on, dan sullivan. “one of the boyfriends wrote to me and said, ‘she’s not mad but cynthia found out’.”of all the women betterboyfriend.me deliver packages to, about 50% know that sullivan chooses the presents they receive: “it’s connected with age. i think, after you’ve been married for a longer time, you don’t keep many secrets.”and over the year, the young founder says he’s got to know the boyfriends really well. they’ve even sent a package to a hospital delivery room. the key, he said, is to remember that his relationship is with the boyfriend.when he first started his company, he attached tags that said betterboyfriend.me to flower bouquets and went to the mission district in san francisco.“i looked for couples and gave the flowers to the girl but the boyfriends didn’t like that. not at all,” he said. “so i changed my idea and gave the flowers to the boyfriends.”nannannannan
