intermediate	cities don’t often decide to pack their bags, get up and move down the road. but that’s exactly what kiruna, an arctic town in northern sweden, has to do – to avoid being swallowed up into the earth.“it’s a terrible choice,” says krister lindstedt of white, the swedish architects company that is managing the biblical task. they have to move this city of 23,000 people away from a gigantic iron-ore mine that is fast swallowing up the ground beneath its streets. “either the mine must stop digging, creating mass unemployment, or the city has to move.”founded in 1900 by the state-owned luossavaara-kiirunavaara mining company (lk), kiruna has grown rich off the vast amount of iron ore that is below the town but it’s now facing destruction by exactly the thing that made it rich. “the town is here because of the mine,” says deputy mayor niklas siren. “otherwise, no one would have built a city here.”located 145km inside the arctic circle, kiruna has a brutal climate. it has winters with no sunlight and average temperatures below -15c. but the iron ore has kept people here. it has become the world’s largest underground iron-ore mine. it produces 90% of all the iron in europe, enough to build more than six eiffel towers a day. and demand continues to grow.in 2004, the mining company told the town that its days were numbered: digging its shafts towards the city at an angle of 60 degrees, subsidence would soon lead to buildings cracking and collapsing. ten years later, cracks are starting to appear in the ground, and they are creeping closer and closer to the town.“the people of kiruna have been living in limbo for ten years,” says viktoria walldin, a social anthropologist who works with the architects. “they have put their lives on hold, unable to make major decisions like buying a house, redecorating, having a child or opening a business.”after years of dithering, the city finally has a plan for how it will proceed. lindstedt has a plan that shows the town’s streets and squares beginning to crawl eastwards along a new high street, until the whole place has moved safely away from the mine by 2033.a new town square is already being built, 3km to the east, with a circular town hall planned by danish architect henning larsen. twenty other key buildings will be dismantled and put together piece by piece in their new home – like an ikea flatpack on a bigger scale. kiruna’s red wooden church, built in 1912 and once voted sweden’s most beautiful building, will take pride of place in a new park, and the bell tower will stand once again above the town hall. but not everything will be saved.“i spoke to an old lady who walks past the bench every day where she had her first kiss,” says walldin. “it’s things like that – the hospital where your first child was born, for example – that are important to people and all that’s going to disappear.”called “the most democratic move in history”, the project will get £320m from the mining company for building new facilities, including a high school, fire station, community centre, library and swimming hall. but the biggest worry for most people is where they will actually live and how they will get a house or flat.“people are used to very low rents and very high incomes but, in future, this will have to change” says lindstedt. lk has agreed to compensate residents to the value of their homes plus 25% but many locals say this is not enough to afford a new-build house.a closer look at the plan shows the new town does not look like the original kiruna at all. the current town has winding streets and detached houses with gardens. white’s plan has multi-storey apartment blocks around shared courtyards in long straight streets.it is an opportunity, say the architects, for kiruna to “reinvent itself” into a town that will attract young people. there will be new cultural facilities and “visionary” things such as a cable car above the high street. but it is a vision that many of the existing residents will probably not be able to afford.nan
intermediate	will we soon live in a world where drones deliver packages? if you believe amazon, the answer is òyesó. others are not so sure: we need to make more technical progress in this area but there is also the problem of public safety.amazon spokesman paul misener told a us congress hearing recently that his company would be ready as soon as all the rules were in place. the federal aviation authority (faa) will  nally have regulations on the commercial use of unmanned aircraft by june 2016. but the technology has a long way to go before then and larger machines arenõt legal yet ð only drones up to 25kg will be legal. and the faa says that, if youõre going to crowd the skies with radio- controlled  ying robots, they must all use different radio frequencies that nobody can jam or hijack.professor sajiv singh, who runs a cargo delivery company called nearearth, said that, to pilot a state-of-the-art drone, you simply give it some basic instructions: go to this altitude, perform this short task, go back home. but even short  ights from a mobile landing pad could cause serious logistical problems, he said.òtheyõre not going to deliver from one uninhabited place to another uninhabited place; theyõre going to deliver from a warehouse to the consumer, which will probably be an urban area or a suburban area,ó he said. òin those particular cases, there are going to be hazards that the vehicle is going to have to see. maybe there will be terrain that the map doesnõt know about. then, maybe thereõs construction equipment that wasnõt there before but is there now. maybe gps signals are blocked, in which case itõs going to have an incorrect idea about where it is.ó all these problems can be solved, he said ð but itõs dif cult.one major problem is maintaining radio contact with a drone and planning for what happens if that contact breaks. òif you have an off-the-shelf uav [unmanned aerial vehicle], itõll just keep going and crash into the ground,ó said roboticist daniel huber.furthermore, òyou canõt do everything with a 25kg aircraftó, said jay mcconville, director of business development for unmanned systems at lockheed martin. òpeople in the aircraft business have to remind ourselves that the operator doesnõt really care about every little thing about the aircraft and wants instead to focus on the end result,ó he said. òoperators want to see vehicle status information; they want to see video on their handheld device or their laptop.óòtechnologically, most of the things that we need for this are in place,ó said huber. he is working on a program to allow drones to inspect infrastructure ð pipelines, telephone lines, bridges and so on. òweõve developed an exploration algorithm where you draw a box around an area and it will  y around that area and look at every surface and then report back.óhuber, who works on 3d systems imagery, said about amazon: òi have heard them say that many packages are lightweight ð a drone can carry a kilogram for 15 minutes. if you have a vehicle that can go into a neighbourhood, it can deliver from that base. you need a 15-minute distance and typical off-the-shelf drones have that distance.ó itõs one way, he said, of making sure the surrounding population is relatively safe. òthe larger you get, the more dangerous you get.óproblems with the use of drones can be solved in some very dramatic ways, huber said. at a recent conference, he said, a disaster relief drone company demonstrated a robot that could take off and, when it got tired, land on its own charging station and exchange its batteries.of course, safety is still a major concern ð singh says that, for a commercial aircraft to be allowed to  y, it has to prove a rate of one serious failure every one million hours. drones, he said, are a long way from that. òthe reaper drone has one failure in 10,000 hours,ó singh said. but they donõt consider an oil leak a catastrophic failure ð something has to fall out of the sky.part of the reason for this is that air travel is dangerous so standards are much higher. òif you  y commercial airlines, they often say, ôoh, a component has failed ð we have to go back to the gate,õó singh said. òand thatõs an established industry with 60 years of legacy! i hate to think that a drone might come down on a busy road.ó part of the solution, singh said, is planning for every situation: òif things fail, the vehicle has to do something reasonable.ónan
intermediate	when it comes to climate change, we usually just focus on the  rst part of the story, the part about the problem. we usually forget the second part of the story about the many available solutions. these solutions are speeding up recycling, slowing down emissions and providing sustainable alternatives to plastic, air conditioning, smartphones and fast fashion.the intergovernmental panel on climate change met recently in copenhagen to present its latest report on the impacts and speed of climate change. climate change is now measured on all continents. our efforts to lower emissions must be intensi ed to avoid climate change getting out of control. copenhagen looked at the risks and challenges but also the solutions.focusing on what can be done, sustainia award, chaired by arnold schwarzenegger, celebrated ten leading sustainable solutions used in 84 countries. from food to fashion, energy to transportation, education to health, the awards showed that there is an alternative to the grim-future scenarios we so often read about.from california, we saw how we can now produce plastics from greenhouse gases that are competitive with normal oil-based plastics in price and quality. from switzerland, we learned how we can recycle and reuse old clothes and shoes more effectively. and from canada, we learned how smartphones can make bike-sharing more convenient.the ten projects each offered unique solutions to sustainability challenges but it was the nigerian initiative, wecyclers, that won arnold schwarzenegger and the rest of juryõs vote. it won the sustainia award 2014.wecyclers allows poor communities to make money on waste in their streets. by using bicycles to collect and recycle waste in lagos, wecyclers lets families exchange garbage for consumer goods via an sms-based point system.recycling companies purchase wecyclersõ sorted waste and make it into products such as mattresses, pillows and trash bags. wecyclers is a response to local waste problems, where itõs estimated that only 40% of the cityõs rubbish is collected. according to the world bank, only 46% of municipal waste in africa is collected. more than 5,000 households are involved and there are plans to extend the initiative to other cities throughout nigeria.solutions to deal with climate change are often hi-tech innovations focused on cutting emissions. however, to successfully solve the variety of challenges, we need variety in our solutions as well. sustainability is not just about bringing down emissions, it is also a question of using our natural resources more intelligently and creating healthier lives for ourselves. these initiatives might be low-tech in innovation, but they are high-impact when it comes to creating sustainable change for entire communities.with a wide range of solutions for the wide range of challenges, we must focus more on the important part of the story that creates enthusiasm, momentum and that helps to create positive change.
intermediate	the duchess of cambridge gave birth to a son on monday, 22 july. the baby is third in line to the british throne.kensington palace announced at 8.30pm that the baby was born at 4.24pm in the exclusive lindo wing at st mary’s hospital, paddington, west london. “we could not be happier,” the duke of cambridge said.in a statement, kensington palace said: “her royal highness the duchess of cambridge was safely delivered of a son at 4.24pm. the baby weighs 8lbs 6oz. the duke of cambridge was present for the birth.”the queen, the duke of edinburgh, the prince of wales, the duchess of cornwall, prince harry and members of both families were informed and were delighted with the news that her royal highness and her child were both doing well.it is understood that the couple delayed making the announcement immediately so that they could enjoy some private time with their newborn. william telephoned his family to tell them the good news, speaking to the queen, his father charles and younger brother prince harry.the birth of the baby prince means the monarchy has three generations of heirs to the throne for the first time since 1894the baby is the first prince of cambridge to be born for more than 190 years since prince george of cambridge, a grandson of george iii and the only son of prince adolphus frederick, the 1st duke of cambridge.in a statement, prince charles said: “both my wife and i are overjoyed at the arrival of my first grandchild. it is an incredibly special moment for william and catherine and we are so thrilled for them on the birth of their baby boy.“grandparenthood is a unique moment in anyone’s life, as countless kind people have told me in recent months, so i am enormously proud and happy to be a grandfather for the first time and we are eagerly looking forward to seeing the baby in the near future.”the newest royal will be called hrh prince george* of cambridge.following tradition, a formal notice was posted on an easel – the same used to announce prince william’s birth in 1982 – in the forecourt of buckingham palace shortly before 9pm. within an hour, the numbers had swelled from hundreds to thousands outside the palace, with locals and tourists wanting to share in the historic moment.new yorker, sharon surloff, was delighted with her phone picture of the royal bulletin. she, her niece and her mother had squeezed through crowds to take a photograph of the easel.“the police were just saying to everyone: ‘ok, 20 seconds and then the next person’. it’s just great to be here, though. we arrived this morning, at nine in the morning, so it has all worked out beautifully.”the palace announced the birth in a press release. minutes later, as crowds of wellwishers outside cheered, “it’s a boy”, the formal medical bulletin was taken from the hospital to buckingham palace under police escort.the prime minister was one of the first to offer his congratulations. speaking outside 10 downing street, david cameron said: “it is wonderful news from st mary’s, paddington, and i am sure that, right across the country, and, indeed, right across the commonwealth, people will be celebrating and wishing the royal couple well.“it is an important moment in the life of our nation but, above all, it is a wonderful moment for a warm and loving couple who have got a brand new baby boy. it has been a remarkable few years for our royal family: a royal wedding that captured people’s hearts, that extraordinary and magnificent jubilee and now this royal birth – all from a family that has given this nation so much incredible service.”congratulations came from the white house, too, from barack obama and his wife. the president said: “michelle and i are so pleased to congratulate the duke and duchess of cambridge on the joyous occasion of the birth of their first child. we wish them all the happiness and blessings parenthood brings.”the archbishop of canterbury, the most rev justin welby, tweeted: “delighted for the duke and duchess of cambridge. may god bless them all with love, health and happiness,” he said.the labour leader, ed miliband, said: “many congratulations to the duke and duchess of cambridge. i wish them and their son all happiness and good health.”nan
elementary	how long can you hold your breath? iõm trying it right now. the  rst 30 seconds are easy. i want to give up at 45 seconds but i continue and it gets easier for a while. but, as i go past one minute, my heart is pounding. i breathe out a tiny bit and this helps. one minute and 12 seconds. iõm quite impressed with myself.in some sports, it is very important to be able to hold your breath, particularly in freediving. in 2006, i met sam amps, who was captain of the uk freedive team. at a swimming pool in bristol, she taught me some simple ways to help me hold my breath for longer while swimming underwater. by the end of the session, i could hold my breath for 90 seconds, long enough to let me swim across the pool. sam swam across the pool three times easily. she could hold her breath for  ve minutes, while swimming. five minutes!i asked how she did it: very slow breathing for several minutes before each dive, then a big, deep breath before diving in.our heart rate doesnõt slow down when we hold our breath. at least, it doesnõt if youõre doing it on land. when youõre under cold water, the heart rate slows down in most people. this change in our bodies is useful in diving ð but it is even more useful for not drowning. holding our breath is becoming very useful in one particular area of medicine. radiotherapy for breast cancer involves pointing radiation exactly at the tumour. itõs usually done in short periods, between breaths. but, if the patient can hold their breath for several minutes, it means that doctors can give the complete radiation dose, in the right place, all at the same time. the problem, of course, is that most people cannot hold their breath for several minutes. but doctors at university hospital birmingham have shown that, if patients are given air with extra oxygen before holding their breath, they can hold it for  ve-and-a-half minutes.surprisingly, to achieve this you have to fool the diaphragm. when you breathe in, youõre pulling the muscle of your diaphragm  at so that the volume of your chest increases ð this pulls the air into your lungs. when you hold your breath, you keep your diaphragm like that. if you breathe extra oxygen before a breath-hold, as in the birmingham radiotherapy experiments, you may be able to stop the diaphragm from becoming tired too quickly. so, itõs your diaphragm, the main muscle of breathing, that is in charge when you are holding your breath. but, in the end, even if youõve fooled it for a while, the signals from the diaphragm become too strong and you have to give up ð and take a breath.nan
elementary	japanese entrepreneur takahito iguchi thinks google glasses are not cool. he may be right. there’s already a website with pictures of people wearing them – the people look ridiculous or smug or, more often, both. if you search google images for google glasses, one of the first pictures is of a large, naked man wearing them in the shower. iguchi hopes that this is google’s weak point. he has designed some glasses that are a bit more stylish and a bit more japanese.iguchi’s glasses aren’t really glasses – they are a piece of metal with a camera and a very small projector. the glasses are called telepathy one. since he first presented them to the public in texas, they have attracted $5 million from investors. like glass, you will be able to buy telepathy one in 2014.it’s a more simple version of google glass. glass has many uses – you can surf the internet, read emails, take photographs – but telepathy will be “more of a communication machine”. connected to your phone, it will allow real-time visual and audio sharing. you’ll be able to post photos and videos of what you see on facebook or send them as an email. or see and speak to a video image of a friend.“it will help bring you close to your friends and family. we are very focused on the communication and sharing possibilities,” says iguchi, who has worked in the japanese technology industry for 20 years. “i’m a visionary,” he says. “i have a dream that people will understand other people. when i go to london, i am a stranger. but i believe that everyone wants people to understand them and to understand other people. and, with the glasses, you can know more information about people before you even speak to them.”when iguchi was growing up, japanese technology ruled the world: they had the sony walkman, which was as popular as the iphone. now, to compete, he has had to leave tokyo and go to silicon valley. “tokyo is very rich in fashion and culture, but it’s still an island. it’s isolated. there is no way to expand. but, in silicon valley, everyone is from everywhere. it’s where you come to connect with the world.” they will make the glasses in japan and the software in the us.it was easy to build the prototype of telepathy one, iguchi says. “we have every sort of technology in tokyo. the problem is presenting it to the world.” the top manufacturers all want to work with him, he says, because they have the technology, they just find it difficult to sell it. “there needs to be a story to the product. apple had a story with the ipod – 1,000 songs in your pocket. and steve jobs was inspired by akio morita, the co-founder of sony, and he inspired me, so maybe it will come in a circle.”like steve jobs, iguchi is a confident man, but his strong japanese accent makes it difficult to understand him. it is possible that this fact helped him to find the idea for telepathy one. when he visited london, he stayed with someone he didn’t know. “he was not my friend, but i talked with him for three hours, and now he is my friend. that is how long it takes to understand each other, to share our feelings, and background, and career. maybe telepathy makes that quicker. if you are getting information from the cloud and social networks, that will happen more easily.”iguchi hopes that telepathy one will help people see other people’s point of view. as a student, he explains, he studied philosophy during the day and taught himself how to code at night. “and, one day, i opened the door of my apartment and i suddenly realized that everything is code. everything is coded and can be shared between humans. and everything can be encoded and decoded. and, if code can be exchanged between humans, that will end all war.”nannan
elementary	the manchester united manager, sir alex ferguson, will retire at the end of the season after 27 years. he will become a director of the club. he is the most successful manager in british football. he has won 13 premier league titles, two champions leagues, the cup winners’ cup, five fa cups and four league cups.“the decision to retire is one that i have thought a lot about,” ferguson said. “it is the right time. it was important to me to leave an organization in the strongest possible condition and i believe i have done so.” he said that he thinks the quality of the team will bring continued success at the highest level. they also have lots of good young players, so ferguson thinks the club has a very good future.“our training facilities are some of the best in world sport,” he added. “our stadium, old trafford, is one of the most important venues in the world. i am delighted to become both director and ambassador for the club. i am looking forward to the future.” he also thanked his family for their love and support.“i would like to thank all my players and staff, past and present, for an incredible level of professionalism and hard work that has helped to bring so many memorable triumphs. without them, the history of this great club would not be as rich. in my early years, the support of the board of directors gave me the confidence and time to build a football club, not just a football team.“over the past ten years, the owners of the club have made it possible for me to manage manchester united to the best of my ability. i have been very lucky to work with david gill, a talented and trustworthy chief executive. i am grateful to all of them.” he also thanked the fans for their support and said he had really enjoyed his time as manager of manchester united.joel glazer, one of the owners of manchester united, said: “alex has shown us so often what a fantastic manager he is, but he’s also a wonderful person. his determination to succeed and his hard work for the club have been remarkable. i will never forget the wonderful memories he has given us, like that magical night in moscow.”avie glazer, his brother, said: “i am very happy to tell you that alex has agreed to stay with the club as a director. his contributions to manchester united over the last 27 years have been extraordinary and, like all united fans, i want him to be a part of its future.”david gill added: “i’ve had the great pleasure of working very closely with alex for 16 unforgettable years. we knew that his retirement would come one day and we both have been planning for it. alex’s vision, energy and ability have built teams that are some of the best and most loyal in world sport. the way he cares for this club, his staff and for the football family in general is something that i admire. we will never forget what he has done for this club and for the game in general. working with alex has been the greatest experience of my working life and it is a great honour to be able to call him a friend.”first-team coach rené meulensteen told everyone how ferguson told his staff the news. “i found out this morning when i came to the club,” he said. “he asked us to go into his office and told us his decision. i’m sure he thought hard about it. i wish him well for the future. he’s been fantastic for this club and i hope all the fans give the new manager the same support.”nannannan
