advanced	he had the tastes of a typical millionaire. he owned a gold and silver rolex and a fleet of expensive cars. he liked to dabble in modern art. but, although this chinese businessman had several companies and a palatial villa in the madrid suburbs, he had almost no money in the bank, a detail that piqued the interest of spanish authorities.gao ping, who had lived most of his adult life in spain, had a monopoly on supplies to 4,000 chinese bazaars across the mediterranean country. but, authorities suspected he was not paying taxes on the clothes, furniture and other goods he was importing from china.when police swooped on his warehouses in 2012 they found piles of cash: wads of €100, €200 and €500 notes were wrapped in elastic bands. around €12m was wheeled away in trolleys, the largest ever cash seizure by spanish police. the gang, with gao the alleged ringleader, stands accused of laundering up to €300m a year, as well as selling counterfeit goods and toys with fake safety marks. the government prosecutor said gao’s illegal business was so big it was damaging the competitiveness of spain. gao is on bail; the case has not yet come to trial.law enforcement officials have long had concerns about €500 notes. small and easy to transport relative to their value, they are the payment method of choice for tax dodgers, money launderers and drug barons. the sum of €1m in €500 notes fits easily into a small laptop bag, where the same amount in €50 notes would require a small suitcase. cash mules have been known to fold the notes into plastic pellets and swallow them. a less dangerous method of concealment is to stuff the banknotes into a car chassis.the uk stopped distribution of the €500 note in 2010 on the grounds that demand for it was “almost entirely for criminal purposes”. in 2009, italy’s central bank warned that the notes were widely used by mafia money launderers and terrorists. other countries have limited their own highdenomination notes due to links to organized crime – canada scrapped its $1,000 note in 2000 on the advice of law enforcement officers.in an age of electronic payment systems and contactless cards, more are questioning whether printing these notes can be justified. peter sands, the former head of standard chartered bank, has called for the abolition of high-denomination notes, including the €500, the $100, the 1,000 swiss franc note and the £50. in a report for the harvard kennedy school of government, sands argued it was time to get rid of high-value notes that make life easier for “bad guys” pursuing tax evasion, financial crime, terrorist finance and corruption. although criminals would switch to smallerdenomination bills, or gold or diamonds, these substitutes are bulkier and more traceable, making it more likely they will get caught, he said.at a conference on terrorist financing in london, the head of europol, rob wainwright, called on the european central bank (ecb) to look at whether it “should continue to produce and circulate these notes that make it easier for criminals and terrorists to hide their business and to fund illegal activities”. according to europol, the purple €500 note accounts for 30% of the value of all the euro notes in circulation, although most people have never seen one.the €500 note was introduced in 2002 when the euro was born: it replaced the 1,000 deutschmark, the 10,000 belgian franc and the 500,000 italian lira. several european countries favoured highvalue banknotes. “it is definitely a preference that has been there for a long time,” says pia hüttl, an affiliate fellow at the bruegel thinktank. “the preference is based on the idea that cash has a lower cost and is accepted everywhere.”cash remains king in germany and austria, where more than half of all transactions are made with paper money and coins. the former president of germany’s constitutional court, hans-jürgen papier, told germany’s frankfurter allgemeine zeitung that restrictions on cash were at odds with individual freedom, while tabloid newspaper bild has launched a petition in defence of paper money, including the €500 note – “hands off my cash”.law enforcement authorities are less convinced, amid a steady stream of reports of suspicious bundles of cash. in one case that has caught the attention of police, two men walked into a bank and tried to deposit €200,000 of torn and muddy €500 notes. in the same week, €1.3m in €500 notes was found stuffed in the false bottom of suitcase. but, a suspicion of criminality is not enough to keep people in custody. “our frustration from a law enforcement perspective is that, in many jurisdictions, it is impossible to provide sufficient evidence to satisfy judicial authorities of a link between suspicious cash detections and criminality,” says jennifer macleod, a specialist in europol’s financial intelligence group. “the search for these links is complicated further through time constraints and fragmented cooperation and information exchange.”the agency would like to see central banks take more responsibility for the “striking anomalies” in the use of €500 notes. luxembourg, for example, issued more than twice its annual gdp in banknotes in 2013 alone, despite being one of the most cash-averse countries in europe. europol asked luxembourg’s central bank to explain. “the reply we had from luxembourg is that they simply issue the notes requested and have no explanation for the reasons behind the demand,” macleod says. “i find it surprising that a central bank does not consider itself to have a responsibility in this area.”this could be changing. mario draghi, the head of the ecb, has said he is determined that the income the bank generates from issuing the notes should not be “a comfort for criminals”. other members of the ecb’s top team, such as yves mersch, contend there is no evidence about the criminal uses of the €500 note. but, amid heightened fears about terrorism, this argument may no longer cut any ice. eu finance ministers have called on policymakers to explore “appropriate restrictions” on high-value notes and report back by 1 may 2016.
advanced	prince harry has flown out of afghanistan at the end of a four-month tour, during which he admitted killing insurgents while piloting his apache helicopter and spoke in rare depth about the tensions and frustrations of being a royal who craved life out of the spotlight.he also revealed his disdain for and distrust of some sections of the media and described how his father constantly reminded him to behave more like a member of the royal family.a commander of the army’s most sophisticated attack helicopter, the prince said he had fired on the taliban during operations to support ground troops and rescue injured afghan and nato personnel. his remarks may be seized upon by insurgents to stir anti-british sentiment, but the prince said he was only doing his job. most of the time the helicopter acted more as a deterrent, he said.in a series of interviews during his time based at camp bastion in helmand province, he hinted at the difficulty of reconciling the different roles in his life. the prince, known as captain wales in the army, explained his ‘three mes’. “one in the army, one socially in my own private time and then one with the family and stuff like that. so there is a switch and i flick it when necessary.”he admitted he sometimes ‘let himself down’ with his laddish behaviour, which he put down to “probably being too much army and not enough prince”, but he said he was entitled to privacy, too.in another unusually frank exchange, he aimed biting criticism at the media, especially the sun, the daily mail and the daily telegraph, three of the royal family’s most ardent supporters in fleet street. he said he was particularly annoyed by articles comparing his role as an apache co-pilot gunner to spitfire crews waiting to scramble during the second world war. “no, it’s not like that at all,” he said.the prince said his suspicion of the media was rooted in the treatment of his family when “i was very small”, but that he couldn’t help monitoring the stories written about him. “of course i read them,” the prince said. “if there’s a story and something’s been written about me, i want to know what’s being said. but all it does is just upset me and anger me that people can get away with writing the stuff they do; not just about me, but about everything and everybody. my father always says, ‘don’t read it’. everyone says, ‘don’t read it, because it’s always rubbish’.”the prince was posted to afghanistan last september to command a £45m apache helicopter – one of the military’s most sophisticated and well-armed aircraft. during his tour, the apaches flew missions supporting nato troops fighting the taliban and accompanied british chinook and us black hawk medical helicopters during casualty evacuations.four years ago, the prince had to be spirited out of afghanistan during his first tour after a media embargo was broken by mistake by an australian magazine. this time, the ministry of defence chose to publicize his deployment on the understanding that newspapers and broadcasters would not give a running commentary on his life out there to allow him to get on with his job. two-man crews from the bbc, sky and itn were sent once each to report on his visit, while a photographer and a reporter from the press association were embedded on all three visits.asked whether he felt more comfortable being captain wales than prince harry, his reply was one of the most revealing he has given about his relationship with prince charles. “definitely. i’ve always been like that. my father’s always trying to remind me about who i am and stuff like that. but it’s very easy to forget about who i am when i am in the army. everyone’s wearing the same uniform and doing the same kind of thing. i get on well with the lads and i enjoy my job. it really is as simple as that.”shortly before he went to afghanistan, the prince was caught in another media furore, when pictures emerged of him frolicking naked in las vegas during a private party. harry said he had let himself down, but also blamed the media. “i probably let myself down, i let my family down, i let other people down. but, at the end of the day, i was in a private area and there should be a certain amount of privacy that one should expect. it was probably a classic example of me probably being too much army, and not enough prince. it’s a simple case of that.“the papers knew that i was going out to afghanistan anyway, so the way i was treated from them i don’t think is acceptable.” he added, “certain people remind me, ‘remember who you are, so don’t always drop your guard’.”asked where he and his brother’s fascination with helicopters came from, he said, “probably the fact that you can only fit a certain amount of people in a helicopter, therefore no one can follow us, like you guys.”
advanced	scarlett johansson is suing a french novelist for û50,000 in damages, alleging that his work of  ction makes fraudulent claims about her personal life.la premiere chose quon regarde (the first thing we look at) by gregoire delacourt tells the story of a french model who looks so similar to the american actor that the books lead male character thinks it is johansson herself. in the novel, the models looks mean that men see her only as a sex object, while women are jealous of her. she has a series of adventures as johansson until she is eventually found out and, in the end, dies in a car crash.johansson herself is not  attered by the best- selling literary work. her lawyer, vincent toledano, told le figaro that delacourtõs novel constituted a òviolation and fraudulent and illegal exploitation of her name, her reputation and her image.ó he said the novel contains òdefamatory claims about her private lifeó and has now gone to court to try to stop the book being translated or adapted for cinema. the court case began in paris on wednesday afternoon, though neither johansson nor delacourt was present.òthe freedom of expression that she defends as an artist is not in question,ó toledano said. òsuch activities for purely mercantile ends have nothing to do with creativity.ódelacourt has tried explaining that he chose to reference johansson because she is òthe archetype of beauty today.ó he said: òi wrote a work of  ction. my character is not scarlett johansson.óthe author recently hit out against the actor on french radio, saying the legal action was òrather sadó. he said: òit freaks me out to think that, when you talk of a character in a novel, judges can get involved.ódelacourt has become one of franceõs best-loved authors; his previous novel, my list of desires, was translated into 47 languages and is now being adapted into a  lm. but he said he was òspeechlessó when he found out johansson was suing him.òi thought sheõd get in contact to ask me to go for a coffee with her. i didnõt write a novel about a celebrity,ó he said. òi wrote a real love story and a homage to feminine beauty, especially interior beauty.òif an author can no longer mention the things that surround us ð a brand of beer, a monument, an actor ð itõs going to be complicated to produce  ction.òitõsstupefying,especiallyasiõmnotsuresheõseven read the novel, since it hasnõt been translated yet.óemmanuelleallibert,spokeswomanforpublisher jc latte_s, said taking legal action was òcrazyó. òwe have never known anything like it. it is all the more surprising for the fact that the novel is not even about scarlett johansson. it is about a woman who is scarlett johanssonõs double.ódelacourtslawyer,anneveil,whoisalso representing publisher jc latteironically, the authorõs legal situation would be far easier had he published the book in johanssonõs home country, rather than france. lloyd jassin, a new york intellectual property lawyer, told time that the case would be unlikely to be considered in the united states because the book would be protected by the first amendment.òthe first amendment doesnõt look at most books as commercial uses or commercial propositions,ó he said. òif her name or likeness is relevant, literarily, if thereõs signi cance and literary merit to using her name between the covers, the first amendment steps in.ó however, in france, the legal position is more complicated and personality rights are taken òmuch more seriously,ó jassin says.òi thought she might send me  owers as it was a declaration of love for her, but she didnõt understand,ó delacourt said. òitõs a strange paradox ð but a very american one.ó
advanced	when larry pizzi, a veteran bicycle industry executive, first heard about electric bikes nearly 20 years ago, he asked: “why would anyone want to screw up a bike by putting a motor and batteries on it?”it’s a question that still puzzles traditionalists. bicycle shops have been slow to stock e-bikes, even though they have been around since the late 1990s. sales in the us have been modest.pizzi, who is now ceo of currie technologies, the number one seller of e-bikes in the us, believes that’s about to change. others in the industry agree. familiar brands including trek, raleigh and specialized all offer electric models and they’re betting the market is about to take off.“we’re on the cusp of mainstream adoption,” pizzi said. “there are more players entering the category, it seems, with every passing month.”the us is an outlier when it comes to electric bikes. nearly 32m e-bikes were sold in 2014, the vast majority in china, where they are primarily used for transportation. they are popular in much of europe, too. they’re common in the netherlands and switzerland; german postal workers use them to get around and bmw offers one for about $3,000.electric bikes are different from motorcycles or mopeds, which rely on motorized power; they are bicycles that can be pedalled with – or without – assistance from an electric motor. riding an e-bike feels like riding a conventional bike with a brisk tailwind; the motor helps you go faster or climb hills but it’s typically not the primary source of propulsion. unlike mopeds, e-bicycles are usually permitted on bike paths and they can’t travel faster than 20mph.there’s debate about how many electric bikes are sold in the us and there is no official count. estimates of annual sales range from about 50,000 to 175,000. that’s comparable to the number of electric cars sold in the us – 118,000 in 2014. yet, while many people are aware of the nissan leaf, chevy volt and tesla, few have heard of e-bike companies currie, pedego or electrobike.to succeed, the electric bike business in the us must clear legal, cultural and financial hurdles. e-bikes are banned in some states, including new york, although the law isn’t strictly enforced. traditionalists who own and staff bike shops don’t like putting motors on bicycles, citing, among other things, the added weight. some e-bikes are close to 30kg.e-bikes are also pricey. while low-end models sell for as little as $700, court rye, the founder and editor of electricbikereview.com, a popular website, says riders should expect to pay at least $1,500 for a quality e-bike with a good battery. top-of-the-line models cost more than twice that.the companies that make and sell e-bikes say they can overcome those obstacles. e-bike technology, particularly the batteries, is improving. “batteries are getting smaller, they’re getting lighter, they’re getting more reliable and they are lasting longer,” says don dicostanza, the founder and ceo of pedego, an electric bikemaker and retailer.companies like bosch, the german electronics giant, and shimano, the leading manufacturer of bicycle gears, are entering the business, which should help erode resistance from bike shops. “this has really caught the attention and the imagination of bicycle dealers,” says currie’s larry pizzi. pedego and startup electrobike aren’t waiting for the shops to come around; they are building their own stores. in the meantime, lobbying efforts are underway to permit the use of e-bikes everywhere.perhaps most importantly, as more cities build cycling infrastructure, including dedicated bike lanes, bicycle commuting has become more popular. as the us census bureau reported in 2014, the number of bike commuters grew from about 488,000 in 2000 to 786,000 in 2012. that’s a “larger percentage increase than that of any other commuting mode,” the report notes. electric bikes make commuting more practical – and fun – by easing worry about hills, headwinds, fatigue and sweat.most of our customers are “ageing baby boomers who want to rekindle the experience they had as a kid,” says pedego’s don dicostanza. “the main reason they stopped riding bikes was because of hills.” pedego has opened nearly 60 stores in the us and it has sold bikes to tour companies in san francisco and washington, dc.electrobike, which operates 30 stores in mexico, opened its first american store in venice beach, california in the autumn of 2014 and hopes to grow to 25 us stores in a year. ceo craig anderson says: “we want to help reduce traffic, help reduce our carbon footprint and promote a healthy lifestyle.” he tells customers: “ride this once and try not to smile.”startups like pedego and electrobike will have to compete with big companies like trek and currie, which, in 2012, was acquired by the accell group, a public company based in the netherlands that is europe’s market leader in e-bikes. accell owns the raleigh brand, as well as haibike, an award-winning german electric bike.“accell has great expectations about e-bikes in north america,” currie’s larry pizzi says. “while baby boomers are still a very important segment, we’re finding that a lot of younger people are using e-bikes for transportation, instead of cars.”accell’s yuba brand even sells a cargo bike with a stronger motor and rear rack. “you can carry two children,” says pizzi. “you can carry 45kg of shopping. it’s a minivan alternative.”
advanced	opposition to western australiaõs shark cull has intensi ed as thousands of people took to beaches across the continent to call on the stateõs premier to end the policy, and rspca australia and virgin atlantic owner richard branson spoke out against it. the controversial catching and killing of sharks longer than three metres began after what the state government called an òunprecedentedó number of shark attacks on western australiaõs coast, which saw a 35-year-old surfer killed in november 2013. he was the sixth person to die from a shark attack in two years.however, according to the shark attack file, australia as a whole has averaged one shark- related fatality a year for the last 50 years. kate faehrmann, a board member at the sea shepherd conservation society, said from a protest in perth: òweõve been saying all along that this policy wonõt work. drumlines, used to catch the sharks, are indiscriminate killers. theyõll kill sharks whether theyõre one, two, three metres or more, as well as dolphins, turtles and other things. thatõs why the community doesnõt want it.óthousands of people protested on perthõs cottesloe beach and sydneyõs manly beach, as well as hundreds at glenelg, in south- west adelaide, and at beaches in victoria and queensland. faehrmann said the protests had shown australians wanted sharks protected: òwhatõs amazing is so many people in australia love sharks. this has demonstrated something about the national psyche, that, despite jaws, despite all the fear, people are coming out in their thousands across the country to say, ôthatõs their ocean. we respect them, we love them and we donõt want them killed.õó anthony joyce, a surfer who once had his foot caught in a sharkõs mouth, said: òthe number of sharks they are going to kill is going to make no difference in the scheme of things.óthe state government has refused to provide a running tally of sharks killed, though there have been reports of sharks smaller than three metres being released after getting caught on drumlines,  oating drums anchored to the sea bed with bait hanging on hooks beneath them. conservationists argue there is no evidence the cull will reduce the number of shark attacks on humans, as no previous cull has solely used drumlines. researchers at the university of western australia say the recent spate of shark attacks in the state may have more to do with the state having the fastest-growing population in australia, rather than a rising number of sharks.richard peirce, chairman of the uk-based conservation charity, the shark trust, said that the cull would be ineffective and potentially lure more predators towards the coast. òthe activity in western australia is compounding the human tragedy of shark attacks. it is very sad that a government that could be seen to take positive initiatives with regards to sharkð human interactions by trialling alternatives to indiscriminate killing has ignored the best advice and opted for an approach that is ineffective and counterproductive,ó he said. òthe indiscriminate nature of drumlines is often overlooked ð even if monitored through the day, leaving the lines in overnight has the potential to attract other predators into the area, attracted by those sharks and other species hooked and injured.óglobally, in 2012, there were 80 unprovoked attacks by sharks, seven of which proved fatal, compared to nearly 100m sharks killed by humans each year. rspca australia released a statement saying it believes the cull is unjusti ed. òthere is no evidence that the increase in attacks is a result of increasing shark numbers. rather, it is consistent with a changing population and human behaviour; that is, there are greater numbers of people in the water,ó it said.richard branson told fairfax radio the policy was back ring. òiõm sure one of the reasons western australia premier, colin barnett, did it was because he was thinking it would encourage tourism. itõs going to do quite the reverse, i think. youõre advertising a problem that doesnõt exist in a major way and youõre deterring people from wanting to come to perth and your beautiful countryside around it. all youõre going to achieve, i think, is to worry people unnecessarily.ó
